"0750775K";"Lycée professionnel Gustave Ferrié";"ILE-DE-FRANCE";"ensemble";50;25;31;-6;28
"0750776L";"Lycée professionnel Marie Laurencin - Lycée des métiers de la mode";"ILE-DE-FRANCE";"ensemble";55;26;27;-1;29
"0750778N";"Lycée Professionnel Turquetil - Lycée des métiers de la mode";"ILE-DE-FRANCE";"ensemble";59;43;33;10;43
"0750783U";"Lycée professionnel Chennevière Malezieux";"ILE-DE-FRANCE";"ensemble";54;44;48;-4;48
"0750783U";"Lycée professionnel Chennevière Malezieux";"ILE-DE-FRANCE";"dont élèves en voie pro sco";57;39;43;-4;43
"0750783U";"Lycée professionnel Chennevière Malezieux";"ILE-DE-FRANCE";"dont apprentis";33;66;70;-5;69
"0750784V";"Lycée professionnel Métiers de l'Ameublement";"ILE-DE-FRANCE";"ensemble";70;29;32;-3;33
"0750785W";"Lycée professionnel Galilée";"ILE-DE-FRANCE";"ensemble";56;32;36;-5;36
"0750785W";"Lycée professionnel Galilée";"ILE-DE-FRANCE";"dont élèves en voie pro sco";56;31;36;-5;35
"0750785W";"Lycée professionnel Galilée";"ILE-DE-FRANCE";"dont apprentis";;;;;
"0750787Y";"Lycée professionnel Corvisart-Arts Graphiques";"ILE-DE-FRANCE";"ensemble";62;27;33;-6;29
"0750788Z";"Lycée professionnel Marcel Deprez - Lycée des métiers de l'électrotechnique";"ILE-DE-FRANCE";"ensemble";69;30;31;-1;37
"0750793E";"Lycée Professionnel Beaugrenelle - Lycée des métiers de la communication et de la gestion d'entreprise";"ILE-DE-FRANCE";"ensemble";50;39;40;-2;30
"0750793E";"Lycée Professionnel Beaugrenelle - Lycée des métiers de la communication et de la gestion d'entreprise";"ILE-DE-FRANCE";"dont élèves en voie pro sco";58;37;29;8;36
"0750793E";"Lycée Professionnel Beaugrenelle - Lycée des métiers de la communication et de la gestion d'entreprise";"ILE-DE-FRANCE";"dont apprentis";0;42;54;-12;16
"0750794F";"Lycée professionnel Brassai - Lycée des métiers de la photographie et de l'image";"ILE-DE-FRANCE";"ensemble";57;;;;
"0750796H";"Lycée Professionnel Octave Feuilet - Lycée des métiers de la mode";"ILE-DE-FRANCE";"ensemble";61;36;29;6;31
"0750796H";"Lycée Professionnel Octave Feuilet - Lycée des métiers de la mode";"ILE-DE-FRANCE";"dont élèves en voie pro sco";63;34;26;8;29
"0750796H";"Lycée Professionnel Octave Feuilet - Lycée des métiers de la mode";"ILE-DE-FRANCE";"dont apprentis";;;;;
"0750800M";"Lycée professionnel Edmond Rostand";"ILE-DE-FRANCE";"ensemble";46;23;25;-2;23
"0750800M";"Lycée professionnel Edmond Rostand";"ILE-DE-FRANCE";"dont élèves en voie pro sco";54;31;26;4;29
"0750800M";"Lycée professionnel Edmond Rostand";"ILE-DE-FRANCE";"dont apprentis";0;4;16;-12;9
"0750802P";"Lycée professionnel Hector Guimard - Lycée des métiers du batiment, de l'artisanat et du patrimoine bâti";"ILE-DE-FRANCE";"ensemble";66;47;40;8;49
"0750802P";"Lycée professionnel Hector Guimard - Lycée des métiers du batiment, de l'artisanat et du patrimoine bâti";"ILE-DE-FRANCE";"dont élèves en voie pro sco";69;42;37;5;46
"0750802P";"Lycée professionnel Hector Guimard - Lycée des métiers du batiment, de l'artisanat et du patrimoine bâti";"ILE-DE-FRANCE";"dont apprentis";24;;;;
"0750808W";"Lycée professionnel Etienne Dolet";"ILE-DE-FRANCE";"ensemble";55;42;30;12;48
"0750828T";"Etablissement régional d'enseignement adapté Edith Piaf";"ILE-DE-FRANCE";"ensemble";79;23;27;-4;18
"0751708Z";"Lycée polyvalent Louis Armand";"ILE-DE-FRANCE";"ensemble";43;38;42;-4;43
"0751710B";"Lycée Professionnel N.L Vauquelin - Lycée des métiers des procédés chimiques, des biotechnologies et de l'eau";"ILE-DE-FRANCE";"ensemble";54;36;44;-8;41
"0751710B";"Lycée Professionnel N.L Vauquelin - Lycée des métiers des procédés chimiques, des biotechnologies et de l'eau";"ILE-DE-FRANCE";"dont élèves en voie pro sco";59;34;37;-3;37
"0751710B";"Lycée Professionnel N.L Vauquelin - Lycée des métiers des procédés chimiques, des biotechnologies et de l'eau";"ILE-DE-FRANCE";"dont apprentis";35;42;54;-12;50
"0751883P";"Lycée technologique privé Institut clorivière";"ILE-DE-FRANCE";"ensemble";36;44;46;-2;52
"0752109K";"Lycée professionnel Suzanne Valadon";"ILE-DE-FRANCE";"ensemble";44;28;29;-1;35
"0752388N";"Lycée professionnel Pierre Lescot";"ILE-DE-FRANCE";"ensemble";41;34;33;1;39
"0752388N";"Lycée professionnel Pierre Lescot";"ILE-DE-FRANCE";"dont élèves en voie pro sco";42;34;32;2;39
"0752388N";"Lycée professionnel Pierre Lescot";"ILE-DE-FRANCE";"dont apprentis";;;;;
"0752608C";"Lycée professionnel Belliard - Lycée des métiers de l'hôtellerie et de la restauration";"ILE-DE-FRANCE";"ensemble";47;30;32;-2;39
"0752700C";"Lycée professionnel Armand Carrel";"ILE-DE-FRANCE";"ensemble";50;24;25;-1;22
"0752701D";"Lycée polyvalent François Truffaut";"ILE-DE-FRANCE";"ensemble";49;46;34;12;22
"0752799K";"Etablissement régional d'enseignement adapté Crocé Spinelli";"ILE-DE-FRANCE";"ensemble";57;26;19;7;32
"0752845K";"Lycée professionnel Théophile Gautier";"ILE-DE-FRANCE";"ensemble";46;32;31;1;33
"0752845K";"Lycée professionnel Théophile Gautier";"ILE-DE-FRANCE";"dont élèves en voie pro sco";46;33;31;2;33
"0752845K";"Lycée professionnel Théophile Gautier";"ILE-DE-FRANCE";"dont apprentis";;;;;
"0752846L";"Lycée Professionnel Erik Satie";"ILE-DE-FRANCE";"ensemble";49;45;39;6;45
"0752846L";"Lycée Professionnel Erik Satie";"ILE-DE-FRANCE";"dont élèves en voie pro sco";54;42;34;9;42
"0752846L";"Lycée Professionnel Erik Satie";"ILE-DE-FRANCE";"dont apprentis";23;55;56;-1;55
"0752961L";"Lycée professionnel Gustave Eiffel";"ILE-DE-FRANCE";"ensemble";50;32;28;4;39
"0753217P";"Lycée polyvalent privé Sainte Thérèse";"ILE-DE-FRANCE";"ensemble";40;33;39;-6;42
"0753256G";"Etablissement régional d'enseignement adapté Alexandre Dumas";"ILE-DE-FRANCE";"ensemble";55;34;26;8;39
"0753268V";"Lycée polyvalent Jean Lurçat";"ILE-DE-FRANCE";"ensemble";46;49;51;-2;52
"0753268V";"Lycée polyvalent Jean Lurçat";"ILE-DE-FRANCE";"dont élèves en voie pro sco";44;50;50;-1;53
"0753268V";"Lycée polyvalent Jean Lurçat";"ILE-DE-FRANCE";"dont apprentis";60;41;53;-12;45
"0753350J";"Lycée professionnel Maria Deraismes";"ILE-DE-FRANCE";"ensemble";43;38;33;5;37
"0753350J";"Lycée professionnel Maria Deraismes";"ILE-DE-FRANCE";"dont élèves en voie pro sco";49;32;27;4;30
"0753350J";"Lycée professionnel Maria Deraismes";"ILE-DE-FRANCE";"dont apprentis";3;61;54;8;65
"0753537M";"Ecole Supérieure Technique de Biologie Appliquée";"ILE-DE-FRANCE";"ensemble";31;36;48;-12;45
"0753838P";"Lycée privé Saint Sulpice";"ILE-DE-FRANCE";"ensemble";;;;;
"0753844W";"Lycée général et technologique privé Sainte Geneviève";"ILE-DE-FRANCE";"ensemble";72;;;;
"0753890W";"Lycée général et technologique privé Charles Péguy";"ILE-DE-FRANCE";"ensemble";75;;;;
"0754015G";"Lycée polyvalent privé Jules Richard Microtechniques";"ILE-DE-FRANCE";"ensemble";51;57;53;4;53
"0754016H";"Lycée polyvalent privé L'Initiative";"ILE-DE-FRANCE";"ensemble";44;41;40;1;40
"0754025T";"Lycée polyvalent privé Saint-Nicolas";"ILE-DE-FRANCE";"ensemble";58;34;37;-4;35
"0754029X";"Lycée polyvalent privé Carcado Saisseval - Lycée des métiers du management du commerce, des services et soins à la personne";"ILE-DE-FRANCE";"ensemble";47;41;46;-5;50
"0754030Y";"Lycée polyvalent privé Albert de Mun";"ILE-DE-FRANCE";"ensemble";50;42;45;-3;51
"0754037F";"Lycée technologique privé Fenelon Sup La Plaine Monceau";"ILE-DE-FRANCE";"ensemble";61;62;50;12;58
"0754042L";"Lycée polyvalent privé Le Rebours - Lycée des métiers du management et des services";"ILE-DE-FRANCE";"ensemble";44;40;47;-7;53
"0754045P";"Lycée polyvalent privé Catherine Labouré";"ILE-DE-FRANCE";"ensemble";58;33;35;-3;28
"0754086J";"Lycée général et technologique privé Charles de Foucauld";"ILE-DE-FRANCE";"ensemble";45;51;48;3;62
"0754239A";"Lycée polyvalent privé Saint Jean de Montmartre - Lycée des métiers privé de la vente et du commerce";"ILE-DE-FRANCE";"ensemble";60;25;29;-4;26
"0754475G";"Lycée polyvalent Léonard de Vinci - Lycée des métiers du bois";"ILE-DE-FRANCE";"ensemble";40;46;47;-1;46
"0754475G";"Lycée polyvalent Léonard de Vinci - Lycée des métiers du bois";"ILE-DE-FRANCE";"dont élèves en voie pro sco";43;42;43;-1;43
"0754475G";"Lycée polyvalent Léonard de Vinci - Lycée des métiers du bois";"ILE-DE-FRANCE";"dont apprentis";13;69;69;1;65
"0754476H";"Lycée polyvalent Guillaume Tirel - Lycée des métiers de l' hotellerie";"ILE-DE-FRANCE";"ensemble";49;46;45;1;52
"0754476H";"Lycée polyvalent Guillaume Tirel - Lycée des métiers de l' hotellerie";"ILE-DE-FRANCE";"dont élèves en voie pro sco";49;46;44;1;52
"0754476H";"Lycée polyvalent Guillaume Tirel - Lycée des métiers de l' hotellerie";"ILE-DE-FRANCE";"dont apprentis";;;;;
"0754530S";"Lycée polyvalent Martin Nadaud";"ILE-DE-FRANCE";"ensemble";42;45;45;1;45
"0754530S";"Lycée polyvalent Martin Nadaud";"ILE-DE-FRANCE";"dont élèves en voie pro sco";45;45;40;5;46
"0754530S";"Lycée polyvalent Martin Nadaud";"ILE-DE-FRANCE";"dont apprentis";0;48;60;-12;38
"0754666P";"Lycée général et technologique privé Passy-Saint Honoré";"ILE-DE-FRANCE";"ensemble";39;37;49;-12;49
"0754924V";"Lycée Polyvalent Privé Notre-Dame - Saint Vincent de Paul - Lycée des Métiers de la Santé et du social";"ILE-DE-FRANCE";"ensemble";50;39;35;4;40
"0760005T";"Lycée général et technologique Thomas Corneille";"NORMANDIE";"ensemble";19;64;55;9;65
"0760007V";"Lycée professionnel Auguste Bartholdi";"NORMANDIE";"ensemble";46;31;26;4;39
"0760013B";"Lycée professionnel Pierre et Marie Curie";"NORMANDIE";"ensemble";46;19;27;-8;27
"0760022L";"Lycée professionnel Bernard Palissy - Lycée des métiers de l'acier, de l'aluminium et des services";"NORMANDIE";"ensemble";54;27;28;-1;36
"0760023M";"Lycée général et technologique Jehan Ango";"NORMANDIE";"ensemble";35;64;56;8;70
"0760024N";"Lycée professionnel Emulation Dieppoise";"NORMANDIE";"ensemble";44;46;45;1;58
"0760024N";"Lycée professionnel Emulation Dieppoise";"NORMANDIE";"dont élèves en voie pro sco";44;38;34;4;53
"0760024N";"Lycée professionnel Emulation Dieppoise";"NORMANDIE";"dont apprentis";45;60;65;-5;67
"0760029U";"Lycée général et technologique André Maurois";"NORMANDIE";"ensemble";39;67;55;12;72
"0760030V";"Lycée polyvalent Ferdinand Buisson - Lycée des métiers de la chimie et de l'automatisme";"NORMANDIE";"ensemble";55;41;30;11;51
"0760032X";"Lycée polyvalent Anguier - Lycée des métiers de la mise en forme des matériaux industriels et de l'éco-innovation";"NORMANDIE";"ensemble";42;41;49;-9;57
"0760035A";"Lycée général et technologique Guy de Maupassant";"NORMANDIE";"ensemble";26;55;55;0;70
"0760036B";"Lycée professionnel Descartes";"NORMANDIE";"ensemble";51;27;29;-2;34
"0760054W";"Lycée polyvalent Porte Océane";"NORMANDIE";"ensemble";52;37;43;-6;48
"0760056Y";"Lycée technologique Jules Siegfried";"NORMANDIE";"ensemble";29;56;52;4;50
"0760058A";"Lycée polyvalent Schuman-Perret- Lycée des métiers de l'habitat, des sciences et de l'industrie";"NORMANDIE";"ensemble";37;51;50;2;59
"0760062E";"Lycée professionnel Jules Le Cesne - Lycée des métiers de l'hôtellerie, de la restauration et des services";"NORMANDIE";"ensemble";41;41;39;2;46
"0760062E";"Lycée professionnel Jules Le Cesne - Lycée des métiers de l'hôtellerie, de la restauration et des services";"NORMANDIE";"dont élèves en voie pro sco";47;33;28;5;35
"0760062E";"Lycée professionnel Jules Le Cesne - Lycée des métiers de l'hôtellerie, de la restauration et des services";"NORMANDIE";"dont apprentis";33;50;50;0;58
"0760072R";"Lycée général et technologique Guillaume Le Conquérant";"NORMANDIE";"ensemble";28;58;56;2;52
"0760076V";"Lycée général et technologique Jean Prévost";"NORMANDIE";"ensemble";38;64;55;9;57
"0760082B";"Lycée professionnel Jean Rostand - Lycée des métiers  de la maintenance et  de l'hortipaysage";"NORMANDIE";"ensemble";41;32;28;3;36
"0760087G";"Lycée professionnel Colbert - Lycée des métiers de la plasturgie et de la fonderie";"NORMANDIE";"ensemble";54;22;34;-12;30
"0760088H";"Lycée professionnel Elisa Lemonnier";"NORMANDIE";"ensemble";59;34;30;4;45
"0760090K";"Lycée général Pierre Corneille";"NORMANDIE";"ensemble";36;33;41;-8;39
"0760091L";"Lycée général et technologique Jeanne d'Arc";"NORMANDIE";"ensemble";48;41;48;-7;52
"0760093N";"Lycée général Camille Saint-Saëns";"NORMANDIE";"ensemble";26;38;50;-12;42
"0760095R";"Lycée polyvalent Blaise Pascal";"NORMANDIE";"ensemble";50;53;50;4;61
"0760096S";"Lycée général et technologique Gustave Flaubert";"NORMANDIE";"ensemble";40;56;50;6;56
"0760096S";"Lycée général et technologique Gustave Flaubert";"NORMANDIE";"dont élèves en voie pro sco";40;56;49;6;57
"0760096S";"Lycée général et technologique Gustave Flaubert";"NORMANDIE";"dont apprentis";;;;;
"0760109F";"Lycée général et technologique les Bruyères";"NORMANDIE";"ensemble";35;45;50;-5;49
"0760110G";"Lycée général et technologique Marcel Sembat";"NORMANDIE";"ensemble";25;45;49;-5;50
"0760110G";"Lycée général et technologique Marcel Sembat";"NORMANDIE";"dont élèves en voie pro sco";20;41;46;-5;48
"0760110G";"Lycée général et technologique Marcel Sembat";"NORMANDIE";"dont apprentis";;;;;
"0760114L";"Lycée professionnel le Hurle-Vent";"NORMANDIE";"ensemble";33;32;39;-8;52
"0760114L";"Lycée professionnel le Hurle-Vent";"NORMANDIE";"dont élèves en voie pro sco";39;19;30;-10;46
"0760114L";"Lycée professionnel le Hurle-Vent";"NORMANDIE";"dont apprentis";20;49;53;-4;61
"0760132F";"Lycée professionnel Jules Siegfried - Lycée des métiers des sciences du numérique et de l'innovation technologique";"NORMANDIE";"ensemble";56;31;29;1;43
"0760142S";"Lycée professionnel Gustave Flaubert";"NORMANDIE";"ensemble";66;23;28;-5;24
"0760144U";"Section d'enseignement professionnel Schuman-Perret";"NORMANDIE";"ensemble";48;38;37;1;46
"0760144U";"Section d'enseignement professionnel Schuman-Perret";"NORMANDIE";"dont élèves en voie pro sco";51;25;27;-3;37
"0760144U";"Section d'enseignement professionnel Schuman-Perret";"NORMANDIE";"dont apprentis";36;74;62;12;70
"0760145V";"Lycée professionnel Val de Seine";"NORMANDIE";"ensemble";59;20;25;-4;27
"0760146W";"Lycée professionnel Marcel Sembat - Lycée des métiers  des propulsions et systèmes embarqués";"NORMANDIE";"ensemble";50;30;35;-5;41
"0760174B";"Lycée général et technologique Claude Monet";"NORMANDIE";"ensemble";32;57;48;9;57
"0761322Z";"Lycée professionnel Claude Monet";"NORMANDIE";"ensemble";63;13;23;-10;39
"0761341V";"Lycée polyvalent privé les Tourelles - Lycée des métiers de la gestion et du management";"NORMANDIE";"ensemble";30;44;50;-6;53
"0761343X";"Lycée polyvalent privé la Châtaigneraie";"NORMANDIE";"ensemble";49;48;43;5;54
"0761347B";"Lycée professionnel privé Notre-Dame";"NORMANDIE";"ensemble";62;40;34;6;48
"0761349D";"Section d'enseignement professionnel Saint Vincent de Paul";"NORMANDIE";"ensemble";34;;;;
"0761353H";"Lycée professionnel privé de la Coiffure Albert Pourrière";"NORMANDIE";"ensemble";41;53;41;12;58
"0761356L";"Lycée polyvalent privé Providence Sainte Thérèse - Lycée des métiers des services aux personnes et aux entreprises";"NORMANDIE";"ensemble";48;35;37;-2;46
"0761710W";"Lycée général et technologique privé Saint Joseph";"NORMANDIE";"ensemble";21;32;44;-12;29
"0761719F";"Lycée général et technologique privé Sacré-Coeur";"NORMANDIE";"ensemble";25;85;73;12;83
"0761721H";"Lycée général et technologique privé Jean XXIII";"NORMANDIE";"ensemble";30;62;60;2;76
"0761735Y";"Lycée polyvalent privé Jeanne d'Arc";"NORMANDIE";"ensemble";42;38;40;-2;47
"0761742F";"Lycée général et technologique Val de Seine";"NORMANDIE";"ensemble";25;39;49;-10;47
"0762081Z";"Etablissement régional d'enseignement adapté Maurice Genevoix";"NORMANDIE";"ensemble";47;9;18;-9;21
"0762169V";"Lycée général et technologique Pablo Neruda";"NORMANDIE";"ensemble";26;63;58;5;77
"0762169V";"Lycée général et technologique Pablo Neruda";"NORMANDIE";"dont élèves en voie pro sco";27;55;50;5;71
"0762169V";"Lycée général et technologique Pablo Neruda";"NORMANDIE";"dont apprentis";22;88;81;7;92
"0762211R";"Etablissement régional d'enseignement adapté Françoise Dolto";"NORMANDIE";"ensemble";28;15;15;0;15
"0762442S";"Lycée polyvalent privé Saint Joseph";"NORMANDIE";"ensemble";57;45;39;6;50
"0762600N";"Lycée polyvalent Edouard Delamare Deboutteville";"NORMANDIE";"ensemble";52;33;40;-7;48
"0762601P";"Lycée polyvalent Georges Brassens";"NORMANDIE";"ensemble";47;17;29;-12;28
"0762602R";"Lycée professionnel des 4 Cantons - Grieu - Lycée des métiers de la maintenance et de l'information numérique";"NORMANDIE";"ensemble";60;27;32;-5;40
"0762765T";"Lycée professionnel Antoine-Laurent Lavoisier - Lycée des métiers des véhicules automobiles et du transport-logistique";"NORMANDIE";"ensemble";29;40;40;0;55
"0762836V";"Lycée professionnel Fernand Léger";"NORMANDIE";"ensemble";61;29;35;-6;42
"0762879S";"Lycée général et technologique Vallée du Cailly";"NORMANDIE";"ensemble";34;49;51;-2;51
"0762880T";"Lycée polyvalent Raymond Queneau";"NORMANDIE";"ensemble";47;33;33;0;45
"0762911B";"Lycée polyvalent Galilée - Lycée des métiers de la chimie et des biotechnologies";"NORMANDIE";"ensemble";61;56;51;5;56
"0762920L";"Lycée polyvalent Pierre de Coubertin - Lycée des métiers de l'industrie";"NORMANDIE";"ensemble";50;36;34;2;48
"0762964J";"Lycée polyvalent Le Corbusier - Lycée des métiers du bâtiment, des travaux publics, de l'énergie et de la domotique";"NORMANDIE";"ensemble";42;34;38;-5;47
"0762976X";"Lycée polyvalent Françoise de Grace - Lycée des métiers des services aux personnes, aux entreprises et du commerce";"NORMANDIE";"ensemble";40;19;26;-7;28
"0763002A";"Lycée polyvalent du Golf";"NORMANDIE";"ensemble";37;31;32;-1;38
"0763079J";"Section d'enseignement professionnel du lycée des métiers du bois et de l'éco-construction";"NORMANDIE";"ensemble";51;36;34;3;57
"0763237F";"Lycée polyvalent Georges Baptiste - Lycée des métiers de l'hôtellerie, de la restauration et de la boulangerie - patisserie";"NORMANDIE";"ensemble";55;43;37;6;53
"0763409T";"Lycée général et technologique Jean-Paul II";"NORMANDIE";"ensemble";25;;;;
"0763500S";"Lycée polyvalent privé Saint Vincent de Paul - Lycée des métiers de l'image";"NORMANDIE";"ensemble";38;37;34;3;47
"0770342D";"Etablissement régional d'enseignement adapté de Chamigny Garçon";"ILE-DE-FRANCE";"ensemble";41;22;20;3;33
"0770918E";"Lycée polyvalent Uruguay France - Lycée des métiers du social et de la santé";"ILE-DE-FRANCE";"ensemble";48;41;38;3;45
"0770920G";"Lycée polyvalent La Fayette - Lycée des métiers de l'énergie, du numérique et des industries de production - Lycée des métiers du commerce";"ILE-DE-FRANCE";"ensemble";50;44;43;2;52
"0770920G";"Lycée polyvalent La Fayette - Lycée des métiers de l'énergie, du numérique et des industries de production - Lycée des métiers du commerce";"ILE-DE-FRANCE";"dont élèves en voie pro sco";50;45;43;2;52
"0770920G";"Lycée polyvalent La Fayette - Lycée des métiers de l'énergie, du numérique et des industries de production - Lycée des métiers du commerce";"ILE-DE-FRANCE";"dont apprentis";;;;;
"0770922J";"Lycée général et technologique Gaston Bachelard";"ILE-DE-FRANCE";"ensemble";33;55;50;5;58
"0770924L";"Lycée polyvalent de Coulommiers";"ILE-DE-FRANCE";"ensemble";37;51;46;5;57
"0770924L";"Lycée polyvalent de Coulommiers";"ILE-DE-FRANCE";"dont élèves en voie pro sco";39;45;37;8;53
"0770924L";"Lycée polyvalent de Coulommiers";"ILE-DE-FRANCE";"dont apprentis";32;65;66;-1;66
"0770926N";"Lycée général et technologique François Couperin";"ILE-DE-FRANCE";"ensemble";44;50;55;-5;59
"0770930T";"Lycée général et technologique Henri Moissan";"ILE-DE-FRANCE";"ensemble";51;;;;
"0770931U";"Lycée polyvalent Pierre de Coubertin";"ILE-DE-FRANCE";"ensemble";33;55;53;2;58
"0770932V";"Lycée professionnel Pierre de Coubertin";"ILE-DE-FRANCE";"ensemble";55;31;29;2;41
"0770934X";"Lycée polyvalent Léonard de Vinci - Lycée des métiers comptabilité et l'informatique - Lycée des métiers ingénierie mécanique et électrotechnique";"ILE-DE-FRANCE";"ensemble";41;43;46;-3;49
"0770934X";"Lycée polyvalent Léonard de Vinci - Lycée des métiers comptabilité et l'informatique - Lycée des métiers ingénierie mécanique et électrotechnique";"ILE-DE-FRANCE";"dont élèves en voie pro sco";42;41;44;-3;46
"0770934X";"Lycée polyvalent Léonard de Vinci - Lycée des métiers comptabilité et l'informatique - Lycée des métiers ingénierie mécanique et électrotechnique";"ILE-DE-FRANCE";"dont apprentis";21;70;74;-4;87
"0770938B";"Lycée polyvalent André Malraux - Lycée des métiers des industries et du design graphique";"ILE-DE-FRANCE";"ensemble";54;38;33;4;42
"0770938B";"Lycée polyvalent André Malraux - Lycée des métiers des industries et du design graphique";"ILE-DE-FRANCE";"dont élèves en voie pro sco";54;37;33;4;41
"0770938B";"Lycée polyvalent André Malraux - Lycée des métiers des industries et du design graphique";"ILE-DE-FRANCE";"dont apprentis";;;;;
"0770940D";"Lycée polyvalent Etienne Bezout";"ILE-DE-FRANCE";"ensemble";49;36;34;2;41
"0770942F";"Lycée polyvalent Thibaut de Champagne";"ILE-DE-FRANCE";"ensemble";50;32;35;-3;45
"0770943G";"Lycée professionnel Benjamin Franklin - Lycée des métiers du bâtiment";"ILE-DE-FRANCE";"ensemble";52;37;34;3;40
"0770943G";"Lycée professionnel Benjamin Franklin - Lycée des métiers du bâtiment";"ILE-DE-FRANCE";"dont élèves en voie pro sco";55;34;32;1;38
"0770943G";"Lycée professionnel Benjamin Franklin - Lycée des métiers du bâtiment";"ILE-DE-FRANCE";"dont apprentis";26;60;48;12;50
"0770944H";"Lycée professionnel Auguste Perdonnet";"ILE-DE-FRANCE";"ensemble";45;33;34;-1;35
"0770945J";"Lycée professionnel Gustave Eiffel - Lycée des métiers des structures métalliques et de la chaudronerie - Lycée des métiers de l'électrotechnique";"ILE-DE-FRANCE";"ensemble";54;39;46;-7;52
"0770945J";"Lycée professionnel Gustave Eiffel - Lycée des métiers des structures métalliques et de la chaudronerie - Lycée des métiers de l'électrotechnique";"ILE-DE-FRANCE";"dont élèves en voie pro sco";56;36;43;-7;49
"0770945J";"Lycée professionnel Gustave Eiffel - Lycée des métiers des structures métalliques et de la chaudronerie - Lycée des métiers de l'électrotechnique";"ILE-DE-FRANCE";"dont apprentis";;;;;
"0771027Y";"Lycée polyvalent Frédéric Joliot Curie - Lycée des métiers de la gestion des entreprises dans le cadre européen";"ILE-DE-FRANCE";"ensemble";43;32;39;-8;46
"0771171E";"Lycée professionnel Louis Lumière - Lycée des métiers de l'électricité - Lycée des métiers du commerce";"ILE-DE-FRANCE";"ensemble";58;36;34;2;40
"0771200L";"Lycée général et technologique privé Blanche de Castille";"ILE-DE-FRANCE";"ensemble";55;29;39;-9;46
"0771238C";"Ecole générale et technologique privée Saint Aspais";"ILE-DE-FRANCE";"ensemble";64;51;44;8;43
"0771336J";"Lycée polyvalent les Pannevelles - Lycée des métiers du bâtiment et des travaux publics";"ILE-DE-FRANCE";"ensemble";54;43;38;5;50
"0771336J";"Lycée polyvalent les Pannevelles - Lycée des métiers du bâtiment et des travaux publics";"ILE-DE-FRANCE";"dont élèves en voie pro sco";54;42;36;5;49
"0771336J";"Lycée polyvalent les Pannevelles - Lycée des métiers du bâtiment et des travaux publics";"ILE-DE-FRANCE";"dont apprentis";;;;;
"0771512A";"Lycée général et technologique Van Dongen";"ILE-DE-FRANCE";"ensemble";33;57;54;2;59
"0771658J";"Lycée polyvalent du Gué à Tresmes - Lycée des métiers de l'hôtellerie et restauration / des arts et design / de l'aménagement et finition du bâtiment";"ILE-DE-FRANCE";"ensemble";46;43;41;2;52
"0771658J";"Lycée polyvalent du Gué à Tresmes - Lycée des métiers de l'hôtellerie et restauration / des arts et design / de l'aménagement et finition du bâtiment";"ILE-DE-FRANCE";"dont élèves en voie pro sco";50;36;37;-1;43
"0771658J";"Lycée polyvalent du Gué à Tresmes - Lycée des métiers de l'hôtellerie et restauration / des arts et design / de l'aménagement et finition du bâtiment";"ILE-DE-FRANCE";"dont apprentis";29;63;52;11;74
"0771663P";"Lycée général et technologique George Sand";"ILE-DE-FRANCE";"ensemble";21;38;50;-12;42
"0771763Y";"Lycée général et technologique Charles Le Chauve";"ILE-DE-FRANCE";"ensemble";46;60;56;5;57
"0771880A";"Lycée professionnel Charles Baudelaire";"ILE-DE-FRANCE";"ensemble";43;29;32;-3;30
"0771940R";"Lycée polyvalent Simone Veil";"ILE-DE-FRANCE";"ensemble";49;38;45;-7;47
"0771940R";"Lycée polyvalent Simone Veil";"ILE-DE-FRANCE";"dont élèves en voie pro sco";51;35;42;-7;44
"0771940R";"Lycée polyvalent Simone Veil";"ILE-DE-FRANCE";"dont apprentis";;;;;
"0771941S";"Lycée polyvalent René Cassin";"ILE-DE-FRANCE";"ensemble";54;45;45;0;49
"0771941S";"Lycée polyvalent René Cassin";"ILE-DE-FRANCE";"dont élèves en voie pro sco";55;43;43;0;47
"0771941S";"Lycée polyvalent René Cassin";"ILE-DE-FRANCE";"dont apprentis";;;;;
"0771995A";"Lycée professionnel le Champ de Claye - Lycée des métiers de l'énergie";"ILE-DE-FRANCE";"ensemble";44;35;32;3;40
"0771996B";"Lycée polyvalent Honoré de Balzac";"ILE-DE-FRANCE";"ensemble";50;45;55;-9;68
"0771997C";"Lycée professionnel Jacques Prévert - Lycée des métiers des systèmes électroniques numériques et de l'électrotechnique";"ILE-DE-FRANCE";"ensemble";49;38;39;-1;43
"0771997C";"Lycée professionnel Jacques Prévert - Lycée des métiers des systèmes électroniques numériques et de l'électrotechnique";"ILE-DE-FRANCE";"dont élèves en voie pro sco";50;38;37;0;43
"0771997C";"Lycée professionnel Jacques Prévert - Lycée des métiers des systèmes électroniques numériques et de l'électrotechnique";"ILE-DE-FRANCE";"dont apprentis";;;;;
"0772120L";"Lycée général et technologique Jean Moulin";"ILE-DE-FRANCE";"ensemble";43;43;45;-2;48
