"n°UAI de l'établissement";"Libellé de l'établissement";"Région";"Dont apprentis en EPLE";;"Taux";"Taux attendu";"Valeur ajoutée";
"0010001W";"Lycée professionnel Alexandre Bérard - Lycée des métiers de l'énergie et de l'habitat";"AUVERGNE-RHONE-ALPES";"ensemble";51;41;36;4;51
"0010006B";"Lycée polyvalent Saint-Exupéry - Lycée des métiers de l'hôtellerie et des services - Lycée des métiers des énergies du bâtiment";"AUVERGNE-RHONE-ALPES";"ensemble";42;51;40;12;47
"0010006B";"Lycée polyvalent Saint-Exupéry - Lycée des métiers de l'hôtellerie et des services - Lycée des métiers des énergies du bâtiment";"AUVERGNE-RHONE-ALPES";"dont élèves en voie pro sco";43;50;38;12;47
"0010006B";"Lycée polyvalent Saint-Exupéry - Lycée des métiers de l'hôtellerie et des services - Lycée des métiers des énergies du bâtiment";"AUVERGNE-RHONE-ALPES";"dont apprentis";;;;;
"0010014K";"Lycée général et technologique Edgar Quinet";"AUVERGNE-RHONE-ALPES";"ensemble";37;68;58;10;66
"0010016M";"Lycée polyvalent Joseph-Marie Carriat";"AUVERGNE-RHONE-ALPES";"ensemble";43;69;59;10;74
"0010016M";"Lycée polyvalent Joseph-Marie Carriat";"AUVERGNE-RHONE-ALPES";"dont élèves en voie pro sco";51;62;52;10;68
"0010016M";"Lycée polyvalent Joseph-Marie Carriat";"AUVERGNE-RHONE-ALPES";"dont apprentis";23;80;69;11;83
"0010020S";"Lycée professionnel Georges Charpak - Lycée des métiers de la maintenance des engins mécaniques";"AUVERGNE-RHONE-ALPES";"ensemble";43;62;58;4;74
"0010020S";"Lycée professionnel Georges Charpak - Lycée des métiers de la maintenance des engins mécaniques";"AUVERGNE-RHONE-ALPES";"dont élèves en voie pro sco";45;34;43;-8;48
"0010020S";"Lycée professionnel Georges Charpak - Lycée des métiers de la maintenance des engins mécaniques";"AUVERGNE-RHONE-ALPES";"dont apprentis";40;90;78;12;100
"0010021T";"Lycée professionnel Marcelle Pardé - Lycée des métiers du réseau textile mode cuir";"AUVERGNE-RHONE-ALPES";"ensemble";48;42;39;3;44
"0010032E";"Lycée polyvalent Xavier Bichat";"AUVERGNE-RHONE-ALPES";"ensemble";34;28;38;-10;41
"0010034G";"Lycée polyvalent Paul Painlevé";"AUVERGNE-RHONE-ALPES";"ensemble";55;45;36;9;44
"0010070W";"Lycée général et technologique privé Saint Pierre";"AUVERGNE-RHONE-ALPES";"ensemble";40;85;73;12;93
"0010072Y";"Lycée polyvalent international";"AUVERGNE-RHONE-ALPES";"ensemble";36;34;40;-6;48
"0010099C";"Lycée professionnel privé Saint Joseph - Lycée des métier des services administratifs et commerciaux - Lycée des métiers de l'électronique";"AUVERGNE-RHONE-ALPES";"ensemble";66;48;40;8;51
"0010814E";"Lycée professionnel privé Saint Joseph";"AUVERGNE-RHONE-ALPES";"ensemble";48;41;36;5;41
"0010878Z";"Lycée polyvalent privé Jeanne d'Arc";"AUVERGNE-RHONE-ALPES";"ensemble";37;32;41;-8;38
"0010966V";"Etablissement régional d'enseignement adapté Philibert Commerson";"AUVERGNE-RHONE-ALPES";"ensemble";30;21;23;-2;42
"0011010T";"Lycée professionnel du Bugey";"AUVERGNE-RHONE-ALPES";"ensemble";44;34;32;2;38
"0011118K";"Lycée professionnel Gabriel Voisin - Lycée des métiers de l'automobile, du transport et de la logistique, de la propreté";"AUVERGNE-RHONE-ALPES";"ensemble";37;48;46;3;57
"0011118K";"Lycée professionnel Gabriel Voisin - Lycée des métiers de l'automobile, du transport et de la logistique, de la propreté";"AUVERGNE-RHONE-ALPES";"dont élèves en voie pro sco";36;49;45;5;58
"0011118K";"Lycée professionnel Gabriel Voisin - Lycée des métiers de l'automobile, du transport et de la logistique, de la propreté";"AUVERGNE-RHONE-ALPES";"dont apprentis";43;38;50;-12;54
"0011119L";"Lycée polyvalent Arbez Carme - Lycée des métiers de la plasturgie et des outillages";"AUVERGNE-RHONE-ALPES";"ensemble";59;48;48;0;46
"0011119L";"Lycée polyvalent Arbez Carme - Lycée des métiers de la plasturgie et des outillages";"AUVERGNE-RHONE-ALPES";"dont élèves en voie pro sco";63;42;41;0;35
"0011119L";"Lycée polyvalent Arbez Carme - Lycée des métiers de la plasturgie et des outillages";"AUVERGNE-RHONE-ALPES";"dont apprentis";42;66;66;0;78
"0011194T";"Lycée général et technologique de la Plaine de l'Ain";"AUVERGNE-RHONE-ALPES";"ensemble";26;56;55;0;62
"0011258M";"Lycée professionnel privé Ensemble scolaire Lamartine";"AUVERGNE-RHONE-ALPES";"ensemble";;;;;
"0011276G";"Lycée général et technologique du Val de Saône";"AUVERGNE-RHONE-ALPES";"ensemble";17;70;58;12;75
"0020012C";"Lycée polyvalent Jean de la Fontaine - Lycée des métiers de la santé, de la gestion et du commerce";"HAUTS-DE-FRANCE";"ensemble";48;25;32;-7;28
"0020014E";"Lycée d'enseignement général et technologique Gay Lussac";"HAUTS-DE-FRANCE";"ensemble";30;58;58;0;70
"0020014E";"Lycée d'enseignement général et technologique Gay Lussac";"HAUTS-DE-FRANCE";"dont élèves en voie pro sco";27;38;49;-11;58
"0020014E";"Lycée d'enseignement général et technologique Gay Lussac";"HAUTS-DE-FRANCE";"dont apprentis";33;84;72;12;86
"0020022N";"Lycée professionnel Jean Monnet";"HAUTS-DE-FRANCE";"ensemble";54;21;26;-4;32
"0020025S";"Lycée professionnel Château Potel - Lycée des métiers horticulture et maintenance (véhicules industriels, matériels agricoles et travaux publics)";"HAUTS-DE-FRANCE";"ensemble";48;21;28;-8;27
"0020031Y";"Lycée d'enseignement général et technologique Frédéric et Irène Joliot Curie";"HAUTS-DE-FRANCE";"ensemble";22;45;51;-6;50
"0020031Y";"Lycée d'enseignement général et technologique Frédéric et Irène Joliot Curie";"HAUTS-DE-FRANCE";"dont élèves en voie pro sco";20;39;48;-8;46
"0020031Y";"Lycée d'enseignement général et technologique Frédéric et Irène Joliot Curie";"HAUTS-DE-FRANCE";"dont apprentis";;;;;
"0020032Z";"Lycée général et technologique Paul Claudel";"HAUTS-DE-FRANCE";"ensemble";42;35;44;-10;46
"0020034B";"Lycée polyvalent Pierre Méchain";"HAUTS-DE-FRANCE";"ensemble";57;34;35;0;36
"0020048S";"Lycée général et technologique Henri Martin";"HAUTS-DE-FRANCE";"ensemble";36;35;37;-3;36
"0020048S";"Lycée général et technologique Henri Martin";"HAUTS-DE-FRANCE";"dont élèves en voie pro sco";36;35;34;1;38
"0020048S";"Lycée général et technologique Henri Martin";"HAUTS-DE-FRANCE";"dont apprentis";35;33;45;-12;29
"0020049T";"Lycée général et technologique Pierre de La Ramée";"HAUTS-DE-FRANCE";"ensemble";25;46;47;-1;59
"0020050U";"Lycée d'enseignement général et technologique Condorcet";"HAUTS-DE-FRANCE";"ensemble";40;45;46;-1;59
"0020050U";"Lycée d'enseignement général et technologique Condorcet";"HAUTS-DE-FRANCE";"dont élèves en voie pro sco";41;44;44;0;58
"0020050U";"Lycée d'enseignement général et technologique Condorcet";"HAUTS-DE-FRANCE";"dont apprentis";30;;;;
"0020051V";"Lycée professionnel d'art - Lycée des métiers";"HAUTS-DE-FRANCE";"ensemble";66;;;;
"0020052W";"Lycée professionnel Colard Noël - Lycée des métiers du bâtiment et de l'hôtellerie";"HAUTS-DE-FRANCE";"ensemble";49;27;26;1;34
"0020052W";"Lycée professionnel Colard Noël - Lycée des métiers du bâtiment et de l'hôtellerie";"HAUTS-DE-FRANCE";"dont élèves en voie pro sco";49;26;25;1;32
"0020052W";"Lycée professionnel Colard Noël - Lycée des métiers du bâtiment et de l'hôtellerie";"HAUTS-DE-FRANCE";"dont apprentis";;;;;
"0020059D";"Lycée général et technologique Gérard de Nerval";"HAUTS-DE-FRANCE";"ensemble";38;49;52;-3;61
"0020078Z";"Lycée professionnel Julie Daubie";"HAUTS-DE-FRANCE";"ensemble";48;17;24;-8;26
"0020078Z";"Lycée professionnel Julie Daubie";"HAUTS-DE-FRANCE";"dont élèves en voie pro sco";49;15;22;-7;24
"0020078Z";"Lycée professionnel Julie Daubie";"HAUTS-DE-FRANCE";"dont apprentis";;;;;
"0020079A";"Lycée professionnel Condorcet - Lycée des métiers";"HAUTS-DE-FRANCE";"ensemble";53;31;27;4;42
"0020088K";"Lycée professionnel Camille Claudel - Lycée des métiers de l'optique et du tertiaire";"HAUTS-DE-FRANCE";"ensemble";57;16;25;-9;23
"0020089L";"Lycée professionnel Frédéric et Irène Joliot Curie - Lycée des métiers de la gestion et de l'industrie";"HAUTS-DE-FRANCE";"ensemble";62;18;20;-2;21
"0020492Z";"Lycée professionnel privé Saint-Vincent-de-Paul - Lycée des métiers du design, de la santé et de l'hôtellerie";"HAUTS-DE-FRANCE";"ensemble";51;23;26;-3;37
"0020498F";"Lycée professionnel privé Sainte Sophie - Lycée des métiers des services à la personne";"HAUTS-DE-FRANCE";"ensemble";57;30;27;3;43
"0021476U";"Lycée polyvalent Léonard De Vinci - Lycée des métiers des éco-sciences et des éco-technologies";"HAUTS-DE-FRANCE";"ensemble";49;41;37;3;48
"0021478W";"Etablissement régional d'enseignement adapté";"HAUTS-DE-FRANCE";"ensemble";53;13;12;1;17
"0021479X";"Lycée professionnel Françoise Dolto - Lycée des métiers des services aux personnes et aux entreprises";"HAUTS-DE-FRANCE";"ensemble";47;11;18;-7;21
"0021869W";"Lycée d'enseignement général et technologique privé Saint Joseph";"HAUTS-DE-FRANCE";"ensemble";24;;;;
"0021873A";"Lycée général et technologique privé St Jean La Croix";"HAUTS-DE-FRANCE";"ensemble";20;34;46;-12;60
"0021874B";"Lycée général et technologique privé Saint Rémy";"HAUTS-DE-FRANCE";"ensemble";33;58;49;10;65
"0021906L";"Lycée professionnel privé Saint Charles - Lycée des métiers de la sécurité et de la maintenance";"HAUTS-DE-FRANCE";"ensemble";66;32;32;0;44
"0021939X";"Lycée polyvalent Jules Verne - Lycée des métiers des sciences et technologies pour un développement durable";"HAUTS-DE-FRANCE";"ensemble";59;19;29;-10;25
"0021999M";"Lycée professionnel privé Saint Joseph - Lycée des métiers de l'hôtellerie et de la restauration";"HAUTS-DE-FRANCE";"ensemble";70;;;;
"0022002R";"Lycée professionnel privé Saint Joseph";"HAUTS-DE-FRANCE";"ensemble";47;19;20;-1;27
"0022008X";"Lycée professionnel Jean Macé - Lycée des métiers du développement durable";"HAUTS-DE-FRANCE";"ensemble";51;20;21;-1;36
"0022022M";"Lycée d'enseignement technologique privé Sainte Sophie";"HAUTS-DE-FRANCE";"ensemble";30;27;36;-8;55
"0022042J";"Lycée polyvalent Jean Bouin - Lycée des métiers de la mode, des services à la personne et aux collectivités";"HAUTS-DE-FRANCE";"ensemble";54;8;20;-12;11
"0022044L";"Lycée polyvalent Le Corbusier - Lycée des métiers de l'hôtellerie et du bâtiment";"HAUTS-DE-FRANCE";"ensemble";35;45;43;2;57
"0022044L";"Lycée polyvalent Le Corbusier - Lycée des métiers de l'hôtellerie et du bâtiment";"HAUTS-DE-FRANCE";"dont élèves en voie pro sco";39;37;34;2;51
"0022044L";"Lycée polyvalent Le Corbusier - Lycée des métiers de l'hôtellerie et du bâtiment";"HAUTS-DE-FRANCE";"dont apprentis";18;68;66;1;74
"0022108F";"Lycée général et technologique privé Saint-Vincent-de-Paul";"HAUTS-DE-FRANCE";"ensemble";26;;;;
"0022172A";"Micro lycée de Saint quentin";"HAUTS-DE-FRANCE";"ensemble";52;;;;
"0030026M";"Lycée polyvalent Paul Constans - Lycée des métiers scientifiques, industriels, administratifs et commerciaux";"AUVERGNE-RHONE-ALPES";"ensemble";54;43;42;1;45
"0030026M";"Lycée polyvalent Paul Constans - Lycée des métiers scientifiques, industriels, administratifs et commerciaux";"AUVERGNE-RHONE-ALPES";"dont élèves en voie pro sco";54;42;42;1;45
"0030026M";"Lycée polyvalent Paul Constans - Lycée des métiers scientifiques, industriels, administratifs et commerciaux";"AUVERGNE-RHONE-ALPES";"dont apprentis";;;;;
"0030038A";"Lycée polyvalent Jean Monnet - Lycée des métiers du design et des arts verriers";"AUVERGNE-RHONE-ALPES";"ensemble";51;44;42;3;51
"0030038A";"Lycée polyvalent Jean Monnet - Lycée des métiers du design et des arts verriers";"AUVERGNE-RHONE-ALPES";"dont élèves en voie pro sco";52;43;40;3;49
"0030038A";"Lycée polyvalent Jean Monnet - Lycée des métiers du design et des arts verriers";"AUVERGNE-RHONE-ALPES";"dont apprentis";26;;;;
"0030051P";"Lycée général et technologique Albert Londres - Lycée des métiers du bois, des énergies et des services aux organisations";"AUVERGNE-RHONE-ALPES";"ensemble";48;47;53;-6;61
"0030051P";"Lycée général et technologique Albert Londres - Lycée des métiers du bois, des énergies et des services aux organisations";"AUVERGNE-RHONE-ALPES";"dont élèves en voie pro sco";49;48;53;-5;62
"0030051P";"Lycée général et technologique Albert Londres - Lycée des métiers du bois, des énergies et des services aux organisations";"AUVERGNE-RHONE-ALPES";"dont apprentis";;;;;
"0030061A";"Lycée professionnel Albert Londres - Lycée des métiers du bois, des énergies et des services aux organisations";"AUVERGNE-RHONE-ALPES";"ensemble";57;31;31;0;43
"0030105Y";"Lycée professionnel privé Sainte-Louise";"AUVERGNE-RHONE-ALPES";"ensemble";67;;;;
"0030112F";"Lycée professionnel privé Anna Rodier";"AUVERGNE-RHONE-ALPES";"ensemble";44;23;32;-9;35
"0030905T";"Lycée professionnel Gustave Eiffel - Lycée des métiers de la maintenance des matériels et des véhicules motocycles";"AUVERGNE-RHONE-ALPES";"ensemble";34;57;58;-1;69
"0030905T";"Lycée professionnel Gustave Eiffel - Lycée des métiers de la maintenance des matériels et des véhicules motocycles";"AUVERGNE-RHONE-ALPES";"dont élèves en voie pro sco";41;42;45;-3;55
"0030905T";"Lycée professionnel Gustave Eiffel - Lycée des métiers de la maintenance des matériels et des véhicules motocycles";"AUVERGNE-RHONE-ALPES";"dont apprentis";24;75;73;2;86
"0030924N";"Lycée professionnel Val d'Allier";"AUVERGNE-RHONE-ALPES";"ensemble";45;12;24;-12;28
"0030935A";"Lycée Privé d'Enseignement Supérieur de Vichy";"AUVERGNE-RHONE-ALPES";"ensemble";33;60;55;5;70
"0031041R";"Lycée technologique privé Anna Rodier";"AUVERGNE-RHONE-ALPES";"ensemble";44;;;;
"0031043T";"Lycée polyvalent Albert Einstein - Lycée des métiers de l'automobile";"AUVERGNE-RHONE-ALPES";"ensemble";55;55;44;11;61
"0031043T";"Lycée polyvalent Albert Einstein - Lycée des métiers de l'automobile";"AUVERGNE-RHONE-ALPES";"dont élèves en voie pro sco";57;49;39;11;56
"0031043T";"Lycée polyvalent Albert Einstein - Lycée des métiers de l'automobile";"AUVERGNE-RHONE-ALPES";"dont apprentis";;;;;
"0031044U";"Lycée polyvalent Geneviève Vincent";"AUVERGNE-RHONE-ALPES";"ensemble";32;23;26;-4;34
"0031044U";"Lycée polyvalent Geneviève Vincent";"AUVERGNE-RHONE-ALPES";"dont élèves en voie pro sco";32;22;26;-4;34
"0031044U";"Lycée polyvalent Geneviève Vincent";"AUVERGNE-RHONE-ALPES";"dont apprentis";;;;;
"0031082K";"Lycée polyvalent Valéry Larbaud";"AUVERGNE-RHONE-ALPES";"ensemble";42;52;45;7;60
"0031082K";"Lycée polyvalent Valéry Larbaud";"AUVERGNE-RHONE-ALPES";"dont élèves en voie pro sco";44;49;42;7;56
"0031082K";"Lycée polyvalent Valéry Larbaud";"AUVERGNE-RHONE-ALPES";"dont apprentis";20;85;75;10;94
"0040003G";"Lycée général André Honnorat";"PROVENCE-ALPES-COTE D'AZUR";"ensemble";62;;;;
"0040007L";"Lycée professionnel lycée des métiers Beau de Rochas";"PROVENCE-ALPES-COTE D'AZUR";"ensemble";54;29;26;3;38
"0040010P";"Lycée général et technologique Félix Esclangon";"PROVENCE-ALPES-COTE D'AZUR";"ensemble";33;57;53;4;69
"0040011R";"Lycée professionnel Louis Martin Bret - Lycée des métiers de l'hotellerie-restauration, des secteurs tertiaire et industriel";"PROVENCE-ALPES-COTE D'AZUR";"ensemble";52;35;31;4;55
"0040023D";"Lycée polyvalent Paul Arène - lycée des métiers de l'hotellerie et de la restauration des Alpes provençales";"PROVENCE-ALPES-COTE D'AZUR";"ensemble";48;45;41;4;72
"0040027H";"Lycée général et technologique Alexandra David Neel";"PROVENCE-ALPES-COTE D'AZUR";"ensemble";54;;;;
"0040378P";"Etablissement régional d'enseignement adapté de Haute-Provence";"PROVENCE-ALPES-COTE D'AZUR";"ensemble";36;;;;
"0040490L";"Lycée général et technologique Pierre-Gilles de Gennes";"PROVENCE-ALPES-COTE D'AZUR";"ensemble";42;59;47;12;56
"0040533H";"Lycée Polyvalent Les Iscles";"PROVENCE-ALPES-COTE D'AZUR";"ensemble";43;43;45;-2;57
"0050003B";"Lycée polyvalent  d'Altitude";"PROVENCE-ALPES-COTE D'AZUR";"ensemble";49;35;37;-2;60
"0050004C";"Lycée climatique Honoré Romane";"PROVENCE-ALPES-COTE D'AZUR";"ensemble";27;56;49;6;64
"0050005D";"Lycée professionnel Alpes et Durance - Lycée des Métiers pluri-actifs du bois et de l'habitat de montagne";"PROVENCE-ALPES-COTE D'AZUR";"ensemble";56;27;39;-12;48
"0050006E";"Lycée général et technologique Dominique Villars";"PROVENCE-ALPES-COTE D'AZUR";"ensemble";35;56;52;4;61
"0050007F";"Lycée général et technologique Aristide Briand";"PROVENCE-ALPES-COTE D'AZUR";"ensemble";45;64;55;9;73
"0050008G";"Lycée professionnel Paul Héraud";"PROVENCE-ALPES-COTE D'AZUR";"ensemble";41;50;42;8;64
"0050009H";"Lycée professionnel Sévigné - Lycée des métiers de la restauration, des services aux entreprises et aux personnes";"PROVENCE-ALPES-COTE D'AZUR";"ensemble";55;30;29;1;40
"0050027C";"Lycée professionnel Pierre Mendès France";"PROVENCE-ALPES-COTE D'AZUR";"ensemble";59;29;29;0;48
"0050039R";"Lycée professionnel privé Pierre et Louis Poutrain";"PROVENCE-ALPES-COTE D'AZUR";"ensemble";73;23;35;-12;46
"0060001U";"Lycée général et technologique Jacques Audiberti";"PROVENCE-ALPES-COTE D'AZUR";"ensemble";37;53;55;-2;61
"0060001U";"Lycée général et technologique Jacques Audiberti";"PROVENCE-ALPES-COTE D'AZUR";"dont élèves en voie pro sco";37;52;54;-2;60
"0060001U";"Lycée général et technologique Jacques Audiberti";"PROVENCE-ALPES-COTE D'AZUR";"dont apprentis";;;;;
"0060002V";"Lycée professionnel Jacques Dolle";"PROVENCE-ALPES-COTE D'AZUR";"ensemble";42;37;32;4;48
"0060009C";"Lycée général et technologique Auguste Renoir";"PROVENCE-ALPES-COTE D'AZUR";"ensemble";24;60;53;6;72
"0060011E";"Lycée général Carnot";"PROVENCE-ALPES-COTE D'AZUR";"ensemble";65;37;38;-1;44
"0060013G";"Lycée général et technologique Bristol";"PROVENCE-ALPES-COTE D'AZUR";"ensemble";46;44;53;-9;56
"0060014H";"Lycée général et technologique Jules Ferry";"PROVENCE-ALPES-COTE D'AZUR";"ensemble";43;53;50;3;59
"0060015J";"Lycée professionnel Les Coteaux - Lycée des métiers de la relation client, de la mode et du costume de spectacle";"PROVENCE-ALPES-COTE D'AZUR";"ensemble";46;28;31;-3;42
"0060020P";"Lycée général et technologique Amiral de Grasse";"PROVENCE-ALPES-COTE D'AZUR";"ensemble";30;57;51;6;67
"0060022S";"Lycée professionnel Léon Chiris";"PROVENCE-ALPES-COTE D'AZUR";"ensemble";42;39;40;0;50
"0060022S";"Lycée professionnel Léon Chiris";"PROVENCE-ALPES-COTE D'AZUR";"dont élèves en voie pro sco";44;39;37;2;48
"0060022S";"Lycée professionnel Léon Chiris";"PROVENCE-ALPES-COTE D'AZUR";"dont apprentis";;;;;
"0060023T";"Lycée professionnel Francis de Croisset";"PROVENCE-ALPES-COTE D'AZUR";"ensemble";43;36;31;4;47
"0060026W";"Lycée général et technologique Pierre et Marie Curie";"PROVENCE-ALPES-COTE D'AZUR";"ensemble";;;;;
"0060027X";"Lycée professionnel Pierre et Marie Curie - Lycée des métiers de l'enseigne, de la signalétique et du développement durable";"PROVENCE-ALPES-COTE D'AZUR";"ensemble";41;19;31;-11;27
"0060027X";"Lycée professionnel Pierre et Marie Curie - Lycée des métiers de l'enseigne, de la signalétique et du développement durable";"PROVENCE-ALPES-COTE D'AZUR";"dont élèves en voie pro sco";41;20;31;-11;28
"0060027X";"Lycée professionnel Pierre et Marie Curie - Lycée des métiers de l'enseigne, de la signalétique et du développement durable";"PROVENCE-ALPES-COTE D'AZUR";"dont apprentis";;;;;
"0060028Y";"Lycée professionnel Paul Valéry - Lycée des métiers de la restauration";"PROVENCE-ALPES-COTE D'AZUR";"ensemble";39;21;32;-11;34
"0060028Y";"Lycée professionnel Paul Valéry - Lycée des métiers de la restauration";"PROVENCE-ALPES-COTE D'AZUR";"dont élèves en voie pro sco";39;21;32;-11;34
"0060028Y";"Lycée professionnel Paul Valéry - Lycée des métiers de la restauration";"PROVENCE-ALPES-COTE D'AZUR";"dont apprentis";;;;;
"0060029Z";"Lycée général et technologique Parc Imperial";"PROVENCE-ALPES-COTE D'AZUR";"ensemble";45;56;54;1;58
"0060029Z";"Lycée général et technologique Parc Imperial";"PROVENCE-ALPES-COTE D'AZUR";"dont élèves en voie pro sco";47;53;51;2;57
"0060029Z";"Lycée général et technologique Parc Imperial";"PROVENCE-ALPES-COTE D'AZUR";"dont apprentis";25;;;;
"0060031B";"Lycée général et technologique Albert Calmette";"PROVENCE-ALPES-COTE D'AZUR";"ensemble";29;47;54;-7;47
"0060033D";"Lycée polyvalent Honoré d'Estienne d'Orves - Lycée des métiers de la comptabilité";"PROVENCE-ALPES-COTE D'AZUR";"ensemble";47;49;48;1;52
"0060033D";"Lycée polyvalent Honoré d'Estienne d'Orves - Lycée des métiers de la comptabilité";"PROVENCE-ALPES-COTE D'AZUR";"dont élèves en voie pro sco";49;50;46;3;52
"0060033D";"Lycée polyvalent Honoré d'Estienne d'Orves - Lycée des métiers de la comptabilité";"PROVENCE-ALPES-COTE D'AZUR";"dont apprentis";35;44;56;-11;49
"0060034E";"Lycée polyvalent hôtelier Tourisme Paul Augier - Lycée des métiers de l'hôtellerie et du tourisme";"PROVENCE-ALPES-COTE D'AZUR";"ensemble";34;45;47;-3;63
"0060034E";"Lycée polyvalent hôtelier Tourisme Paul Augier - Lycée des métiers de l'hôtellerie et du tourisme";"PROVENCE-ALPES-COTE D'AZUR";"dont élèves en voie pro sco";39;45;48;-3;60
"0060034E";"Lycée polyvalent hôtelier Tourisme Paul Augier - Lycée des métiers de l'hôtellerie et du tourisme";"PROVENCE-ALPES-COTE D'AZUR";"dont apprentis";14;46;47;-1;68
"0060038J";"Lycée professionnel Vauban";"PROVENCE-ALPES-COTE D'AZUR";"ensemble";39;32;36;-4;39
"0060038J";"Lycée professionnel Vauban";"PROVENCE-ALPES-COTE D'AZUR";"dont élèves en voie pro sco";42;26;31;-5;37
"0060038J";"Lycée professionnel Vauban";"PROVENCE-ALPES-COTE D'AZUR";"dont apprentis";29;49;50;-1;43
"0060040L";"Lycée professionnel Pasteur";"PROVENCE-ALPES-COTE D'AZUR";"ensemble";55;20;29;-9;27
"0060042N";"Lycée professionnel Les Palmiers";"PROVENCE-ALPES-COTE D'AZUR";"ensemble";40;29;30;-1;38
"0060042N";"Lycée professionnel Les Palmiers";"PROVENCE-ALPES-COTE D'AZUR";"dont élèves en voie pro sco";41;29;30;-1;38
"0060042N";"Lycée professionnel Les Palmiers";"PROVENCE-ALPES-COTE D'AZUR";"dont apprentis";;;;;
"0060043P";"Lycée professionnel Magnan - Lycée des métiers des soins et services à la personne";"PROVENCE-ALPES-COTE D'AZUR";"ensemble";49;29;30;-1;37
"0060075Z";"Lycée général et technologique Les Eucalyptus";"PROVENCE-ALPES-COTE D'AZUR";"ensemble";40;50;51;-1;66
"0060082G";"Lycée professionnel Les Eucalyptus                 Lycée des sciences appliquées aux métiers de l'Industrie";"PROVENCE-ALPES-COTE D'AZUR";"ensemble";50;52;40;12;57
"0060670W";"Lycée général et technologique privé Sainte Marie";"PROVENCE-ALPES-COTE D'AZUR";"ensemble";25;22;34;-12;48
"0060673Z";"Lycée général et technologique privé Stanislas";"PROVENCE-ALPES-COTE D'AZUR";"ensemble";34;18;30;-12;55
"0060674A";"Lycée général et technologique privé Fénélon";"PROVENCE-ALPES-COTE D'AZUR";"ensemble";32;;;;
"0060677D";"Lycée général et technologique privé Sasserno";"PROVENCE-ALPES-COTE D'AZUR";"ensemble";37;33;45;-12;47
"0060715V";"Lycée professionnel privé La Providence";"PROVENCE-ALPES-COTE D'AZUR";"ensemble";46;24;27;-3;35
"0060750H";"Lycée polyvalent privé Institution Saint Joseph Carnolés";"PROVENCE-ALPES-COTE D'AZUR";"ensemble";62;;;;
"0060774J";"Lycée polyvalent privé Saint Joseph";"PROVENCE-ALPES-COTE D'AZUR";"ensemble";35;37;49;-12;30
"0060776L";"Lycée professionnel privé Saint Vincent de Paul - Lycée des métiers du tertiaire";"PROVENCE-ALPES-COTE D'AZUR";"ensemble";50;41;37;4;41
"0061394H";"Lycée professionnel privé Les Fauvettes";"PROVENCE-ALPES-COTE D'AZUR";"ensemble";41;32;33;0;45
"0061462G";"Lycée professionnel privé Don Bosco - Lycée des métiers de la maintenance industrielle et industrie graphique";"PROVENCE-ALPES-COTE D'AZUR";"ensemble";54;37;36;0;45
"0061478Z";"Lycée polyvalent Léonard de Vinci - Lycée des métiers du bâtiment et travaux publics";"PROVENCE-ALPES-COTE D'AZUR";"ensemble";49;52;49;3;62
"0061478Z";"Lycée polyvalent Léonard de Vinci - Lycée des métiers du bâtiment et travaux publics";"PROVENCE-ALPES-COTE D'AZUR";"dont élèves en voie pro sco";50;50;47;3;61
"0061478Z";"Lycée polyvalent Léonard de Vinci - Lycée des métiers du bâtiment et travaux publics";"PROVENCE-ALPES-COTE D'AZUR";"dont apprentis";;;;;
"0061561P";"Lycée professionnel Alfred Hutinel - lycée des métiers des énergies électriques";"PROVENCE-ALPES-COTE D'AZUR";"ensemble";40;36;37;-1;46
"0061635V";"Lycée professionnel Auguste Escoffier";"PROVENCE-ALPES-COTE D'AZUR";"ensemble";39;32;31;1;45
"0061691F";"Lycée général et technologique Thierry Maulnier - Lycée des métiers de la chimie";"PROVENCE-ALPES-COTE D'AZUR";"ensemble";72;;;;
"0061760F";"Lycée général et technologique Alexis de Tocqueville";"PROVENCE-ALPES-COTE D'AZUR";"ensemble";39;54;49;6;66
"0061763J";"Lycée général et technologique Guillaume Apollinaire";"PROVENCE-ALPES-COTE D'AZUR";"ensemble";24;38;45;-7;42
"0061987C";"Lycée polyvalent de la Montagne";"PROVENCE-ALPES-COTE D'AZUR";"ensemble";49;40;37;3;53
"0062089N";"Lycée Général et Technologique René Goscinny";"PROVENCE-ALPES-COTE D'AZUR";"ensemble";50;45;40;5;50
"0070001N";"Lycée polyvalent public Boissy d'Anglas - Lycée des métiers de la création industrielle";"AUVERGNE-RHONE-ALPES";"ensemble";41;57;53;3;65
"0070001N";"Lycée polyvalent public Boissy d'Anglas - Lycée des métiers de la création industrielle";"AUVERGNE-RHONE-ALPES";"dont élèves en voie pro sco";42;51;46;5;61
"0070001N";"Lycée polyvalent public Boissy d'Anglas - Lycée des métiers de la création industrielle";"AUVERGNE-RHONE-ALPES";"dont apprentis";41;67;67;0;72
"0070002P";"Lycée professionnel Joseph et Etienne De Montgolfier";"AUVERGNE-RHONE-ALPES";"ensemble";37;32;31;1;45
"0070002P";"Lycée professionnel Joseph et Etienne De Montgolfier";"AUVERGNE-RHONE-ALPES";"dont élèves en voie pro sco";36;31;31;0;44
"0070002P";"Lycée professionnel Joseph et Etienne De Montgolfier";"AUVERGNE-RHONE-ALPES";"dont apprentis";;;;;
