"n°UAI de l'établissement";"Libellé de l'établissement";"Région";;;"Taux";"Taux attendu";"Valeur ajoutée";;;
"0340006X";"Lycée professionnel Fernand Léger, lycée des métiers du BTP et des arts";"OCCITANIE";"dont apprentis";33;68;66;1;68;70;76
"0340011C";"Lycée polyvalent Jean Moulin";"OCCITANIE";"ensemble";52;31;30;1;40;36;46
"0340012D";"Lycée professionnel Jean Mermoz, Lycée des métiers de la maintenance, de la menuiserie et de la relation client";"OCCITANIE";"ensemble";46;23;27;-5;37;38;48
"0340023R";"Lycée général et technologique René Gosse";"OCCITANIE";"ensemble";32;38;50;-12;56;44;47
"0340028W";"Lycée polyvalent Joseph Vallot";"OCCITANIE";"ensemble";55;26;28;-3;43;46;49
"0340030Y";"Lycée polyvalent Louis Feuillade";"OCCITANIE";"ensemble";46;33;37;-4;41;45;48
"0340030Y";"Lycée polyvalent Louis Feuillade";"OCCITANIE";"dont élèves en voie pro sco";48;33;37;-4;40;46;50
"0340030Y";"Lycée polyvalent Louis Feuillade";"OCCITANIE";"dont apprentis";25;;;;;;
"0340039H";"Lycée général et technologique Georges Clémenceau";"OCCITANIE";"ensemble";32;52;60;-7;62;52;60
"0340040J";"Lycée polyvalent Jules Guesde";"OCCITANIE";"ensemble";64;40;45;-5;50;42;52
"0340042L";"Lycée polyvalent Jean Mermoz";"OCCITANIE";"ensemble";44;54;53;1;62;63;68
"0340042L";"Lycée polyvalent Jean Mermoz";"OCCITANIE";"dont élèves en voie pro sco";50;47;45;3;57;57;63
"0340042L";"Lycée polyvalent Jean Mermoz";"OCCITANIE";"dont apprentis";18;70;74;-4;75;77;80
"0340043M";"Lycée professionnel Pierre Mendès France, lycée des métiers des polytechniques";"OCCITANIE";"ensemble";48;32;39;-7;45;46;51
"0340043M";"Lycée professionnel Pierre Mendès France, lycée des métiers des polytechniques";"OCCITANIE";"dont élèves en voie pro sco";50;29;36;-7;42;42;48
"0340043M";"Lycée professionnel Pierre Mendès France, lycée des métiers des polytechniques";"OCCITANIE";"dont apprentis";35;46;51;-6;56;62;61
"0340045P";"Lycée professionnel Jules Ferry, lycée des métiers des services à la personne et de l'entreprise";"OCCITANIE";"ensemble";40;37;40;-3;45;48;55
"0340045P";"Lycée professionnel Jules Ferry, lycée des métiers des services à la personne et de l'entreprise";"OCCITANIE";"dont élèves en voie pro sco";46;32;35;-3;41;43;50
"0340045P";"Lycée professionnel Jules Ferry, lycée des métiers des services à la personne et de l'entreprise";"OCCITANIE";"dont apprentis";22;48;52;-4;53;61;67
"0340059E";"Lycée général et technologique Jean Moulin";"OCCITANIE";"ensemble";28;40;45;-6;51;51;67
"0340061G";"Lycée professionnel Charles Alliès, lycée des métiers du commerce et de la maintenance des matériels";"OCCITANIE";"ensemble";50;28;33;-4;48;43;55
"0340061G";"Lycée professionnel Charles Alliès, lycée des métiers du commerce et de la maintenance des matériels";"OCCITANIE";"dont élèves en voie pro sco";52;23;27;-4;44;37;52
"0340061G";"Lycée professionnel Charles Alliès, lycée des métiers du commerce et de la maintenance des matériels";"OCCITANIE";"dont apprentis";24;;;;;;
"0340069R";"Lycée professionnel Jacques Brel, lycée des métiers de la moto";"OCCITANIE";"ensemble";38;37;37;0;55;56;60
"0340069R";"Lycée professionnel Jacques Brel, lycée des métiers de la moto";"OCCITANIE";"dont élèves en voie pro sco";44;26;26;0;47;47;52
"0340069R";"Lycée professionnel Jacques Brel, lycée des métiers de la moto";"OCCITANIE";"dont apprentis";4;73;76;-3;85;88;85
"0340076Y";"Lycée général et technologique Irène et Frédéric Joliot-Curie";"OCCITANIE";"ensemble";30;46;51;-5;64;57;66
"0340078A";"Lycée professionnel Charles de Gaulle, Lycée des métiers de la commercialisation et de la restauration";"OCCITANIE";"ensemble";46;27;26;1;37;36;52
"0340088L";"Lycée professionnel Irène et Frédéric Joliot-Curie";"OCCITANIE";"ensemble";54;29;31;-2;42;46;57
"0340833W";"Etablissement régional d'enseignement adapté Jean-Jacques Rousseau";"OCCITANIE";"ensemble";43;28;23;4;31;36;47
"0340871M";"Lycée général et technologique privé La Trinité";"OCCITANIE";"ensemble";23;54;50;5;67;54;58
"0340920R";"Lycée professionnel privé Turgot, lycée des métiers de la santé et du social";"OCCITANIE";"ensemble";42;31;28;2;39;42;49
"0340923U";"Lycée professionnel privé Le Parterre";"OCCITANIE";"ensemble";44;44;32;12;51;41;44
"0340991T";"Lycée polyvalent privé Nevers";"OCCITANIE";"ensemble";42;45;45;0;53;56;56
"0340992U";"Lycée professionnel privé le Sacré-Coeur";"OCCITANIE";"ensemble";56;27;31;-4;41;40;48
"0341385W";"Lycée professionnel Léonard de Vinci, lycée des métiers de la construction écologique, durable et innovante";"OCCITANIE";"ensemble";45;40;37;3;42;48;55
"0341385W";"Lycée professionnel Léonard de Vinci, lycée des métiers de la construction écologique, durable et innovante";"OCCITANIE";"dont élèves en voie pro sco";48;35;30;5;36;43;50
"0341385W";"Lycée professionnel Léonard de Vinci, lycée des métiers de la construction écologique, durable et innovante";"OCCITANIE";"dont apprentis";22;63;70;-7;66;71;77
"0341521U";"Lycée polyvalent privé Saint-Joseph Pierre Rouge";"OCCITANIE";"ensemble";57;27;34;-7;31;33;48
"0341523W";"Lycée polyvalent privé Saint Joseph";"OCCITANIE";"ensemble";48;44;44;0;62;38;50
"0341736C";"Lycée général et technologique Jean Monnet";"OCCITANIE";"ensemble";46;45;45;1;46;52;56
"0341765J";"Lycée général et technologique privé Rabelais";"OCCITANIE";"ensemble";33;;;;;;
"0341794R";"Lycée polyvalent Jean-François Champollion, Lycée des métiers de la communication et des usages du numérique";"OCCITANIE";"ensemble";51;33;36;-2;38;39;44
"0341794R";"Lycée polyvalent Jean-François Champollion, Lycée des métiers de la communication et des usages du numérique";"OCCITANIE";"dont élèves en voie pro sco";53;26;30;-4;33;33;39
"0341794R";"Lycée polyvalent Jean-François Champollion, Lycée des métiers de la communication et des usages du numérique";"OCCITANIE";"dont apprentis";36;74;66;7;71;71;71
"0341921D";"Lycée polyvalent Georges Pompidou";"OCCITANIE";"ensemble";45;43;39;4;49;49;54
"0341921D";"Lycée polyvalent Georges Pompidou";"OCCITANIE";"dont élèves en voie pro sco";46;44;39;5;50;49;54
"0341921D";"Lycée polyvalent Georges Pompidou";"OCCITANIE";"dont apprentis";;;;;;;
"0342066L";"Lycée polyvalent Jean Jaurès, Lycée des métiers de la santé et du social";"OCCITANIE";"ensemble";53;43;32;10;52;48;53
"0342073U";"IRTS Montpellier, Lycée privé enseignement technique";"OCCITANIE";"ensemble";62;58;46;12;62;58;62
"0342090M";"Lycée polyvalent victor Hugo";"OCCITANIE";"ensemble";44;32;25;6;48;45;56
"0342091N";"Lycée polyvalent Marc Bloch";"OCCITANIE";"ensemble";54;35;42;-7;56;47;67
"0342175E";"Lycée polyvalent privé La Merci Littoral";"OCCITANIE";"ensemble";48;36;33;3;59;44;72
"0342225J";"Lycée polyvalent Georges Frêche,  lycée des métiers de la gastronomie, de l'hôtellerie et du tourisme";"OCCITANIE";"ensemble";42;42;44;-2;58;49;63
"0342225J";"Lycée polyvalent Georges Frêche,  lycée des métiers de la gastronomie, de l'hôtellerie et du tourisme";"OCCITANIE";"dont élèves en voie pro sco";43;42;43;-1;59;48;62
"0342225J";"Lycée polyvalent Georges Frêche,  lycée des métiers de la gastronomie, de l'hôtellerie et du tourisme";"OCCITANIE";"dont apprentis";24;46;54;-8;46;65;69
"0350005R";"Lycée polyvalent Yvon-Bourges";"BRETAGNE";"ensemble";50;63;54;9;76;57;80
"0350009V";"Lycée professionnel Alphonse Pellé";"BRETAGNE";"ensemble";62;44;37;6;47;38;41
"0350011X";"Lycée général et technologique Jean Guéhenno";"BRETAGNE";"ensemble";42;63;60;3;61;61;71
"0350022J";"Lycée général et technologique Beaumont";"BRETAGNE";"ensemble";17;60;57;4;66;63;74
"0350026N";"Lycée général et technologique Jean Macé";"BRETAGNE";"ensemble";48;48;59;-11;58;58;63
"0350028R";"Lycée général et technologique Bréquigny";"BRETAGNE";"ensemble";39;61;56;5;64;61;68
"0350029S";"Lycée général et technologique Joliot-Curie";"BRETAGNE";"ensemble";32;68;59;9;69;69;77
"0350030T";"Lycée polyvalent Pierre Mendès-France - Lycée des métiers du bâtiment et de l'énergétique";"BRETAGNE";"ensemble";54;62;54;8;58;64;66
"0350030T";"Lycée polyvalent Pierre Mendès-France - Lycée des métiers du bâtiment et de l'énergétique";"BRETAGNE";"dont élèves en voie pro sco";58;56;48;8;53;60;61
"0350030T";"Lycée polyvalent Pierre Mendès-France - Lycée des métiers du bâtiment et de l'énergétique";"BRETAGNE";"dont apprentis";23;94;84;10;82;85;94
"0350031U";"Lycée professionnel Jean Jaurès - Lycée des métiers";"BRETAGNE";"ensemble";58;60;48;12;62;57;63
"0350032V";"Lycée professionnel Louis Guilloux - Lycée des métiers de l'hôtellerie-restauration - Lycée des métiers de la mode";"BRETAGNE";"ensemble";53;47;47;0;50;55;61
"0350032V";"Lycée professionnel Louis Guilloux - Lycée des métiers de l'hôtellerie-restauration - Lycée des métiers de la mode";"BRETAGNE";"dont élèves en voie pro sco";53;47;46;0;50;53;60
"0350032V";"Lycée professionnel Louis Guilloux - Lycée des métiers de l'hôtellerie-restauration - Lycée des métiers de la mode";"BRETAGNE";"dont apprentis";50;;;;;;
"0350042F";"Lycée général et technologique Maupertuis";"BRETAGNE";"ensemble";35;58;54;4;65;67;70
"0350042F";"Lycée général et technologique Maupertuis";"BRETAGNE";"dont élèves en voie pro sco";34;57;53;4;64;66;69
"0350042F";"Lycée général et technologique Maupertuis";"BRETAGNE";"dont apprentis";;;;;;;
"0350048M";"Lycée polyvalent Jacques Cartier";"BRETAGNE";"ensemble";34;44;46;-2;57;51;67
"0350050P";"Lycée professionnel Bel Air - Lycée des métiers de la logistique, du transport et de la maintenance des véhicules";"BRETAGNE";"ensemble";39;57;54;4;65;64;69
"0350053T";"Lycée général et technologique Bertrand d'Argentré";"BRETAGNE";"ensemble";22;51;55;-4;65;62;68
"0350059Z";"Lycée professionnel Bréquigny";"BRETAGNE";"ensemble";42;49;42;7;44;51;53
"0350062C";"Lycée professionnel Maupertuis";"BRETAGNE";"ensemble";47;32;37;-4;49;45;58
"0350102W";"Lycée professionnel Beaumont - Lycée des métiers des services - Lycée des métiers de l'industrie et de l'habitat";"BRETAGNE";"ensemble";50;41;35;6;45;46;57
"0350709F";"Lycée professionnel La Champagne - Lycée des métiers";"BRETAGNE";"ensemble";48;57;50;7;60;62;69
"0350709F";"Lycée professionnel La Champagne - Lycée des métiers";"BRETAGNE";"dont élèves en voie pro sco";51;51;46;6;53;57;65
"0350709F";"Lycée professionnel La Champagne - Lycée des métiers";"BRETAGNE";"dont apprentis";20;;;;;;
"0350710G";"Lycée général François-René de Chateaubriand";"BRETAGNE";"ensemble";;;;;;;
"0350732F";"Etablissement régional d'enseignement adapté Jean Bart";"BRETAGNE";"ensemble";51;29;34;-5;33;33;46
"0350747X";"Etablissement régional d'enseignement adapté Magda Hollander-Lafon";"BRETAGNE";"ensemble";22;26;34;-7;33;38;40
"0350761M";"Lycée professionnel Jean Guéhenno";"BRETAGNE";"ensemble";52;39;45;-6;42;46;46
"0350761M";"Lycée professionnel Jean Guéhenno";"BRETAGNE";"dont élèves en voie pro sco";55;34;38;-4;37;38;41
"0350761M";"Lycée professionnel Jean Guéhenno";"BRETAGNE";"dont apprentis";;;;;;;
"0350769W";"Lycée polyvalent privé Jean-Baptiste Le Taillandier - Lycée des métiers de la vente et du commerce";"BRETAGNE";"ensemble";39;55;51;4;61;60;69
"0350774B";"Lycée général et technologique privé Saint Sauveur";"BRETAGNE";"ensemble";10;57;56;1;74;74;77
"0350776D";"Lycée polyvalent privé Saint Vincent Providence";"BRETAGNE";"ensemble";50;30;27;3;50;35;35
"0350777E";"Lycée général et technologique privé Saint Martin";"BRETAGNE";"ensemble";9;60;50;9;65;46;69
"0350783L";"Collège et lycée général et technologique privés Saint Martin / Sainte Geneviève";"BRETAGNE";"ensemble";28;18;30;-12;43;43;46
"0350790U";"Lycée professionnel privé Notre-Dame";"BRETAGNE";"ensemble";54;40;43;-3;57;61;66
"0350791V";"Lycée polyvalent privé Marcel Callo - Lycée des métiers de l'industrie, de l'automobile et de l'aéronautique";"BRETAGNE";"ensemble";68;65;53;12;67;67;64
"0350793X";"Lycée polyvalent privé Frédéric Ozanam";"BRETAGNE";"ensemble";44;65;56;10;65;69;75
"0350795Z";"Lycée polyvalent privé de La Salle - Lycée des métiers de la gestion et du commerce";"BRETAGNE";"ensemble";34;62;58;4;67;67;72
"0350797B";"Lycée polyvalent privé Jeanne d'Arc - Lycée des métiers du tourisme - Lycée des métiers du secteur sanitaire et de l'intervention sociale";"BRETAGNE";"ensemble";20;43;52;-9;55;52;59
"0350807M";"Lycée professionnel privé Notre Dame - Lycée des métiers de la restauration et du service";"BRETAGNE";"ensemble";57;53;58;-5;67;61;73
"0350808N";"Lycée polyvalent privé Sainte Jeanne d'Arc - Lycée des métiers des systèmes électroniques";"BRETAGNE";"ensemble";66;54;50;4;61;60;66
"0351054F";"Lycée professionnel Charles Tillon";"BRETAGNE";"ensemble";62;54;57;-3;51;56;58
"0351054F";"Lycée professionnel Charles Tillon";"BRETAGNE";"dont élèves en voie pro sco";70;36;40;-4;31;45;46
"0351054F";"Lycée professionnel Charles Tillon";"BRETAGNE";"dont apprentis";38;80;81;-1;80;72;75
"0351878B";"Lycée professionnel Coetlogon";"BRETAGNE";"ensemble";53;39;40;-1;42;46;49
"0351878B";"Lycée professionnel Coetlogon";"BRETAGNE";"dont élèves en voie pro sco";55;39;39;0;41;44;49
"0351878B";"Lycée professionnel Coetlogon";"BRETAGNE";"dont apprentis";22;39;52;-12;50;57;39
"0351907H";"Lycée général et technologique René Descartes";"BRETAGNE";"ensemble";32;65;65;1;72;70;78
"0351930H";"Lycée polyvalent privé La Providence";"BRETAGNE";"ensemble";;;;;;;
"0352009U";"Lycée général et technologique Victor et Hélène Basch";"BRETAGNE";"ensemble";26;58;60;-2;65;59;72
"0352072M";"Lycée polyvalent privé Institution Saint-Malo - La Providence";"BRETAGNE";"ensemble";39;35;47;-12;59;44;63
"0352446U";"Lycée professionnel privé Sainte Thérèse - Lycée des métiers de la restauration et de l'hôtellerie";"BRETAGNE";"ensemble";53;53;61;-7;67;66;71
"0360003H";"Lycée professionnel Chateauneuf";"CENTRE-VAL DE LOIRE";"ensemble";44;37;41;-4;48;48;53
"0360003H";"Lycée professionnel Chateauneuf";"CENTRE-VAL DE LOIRE";"dont élèves en voie pro sco";44;32;39;-6;46;46;50
"0360003H";"Lycée professionnel Chateauneuf";"CENTRE-VAL DE LOIRE";"dont apprentis";;;;;;;
"0360005K";"Lycée polyvalent Pasteur";"CENTRE-VAL DE LOIRE";"ensemble";52;48;47;1;50;50;63
"0360005K";"Lycée polyvalent Pasteur";"CENTRE-VAL DE LOIRE";"dont élèves en voie pro sco";53;40;42;-2;42;46;60
"0360005K";"Lycée polyvalent Pasteur";"CENTRE-VAL DE LOIRE";"dont apprentis";;;;;;;
"0360009P";"Lycée général et technologique Pierre et Marie Curie";"CENTRE-VAL DE LOIRE";"ensemble";26;35;47;-12;38;38;53
"0360011S";"Lycée professionnel Les Charmilles - Lycée des métiers des services à la personne et du tertiaire";"CENTRE-VAL DE LOIRE";"ensemble";37;23;30;-7;26;30;35
"0360019A";"Lycée polyvalent George Sand";"CENTRE-VAL DE LOIRE";"ensemble";34;20;31;-11;26;35;38
"0360024F";"Lycée polyvalent Balzac-D'Alembert - Lycée des métiers du cuir, de la logistique et du transport";"CENTRE-VAL DE LOIRE";"ensemble";39;50;48;3;58;58;58
"0360024F";"Lycée polyvalent Balzac-D'Alembert - Lycée des métiers du cuir, de la logistique et du transport";"CENTRE-VAL DE LOIRE";"dont élèves en voie pro sco";40;50;47;4;58;60;58
"0360024F";"Lycée polyvalent Balzac-D'Alembert - Lycée des métiers du cuir, de la logistique et du transport";"CENTRE-VAL DE LOIRE";"dont apprentis";;;;;;;
"0360043B";"Lycée polyvalent Blaise Pascal";"CENTRE-VAL DE LOIRE";"ensemble";40;55;55;1;57;66;64
"0360043B";"Lycée polyvalent Blaise Pascal";"CENTRE-VAL DE LOIRE";"dont élèves en voie pro sco";43;51;50;2;54;64;63
"0360043B";"Lycée polyvalent Blaise Pascal";"CENTRE-VAL DE LOIRE";"dont apprentis";20;79;81;-2;71;79;71
"0360050J";"Etablissement régional d'enseignement adapté Eric Tabarly";"CENTRE-VAL DE LOIRE";"ensemble";30;15;21;-6;13;11;15
"0360505D";"Lycée polyvalent privé Saint Cyr";"CENTRE-VAL DE LOIRE";"ensemble";42;;;;;;
"0360693H";"Lycée polyvalent privé Sainte Solange";"CENTRE-VAL DE LOIRE";"ensemble";54;;;;;;
"0370009J";"Lycée polyvalent François Rabelais";"CENTRE-VAL DE LOIRE";"ensemble";28;59;56;3;65;65;66
"0370009J";"Lycée polyvalent François Rabelais";"CENTRE-VAL DE LOIRE";"dont élèves en voie pro sco";28;56;53;3;62;61;64
"0370009J";"Lycée polyvalent François Rabelais";"CENTRE-VAL DE LOIRE";"dont apprentis";;;;;;;
"0370016S";"Lycée polyvalent Thérèse Planiol - Lycée des métiers du service et de la production";"CENTRE-VAL DE LOIRE";"ensemble";36;33;37;-3;41;47;50
"0370016S";"Lycée polyvalent Thérèse Planiol - Lycée des métiers du service et de la production";"CENTRE-VAL DE LOIRE";"dont élèves en voie pro sco";36;34;36;-2;41;47;50
"0370016S";"Lycée polyvalent Thérèse Planiol - Lycée des métiers du service et de la production";"CENTRE-VAL DE LOIRE";"dont apprentis";;;;;;;
"0370032J";"Lycée professionnel François Clouet - Lycée des métiers de la mode et des services";"CENTRE-VAL DE LOIRE";"ensemble";43;33;31;2;38;36;46
"0370036N";"Lycée général et technologique Balzac";"CENTRE-VAL DE LOIRE";"ensemble";30;69;59;9;62;60;64
"0370037P";"Lycée général et technologique Choiseul";"CENTRE-VAL DE LOIRE";"ensemble";32;59;58;1;57;60;61
"0370038R";"Lycée général et technologique Grandmont";"CENTRE-VAL DE LOIRE";"ensemble";40;59;61;-2;71;69;69
"0370038R";"Lycée général et technologique Grandmont";"CENTRE-VAL DE LOIRE";"dont élèves en voie pro sco";41;57;59;-2;68;69;67
"0370038R";"Lycée général et technologique Grandmont";"CENTRE-VAL DE LOIRE";"dont apprentis";30;71;77;-5;86;71;82
"0370039S";"Lycée général et technologique Paul-Louis Courier";"CENTRE-VAL DE LOIRE";"ensemble";37;63;57;6;68;68;69
"0370040T";"L.P. Albert Bayet - Lycée des métiers de l'hôtellerie restauration, de l'automobile et de la logistique et des industries graphiques et plurimédia";"CENTRE-VAL DE LOIRE";"ensemble";40;38;44;-7;48;47;50
"0370040T";"L.P. Albert Bayet - Lycée des métiers de l'hôtellerie restauration, de l'automobile et de la logistique et des industries graphiques et plurimédia";"CENTRE-VAL DE LOIRE";"dont élèves en voie pro sco";42;33;41;-8;46;44;48
"0370040T";"L.P. Albert Bayet - Lycée des métiers de l'hôtellerie restauration, de l'automobile et de la logistique et des industries graphiques et plurimédia";"CENTRE-VAL DE LOIRE";"dont apprentis";21;61;63;-2;63;63;59
"0370053G";"Lycée professionnel Gustave Eiffel - Lycée des métiers de l'industrie";"CENTRE-VAL DE LOIRE";"ensemble";57;30;36;-5;39;43;50
"0370054H";"Lycée professionnel Martin Nadaud - Lycée des métiers de l'architecture, de la construction et de l'énergie";"CENTRE-VAL DE LOIRE";"ensemble";43;63;52;11;64;73;76
"0370054H";"Lycée professionnel Martin Nadaud - Lycée des métiers de l'architecture, de la construction et de l'énergie";"CENTRE-VAL DE LOIRE";"dont élèves en voie pro sco";49;56;44;12;55;69;71
"0370054H";"Lycée professionnel Martin Nadaud - Lycée des métiers de l'architecture, de la construction et de l'énergie";"CENTRE-VAL DE LOIRE";"dont apprentis";20;81;75;6;85;81;88
"0370728R";"Lycée général et technologique privé Notre Dame La Riche - Lycée des métiers du commerce et de l'informatique, sous le patronage de St-François";"CENTRE-VAL DE LOIRE";"ensemble";9;47;55;-8;62;47;77
"0370731U";"Lycée général et technologique privé Sainte Ursule";"CENTRE-VAL DE LOIRE";"ensemble";8;28;40;-12;50;50;67
"0370748M";"Lycée polyvalent privé St-Gatien - Lycée des métiers de l'habitat et de la construction";"CENTRE-VAL DE LOIRE";"ensemble";43;68;56;12;68;63;67
"0370749N";"Lycée général et technologique privé Sainte-Marguerite";"CENTRE-VAL DE LOIRE";"ensemble";22;50;57;-7;61;57;61
"0370757X";"Lycée professionnel privé Notre Dame La Riche, sous le patronage de Saint Vincent de Paul";"CENTRE-VAL DE LOIRE";"ensemble";57;42;38;5;46;50;60
"0370771M";"Lycée professionnel Victor Laloux - Lycée des métiers de la distribution et des services";"CENTRE-VAL DE LOIRE";"ensemble";48;40;38;2;45;52;55
"0370771M";"Lycée professionnel Victor Laloux - Lycée des métiers de la distribution et des services";"CENTRE-VAL DE LOIRE";"dont élèves en voie pro sco";49;36;35;1;40;49;51
"0370771M";"Lycée professionnel Victor Laloux - Lycée des métiers de la distribution et des services";"CENTRE-VAL DE LOIRE";"dont apprentis";29;71;59;12;83;75;79
"0370881G";"Lycée général et technologique privé Marmoutier";"CENTRE-VAL DE LOIRE";"ensemble";18;38;50;-12;48;45;60
"0370888P";"Lycée professionnel d'Arsonval - Lycée des métiers d'art, de l'aménagement de l'espace et de la communication";"CENTRE-VAL DE LOIRE";"ensemble";58;36;40;-5;40;48;53
"0371099U";"Lycée professionnel Henri Becquerel - Lycée des métiers de l'électricité";"CENTRE-VAL DE LOIRE";"ensemble";56;34;35;-2;36;39;40
"0371100V";"Lycée professionnel Joseph Cugnot - Lycée des métiers de l'industrie et des services";"CENTRE-VAL DE LOIRE";"ensemble";39;36;41;-5;56;48;56
"0371123V";"Lycée professionnel Jean Chaptal";"CENTRE-VAL DE LOIRE";"ensemble";37;38;41;-3;44;37;50
"0371123V";"Lycée professionnel Jean Chaptal";"CENTRE-VAL DE LOIRE";"dont élèves en voie pro sco";38;33;37;-5;40;32;47
"0371123V";"Lycée professionnel Jean Chaptal";"CENTRE-VAL DE LOIRE";"dont apprentis";30;;;;;;
"0371184L";"Lycée polyvalent privé Saint Gilles";"CENTRE-VAL DE LOIRE";"ensemble";31;56;44;12;56;67;59
"0371211R";"Lycée professionnel Beauregard - Lycée des métiers du tertiaire, de la maintenance et de l'électrotechnique";"CENTRE-VAL DE LOIRE";"ensemble";60;23;32;-8;28;40;42
"0371328T";"Lycée professionnel privé Sainte-Ursule";"CENTRE-VAL DE LOIRE";"ensemble";24;36;31;5;50;45;53
"0371417P";"Lycée général et technologique Jean Monnet";"CENTRE-VAL DE LOIRE";"ensemble";75;;;;;;
"0371418R";"Lycée général et technologique Jacques de Vaucanson";"CENTRE-VAL DE LOIRE";"ensemble";62;50;54;-4;46;46;54
"0371532P";"Lycée polyvalent privé Esthétique de Touraine";"CENTRE-VAL DE LOIRE";"ensemble";29;55;64;-9;72;68;79
"0380008C";"Lycée général et technologique L'Oiselet";"AUVERGNE-RHONE-ALPES";"ensemble";32;71;63;8;76;76;76
"0380008C";"Lycée général et technologique L'Oiselet";"AUVERGNE-RHONE-ALPES";"dont élèves en voie pro sco";38;69;61;8;76;77;73
"0380008C";"Lycée général et technologique L'Oiselet";"AUVERGNE-RHONE-ALPES";"dont apprentis";18;76;68;8;78;73;80
"0380010E";"Lycée professionnel Gambetta";"AUVERGNE-RHONE-ALPES";"ensemble";50;41;38;3;47;40;49
"0380010E";"Lycée professionnel Gambetta";"AUVERGNE-RHONE-ALPES";"dont élèves en voie pro sco";50;42;38;3;46;39;49
"0380010E";"Lycée professionnel Gambetta";"AUVERGNE-RHONE-ALPES";"dont apprentis";;;;;;;
"0380014J";"Lycée polyvalent Hector Berlioz";"AUVERGNE-RHONE-ALPES";"ensemble";43;41;36;5;40;48;54
"0380014J";"Lycée polyvalent Hector Berlioz";"AUVERGNE-RHONE-ALPES";"dont élèves en voie pro sco";44;39;34;4;37;43;51
"0380014J";"Lycée polyvalent Hector Berlioz";"AUVERGNE-RHONE-ALPES";"dont apprentis";37;;;;;;
"0380018N";"Lycée technologique privé Iser - Lycée des métiers du commerce, du social et des services à la personne";"AUVERGNE-RHONE-ALPES";"ensemble";36;56;58;-2;54;61;68
"0380023U";"Lycée professionnel Jacques Prévert";"AUVERGNE-RHONE-ALPES";"ensemble";54;40;37;3;42;48;51
"0380033E";"Lycée polyvalent Vaucanson";"AUVERGNE-RHONE-ALPES";"ensemble";51;58;50;7;57;63;68
"0380034F";"Lycée polyvalent Louise Michel - Lycée des métiers au service de la vie et des organisations";"AUVERGNE-RHONE-ALPES";"ensemble";40;51;52;-1;52;53;54
"0380034F";"Lycée polyvalent Louise Michel - Lycée des métiers au service de la vie et des organisations";"AUVERGNE-RHONE-ALPES";"dont élèves en voie pro sco";45;52;52;0;52;53;54
"0380034F";"Lycée polyvalent Louise Michel - Lycée des métiers au service de la vie et des organisations";"AUVERGNE-RHONE-ALPES";"dont apprentis";13;46;51;-5;52;51;55
"0380035G";"Lycéé polyvalent Lesdiguiéres - Lycée des métiers de l' hôtellerie et du tourisme";"AUVERGNE-RHONE-ALPES";"ensemble";48;59;54;5;66;58;67
"0380036H";"Lycée professionnel Guynemer - Lycée des métiers de l' automobile de la maintenance des engins et des équipements";"AUVERGNE-RHONE-ALPES";"ensemble";48;51;52;-1;50;58;50
"0380036H";"Lycée professionnel Guynemer - Lycée des métiers de l' automobile de la maintenance des engins et des équipements";"AUVERGNE-RHONE-ALPES";"dont élèves en voie pro sco";46;51;50;1;50;56;48
"0380036H";"Lycée professionnel Guynemer - Lycée des métiers de l' automobile de la maintenance des engins et des équipements";"AUVERGNE-RHONE-ALPES";"dont apprentis";60;;;;;;
"0380037J";"Lycée professionnel Jean Jaurès";"AUVERGNE-RHONE-ALPES";"ensemble";48;40;40;0;38;48;46
"0380049X";"Lycée polyvalent de la matheysine";"AUVERGNE-RHONE-ALPES";"ensemble";36;44;41;4;56;53;61
"0380053B";"Lycée polyvalent Charles Gabriel Pravaz";"AUVERGNE-RHONE-ALPES";"ensemble";50;50;38;12;58;57;61
"0380063M";"Lycée polyvalent La Saulaie";"AUVERGNE-RHONE-ALPES";"ensemble";48;37;43;-5;47;41;51
"0380063M";"Lycée polyvalent La Saulaie";"AUVERGNE-RHONE-ALPES";"dont élèves en voie pro sco";54;32;39;-7;45;40;45
"0380063M";"Lycée polyvalent La Saulaie";"AUVERGNE-RHONE-ALPES";"dont apprentis";23;50;51;-1;50;42;67
"0380073Y";"Lycée polyvalent Elie Cartan - Lycée des métiers des équipements industriels et du textile";"AUVERGNE-RHONE-ALPES";"ensemble";46;49;38;11;42;51;49
"0380073Y";"Lycée polyvalent Elie Cartan - Lycée des métiers des équipements industriels et du textile";"AUVERGNE-RHONE-ALPES";"dont élèves en voie pro sco";44;46;36;10;41;49;49
"0380073Y";"Lycée polyvalent Elie Cartan - Lycée des métiers des équipements industriels et du textile";"AUVERGNE-RHONE-ALPES";"dont apprentis";;;;;;;
"0380081G";"Lycée polyvalent Ella Fitzgerald";"AUVERGNE-RHONE-ALPES";"ensemble";43;45;47;-2;48;53;58
"0380081G";"Lycée polyvalent Ella Fitzgerald";"AUVERGNE-RHONE-ALPES";"dont élèves en voie pro sco";44;44;46;-2;47;53;58
