"0340833W";"Etablissement régional d'enseignement adapté Jean-Jacques Rousseau";"OCCITANIE";"ensemble";40;25;21;4;36
"0340871M";"Lycée général et technologique privé La Trinité";"OCCITANIE";"ensemble";29;36;48;-12;56
"0340920R";"Lycée professionnel privé Turgot, lycée des métiers de la santé et du social";"OCCITANIE";"ensemble";49;29;29;0;41
"0340923U";"Lycée professionnel privé Le Parterre";"OCCITANIE";"ensemble";41;34;22;12;37
"0340991T";"Lycée polyvalent privé Nevers";"OCCITANIE";"ensemble";52;55;43;12;65
"0340992U";"Lycée professionnel privé le Sacré-Coeur";"OCCITANIE";"ensemble";60;24;29;-5;47
"0341385W";"Lycée professionnel Léonard de Vinci, lycée des métiers de la construction écologique, durable et innovante";"OCCITANIE";"ensemble";50;38;37;1;42
"0341385W";"Lycée professionnel Léonard de Vinci, lycée des métiers de la construction écologique, durable et innovante";"OCCITANIE";"dont élèves en voie pro sco";54;32;28;4;37
"0341385W";"Lycée professionnel Léonard de Vinci, lycée des métiers de la construction écologique, durable et innovante";"OCCITANIE";"dont apprentis";22;60;68;-9;60
"0341521U";"Lycée polyvalent privé Saint-Joseph Pierre Rouge";"OCCITANIE";"ensemble";61;25;33;-8;20
"0341523W";"Lycée polyvalent privé Saint Joseph";"OCCITANIE";"ensemble";58;36;42;-6;45
"0341736C";"Lycée général et technologique Jean Monnet";"OCCITANIE";"ensemble";49;44;45;0;59
"0341765J";"Lycée général et technologique privé Rabelais";"OCCITANIE";"ensemble";23;56;50;6;56
"0341794R";"Lycée polyvalent Jean-François Champollion, Lycée des métiers de la communication et des usages du numérique";"OCCITANIE";"ensemble";54;34;37;-2;40
"0341794R";"Lycée polyvalent Jean-François Champollion, Lycée des métiers de la communication et des usages du numérique";"OCCITANIE";"dont élèves en voie pro sco";59;24;30;-6;31
"0341794R";"Lycée polyvalent Jean-François Champollion, Lycée des métiers de la communication et des usages du numérique";"OCCITANIE";"dont apprentis";19;74;62;12;74
"0341921D";"Lycée polyvalent Georges Pompidou";"OCCITANIE";"ensemble";46;40;36;4;50
"0341921D";"Lycée polyvalent Georges Pompidou";"OCCITANIE";"dont élèves en voie pro sco";46;41;36;4;51
"0341921D";"Lycée polyvalent Georges Pompidou";"OCCITANIE";"dont apprentis";;;;;
"0342066L";"Lycée polyvalent Jean Jaurès, Lycée des métiers de la santé et du social";"OCCITANIE";"ensemble";55;43;34;9;50
"0342073U";"IRTS Montpellier, Lycée privé enseignement technique";"OCCITANIE";"ensemble";60;43;38;5;43
"0342090M";"Lycée polyvalent victor Hugo";"OCCITANIE";"ensemble";42;33;26;7;47
"0342091N";"Lycée polyvalent Marc Bloch";"OCCITANIE";"ensemble";50;35;39;-4;51
"0342175E";"Lycée polyvalent privé La Merci Littoral";"OCCITANIE";"ensemble";41;41;33;9;68
"0342225J";"Lycée polyvalent Georges Frêche,  lycée des métiers de la gastronomie, de l'hôtellerie et du tourisme";"OCCITANIE";"ensemble";45;38;41;-3;56
"0342225J";"Lycée polyvalent Georges Frêche,  lycée des métiers de la gastronomie, de l'hôtellerie et du tourisme";"OCCITANIE";"dont élèves en voie pro sco";47;37;40;-3;57
"0342225J";"Lycée polyvalent Georges Frêche,  lycée des métiers de la gastronomie, de l'hôtellerie et du tourisme";"OCCITANIE";"dont apprentis";29;46;48;-2;56
"0350005R";"Lycée polyvalent Yvon-Bourges";"BRETAGNE";"ensemble";50;51;50;1;73
"0350005R";"Lycée polyvalent Yvon-Bourges";"BRETAGNE";"dont élèves en voie pro sco";51;51;50;1;72
"0350005R";"Lycée polyvalent Yvon-Bourges";"BRETAGNE";"dont apprentis";;;;;
"0350009V";"Lycée professionnel Alphonse Pellé";"BRETAGNE";"ensemble";57;30;37;-7;45
"0350011X";"Lycée général et technologique Jean Guéhenno";"BRETAGNE";"ensemble";33;61;59;3;66
"0350022J";"Lycée général et technologique Beaumont";"BRETAGNE";"ensemble";16;64;56;7;68
"0350026N";"Lycée général et technologique Jean Macé";"BRETAGNE";"ensemble";55;43;55;-12;57
"0350028R";"Lycée général et technologique Bréquigny";"BRETAGNE";"ensemble";41;56;54;3;63
"0350029S";"Lycée général et technologique Joliot-Curie";"BRETAGNE";"ensemble";33;61;56;5;71
"0350030T";"Lycée polyvalent Pierre Mendès-France - Lycée des métiers du bâtiment et de l'énergétique";"BRETAGNE";"ensemble";57;54;52;2;54
"0350030T";"Lycée polyvalent Pierre Mendès-France - Lycée des métiers du bâtiment et de l'énergétique";"BRETAGNE";"dont élèves en voie pro sco";61;46;45;1;49
"0350030T";"Lycée polyvalent Pierre Mendès-France - Lycée des métiers du bâtiment et de l'énergétique";"BRETAGNE";"dont apprentis";36;88;80;8;76
"0350031U";"Lycée professionnel Jean Jaurès - Lycée des métiers";"BRETAGNE";"ensemble";62;52;40;12;55
"0350032V";"Lycée professionnel Louis Guilloux - Lycée des métiers de l'hôtellerie-restauration - Lycée des métiers de la mode";"BRETAGNE";"ensemble";59;41;41;0;42
"0350032V";"Lycée professionnel Louis Guilloux - Lycée des métiers de l'hôtellerie-restauration - Lycée des métiers de la mode";"BRETAGNE";"dont élèves en voie pro sco";59;40;40;0;42
"0350032V";"Lycée professionnel Louis Guilloux - Lycée des métiers de l'hôtellerie-restauration - Lycée des métiers de la mode";"BRETAGNE";"dont apprentis";;;;;
"0350042F";"Lycée général et technologique Maupertuis";"BRETAGNE";"ensemble";35;48;54;-6;55
"0350042F";"Lycée général et technologique Maupertuis";"BRETAGNE";"dont élèves en voie pro sco";36;45;51;-5;51
"0350042F";"Lycée général et technologique Maupertuis";"BRETAGNE";"dont apprentis";;;;;
"0350048M";"Lycée polyvalent Jacques Cartier";"BRETAGNE";"ensemble";42;46;42;5;64
"0350050P";"Lycée professionnel Bel Air - Lycée des métiers de la logistique, du transport et de la maintenance des véhicules";"BRETAGNE";"ensemble";38;57;49;8;64
"0350053T";"Lycée général et technologique Bertrand d'Argentré";"BRETAGNE";"ensemble";33;54;53;0;65
"0350059Z";"Lycée professionnel Bréquigny";"BRETAGNE";"ensemble";41;43;36;7;49
"0350062C";"Lycée professionnel Maupertuis";"BRETAGNE";"ensemble";48;35;33;2;38
"0350102W";"Lycée professionnel Beaumont - Lycée des métiers des services - Lycée des métiers de l'industrie et de l'habitat";"BRETAGNE";"ensemble";46;33;32;1;45
"0350709F";"Lycée professionnel La Champagne - Lycée des métiers";"BRETAGNE";"ensemble";44;54;48;6;60
"0350709F";"Lycée professionnel La Champagne - Lycée des métiers";"BRETAGNE";"dont élèves en voie pro sco";49;48;43;5;54
"0350709F";"Lycée professionnel La Champagne - Lycée des métiers";"BRETAGNE";"dont apprentis";0;83;73;10;88
"0350710G";"Lycée général François-René de Chateaubriand";"BRETAGNE";"ensemble";;;;;
"0350732F";"Etablissement régional d'enseignement adapté Jean Bart";"BRETAGNE";"ensemble";50;33;31;2;46
"0350747X";"Etablissement régional d'enseignement adapté Magda Hollander-Lafon";"BRETAGNE";"ensemble";28;33;36;-3;33
"0350761M";"Lycée professionnel Jean Guéhenno";"BRETAGNE";"ensemble";53;42;46;-4;44
"0350761M";"Lycée professionnel Jean Guéhenno";"BRETAGNE";"dont élèves en voie pro sco";58;32;36;-4;37
"0350761M";"Lycée professionnel Jean Guéhenno";"BRETAGNE";"dont apprentis";19;73;79;-6;68
"0350769W";"Lycée polyvalent privé Jean-Baptiste Le Taillandier - Lycée des métiers de la vente et du commerce";"BRETAGNE";"ensemble";40;46;48;-2;55
"0350774B";"Lycée général et technologique privé Saint Sauveur";"BRETAGNE";"ensemble";31;61;51;10;79
"0350776D";"Lycée polyvalent privé Saint Vincent Providence";"BRETAGNE";"ensemble";63;;;;
"0350777E";"Lycée général et technologique privé Saint Martin";"BRETAGNE";"ensemble";22;65;53;12;74
"0350783L";"Collège et lycée général et technologique privés Saint Martin / Sainte Geneviève";"BRETAGNE";"ensemble";29;;;;
"0350790U";"Lycée professionnel privé Notre-Dame";"BRETAGNE";"ensemble";56;37;37;-1;51
"0350791V";"Lycée polyvalent privé Marcel Callo - Lycée des métiers de l'industrie, de l'automobile et de l'aéronautique";"BRETAGNE";"ensemble";70;51;46;5;62
"0350793X";"Lycée polyvalent privé Frédéric Ozanam";"BRETAGNE";"ensemble";53;57;51;7;67
"0350795Z";"Lycée polyvalent privé de La Salle - Lycée des métiers de la gestion et du commerce";"BRETAGNE";"ensemble";50;55;54;1;59
"0350797B";"Lycée polyvalent privé Jeanne d'Arc - Lycée des métiers du tourisme - Lycée des métiers du secteur sanitaire et de l'intervention sociale";"BRETAGNE";"ensemble";35;42;51;-9;55
"0350807M";"Lycée professionnel privé Notre Dame - Lycée des métiers de la restauration et du service";"BRETAGNE";"ensemble";59;55;52;2;69
"0350808N";"Lycée polyvalent privé Sainte Jeanne d'Arc - Lycée des métiers";"BRETAGNE";"ensemble";75;53;47;7;55
"0351054F";"Lycée professionnel Charles Tillon";"BRETAGNE";"ensemble";57;58;53;5;55
"0351054F";"Lycée professionnel Charles Tillon";"BRETAGNE";"dont élèves en voie pro sco";66;39;35;5;37
"0351054F";"Lycée professionnel Charles Tillon";"BRETAGNE";"dont apprentis";27;85;80;5;82
"0351878B";"Lycée professionnel Coetlogon";"BRETAGNE";"ensemble";51;30;34;-4;40
"0351878B";"Lycée professionnel Coetlogon";"BRETAGNE";"dont élèves en voie pro sco";52;30;33;-3;39
"0351878B";"Lycée professionnel Coetlogon";"BRETAGNE";"dont apprentis";36;;;;
"0351907H";"Lycée général et technologique René Descartes";"BRETAGNE";"ensemble";39;64;62;1;67
"0351930H";"Lycée polyvalent privé La Providence";"BRETAGNE";"ensemble";;;;;
"0352009U";"Lycée général et technologique Victor et Hélène Basch";"BRETAGNE";"ensemble";32;55;57;-2;61
"0352072M";"Lycée polyvalent privé Institution Saint-Malo - La Providence";"BRETAGNE";"ensemble";46;36;47;-11;61
"0352446U";"Lycée professionnel privé Sainte Thérèse - Lycée des métiers de la restauration et de l'hôtellerie";"BRETAGNE";"ensemble";62;56;55;1;63
"0360003H";"Lycée professionnel Chateauneuf";"CENTRE-VAL DE LOIRE";"ensemble";45;40;40;1;50
"0360003H";"Lycée professionnel Chateauneuf";"CENTRE-VAL DE LOIRE";"dont élèves en voie pro sco";48;31;34;-3;42
"0360003H";"Lycée professionnel Chateauneuf";"CENTRE-VAL DE LOIRE";"dont apprentis";25;83;71;12;88
"0360005K";"Lycée polyvalent Pasteur";"CENTRE-VAL DE LOIRE";"ensemble";45;41;41;1;55
"0360005K";"Lycée polyvalent Pasteur";"CENTRE-VAL DE LOIRE";"dont élèves en voie pro sco";45;33;35;-2;48
"0360005K";"Lycée polyvalent Pasteur";"CENTRE-VAL DE LOIRE";"dont apprentis";;;;;
"0360009P";"Lycée général et technologique Pierre et Marie Curie";"CENTRE-VAL DE LOIRE";"ensemble";38;43;55;-12;36
"0360011S";"Lycée professionnel Les Charmilles - Lycée des métiers des services à la personne et du tertiaire";"CENTRE-VAL DE LOIRE";"ensemble";39;23;27;-4;25
"0360019A";"Lycée polyvalent George Sand";"CENTRE-VAL DE LOIRE";"ensemble";43;20;29;-9;22
"0360024F";"Lycée polyvalent Balzac-D'Alembert - Lycée des métiers du cuir, de la logistique et du transport";"CENTRE-VAL DE LOIRE";"ensemble";38;48;44;3;58
"0360024F";"Lycée polyvalent Balzac-D'Alembert - Lycée des métiers du cuir, de la logistique et du transport";"CENTRE-VAL DE LOIRE";"dont élèves en voie pro sco";36;46;43;4;58
"0360024F";"Lycée polyvalent Balzac-D'Alembert - Lycée des métiers du cuir, de la logistique et du transport";"CENTRE-VAL DE LOIRE";"dont apprentis";;;;;
"0360043B";"Lycée polyvalent Blaise Pascal";"CENTRE-VAL DE LOIRE";"ensemble";41;48;53;-4;56
"0360043B";"Lycée polyvalent Blaise Pascal";"CENTRE-VAL DE LOIRE";"dont élèves en voie pro sco";46;41;46;-5;50
"0360043B";"Lycée polyvalent Blaise Pascal";"CENTRE-VAL DE LOIRE";"dont apprentis";5;78;80;-2;81
"0360050J";"Etablissement régional d'enseignement adapté Eric Tabarly";"CENTRE-VAL DE LOIRE";"ensemble";31;13;20;-7;21
"0360505D";"Lycée polyvalent privé Saint Cyr-Sainte Julitte";"CENTRE-VAL DE LOIRE";"ensemble";42;;;;
"0360693H";"Lycée polyvalent privé Sainte Solange";"CENTRE-VAL DE LOIRE";"ensemble";61;;;;
"0370009J";"Lycée polyvalent François Rabelais";"CENTRE-VAL DE LOIRE";"ensemble";27;57;53;4;65
"0370009J";"Lycée polyvalent François Rabelais";"CENTRE-VAL DE LOIRE";"dont élèves en voie pro sco";27;51;48;2;60
"0370009J";"Lycée polyvalent François Rabelais";"CENTRE-VAL DE LOIRE";"dont apprentis";30;;;;
"0370016S";"Lycée polyvalent Thérèse Planiol - Lycée des métiers du service et de la production";"CENTRE-VAL DE LOIRE";"ensemble";37;31;33;-1;45
"0370016S";"Lycée polyvalent Thérèse Planiol - Lycée des métiers du service et de la production";"CENTRE-VAL DE LOIRE";"dont élèves en voie pro sco";37;31;32;-1;44
"0370016S";"Lycée polyvalent Thérèse Planiol - Lycée des métiers du service et de la production";"CENTRE-VAL DE LOIRE";"dont apprentis";;;;;
"0370032J";"Lycée professionnel François Clouet - Lycée des métiers de la mode et des services";"CENTRE-VAL DE LOIRE";"ensemble";40;31;28;3;37
"0370036N";"Lycée général et technologique Balzac";"CENTRE-VAL DE LOIRE";"ensemble";34;73;61;12;68
"0370037P";"Lycée général et technologique Choiseul";"CENTRE-VAL DE LOIRE";"ensemble";37;56;55;0;55
"0370038R";"Lycée général et technologique Grandmont";"CENTRE-VAL DE LOIRE";"ensemble";37;61;58;3;67
"0370038R";"Lycée général et technologique Grandmont";"CENTRE-VAL DE LOIRE";"dont élèves en voie pro sco";37;59;55;4;64
"0370038R";"Lycée général et technologique Grandmont";"CENTRE-VAL DE LOIRE";"dont apprentis";36;73;78;-5;90
"0370039S";"Lycée général et technologique Paul-Louis Courier";"CENTRE-VAL DE LOIRE";"ensemble";40;48;49;-1;56
"0370040T";"L.P. Albert Bayet - Lycée des métiers de l'hôtellerie restauration, de l'automobile et de la logistique et des industries graphiques et plurimédia";"CENTRE-VAL DE LOIRE";"ensemble";44;33;40;-7;46
"0370040T";"L.P. Albert Bayet - Lycée des métiers de l'hôtellerie restauration, de l'automobile et de la logistique et des industries graphiques et plurimédia";"CENTRE-VAL DE LOIRE";"dont élèves en voie pro sco";46;31;36;-6;44
"0370040T";"L.P. Albert Bayet - Lycée des métiers de l'hôtellerie restauration, de l'automobile et de la logistique et des industries graphiques et plurimédia";"CENTRE-VAL DE LOIRE";"dont apprentis";29;48;60;-12;57
"0370053G";"Lycée professionnel Gustave Eiffel - Lycée des métiers de l'industrie";"CENTRE-VAL DE LOIRE";"ensemble";60;27;33;-6;39
"0370054H";"Lycée professionnel Martin Nadaud - Lycée des métiers de l'architecture, de la construction et de l'énergie";"CENTRE-VAL DE LOIRE";"ensemble";52;59;49;11;63
"0370054H";"Lycée professionnel Martin Nadaud - Lycée des métiers de l'architecture, de la construction et de l'énergie";"CENTRE-VAL DE LOIRE";"dont élèves en voie pro sco";55;54;42;12;54
"0370054H";"Lycée professionnel Martin Nadaud - Lycée des métiers de l'architecture, de la construction et de l'énergie";"CENTRE-VAL DE LOIRE";"dont apprentis";42;71;71;1;83
"0370728R";"Lycée général et technologique privé Notre Dame La Riche - Lycée des métiers du commerce et de l'informatique, sous le patronage de St-François";"CENTRE-VAL DE LOIRE";"ensemble";8;42;51;-9;55
"0370748M";"Lycée polyvalent privé St-Gatien - Lycée des métiers de l'habitat et de la construction";"CENTRE-VAL DE LOIRE";"ensemble";54;63;53;11;78
"0370749N";"Lycée général et technologique privé Sainte-Marguerite";"CENTRE-VAL DE LOIRE";"ensemble";35;51;54;-2;58
"0370757X";"Lycée professionnel privé Notre Dame La Riche, sous le patronage de Saint Vincent de Paul";"CENTRE-VAL DE LOIRE";"ensemble";56;38;33;4;44
"0370771M";"Lycée professionnel Victor Laloux - Lycée des métiers de la distribution et des services";"CENTRE-VAL DE LOIRE";"ensemble";53;35;33;2;44
"0370771M";"Lycée professionnel Victor Laloux - Lycée des métiers de la distribution et des services";"CENTRE-VAL DE LOIRE";"dont élèves en voie pro sco";55;29;30;-1;39
"0370771M";"Lycée professionnel Victor Laloux - Lycée des métiers de la distribution et des services";"CENTRE-VAL DE LOIRE";"dont apprentis";38;74;62;12;78
"0370881G";"Lycée général et technologique privé Marmoutier";"CENTRE-VAL DE LOIRE";"ensemble";14;50;58;-8;57
"0370888P";"Lycée professionnel d'Arsonval - Lycée des métiers d'art, de l'aménagement de l'espace et de la communication";"CENTRE-VAL DE LOIRE";"ensemble";57;38;37;1;44
"0371099U";"Lycée professionnel Henri Becquerel - Lycée des métiers de l'électricité";"CENTRE-VAL DE LOIRE";"ensemble";60;20;31;-11;28
"0371100V";"Lycée professionnel Joseph Cugnot - Lycée des métiers de l'industrie et des services";"CENTRE-VAL DE LOIRE";"ensemble";42;42;38;4;56
"0371123V";"Lycée professionnel Jean Chaptal";"CENTRE-VAL DE LOIRE";"ensemble";46;30;36;-6;41
"0371123V";"Lycée professionnel Jean Chaptal";"CENTRE-VAL DE LOIRE";"dont élèves en voie pro sco";47;26;31;-5;37
"0371123V";"Lycée professionnel Jean Chaptal";"CENTRE-VAL DE LOIRE";"dont apprentis";37;;;;
"0371211R";"Lycée professionnel Beauregard - Lycée des métiers du tertiaire, de la maintenance et de l'électrotechnique";"CENTRE-VAL DE LOIRE";"ensemble";59;19;28;-10;34
"0371328T";"Lycée professionnel privé Sainte-Ursule";"CENTRE-VAL DE LOIRE";"ensemble";33;14;26;-12;39
"0371417P";"Lycée général et technologique Jean Monnet";"CENTRE-VAL DE LOIRE";"ensemble";72;;;;
"0371418R";"Lycée général et technologique Jacques de Vaucanson";"CENTRE-VAL DE LOIRE";"ensemble";49;38;50;-12;42
"0371532P";"Lycée polyvalent privé Esthétique de Touraine";"CENTRE-VAL DE LOIRE";"ensemble";30;52;61;-9;66
"0380008C";"Lycée général et technologique L'Oiselet";"AUVERGNE-RHONE-ALPES";"ensemble";35;76;64;12;80
"0380008C";"Lycée général et technologique L'Oiselet";"AUVERGNE-RHONE-ALPES";"dont élèves en voie pro sco";36;72;60;12;75
"0380008C";"Lycée général et technologique L'Oiselet";"AUVERGNE-RHONE-ALPES";"dont apprentis";34;84;72;12;91
"0380010E";"Lycée professionnel Gambetta";"AUVERGNE-RHONE-ALPES";"ensemble";49;40;35;5;49
"0380010E";"Lycée professionnel Gambetta";"AUVERGNE-RHONE-ALPES";"dont élèves en voie pro sco";49;39;35;4;49
"0380010E";"Lycée professionnel Gambetta";"AUVERGNE-RHONE-ALPES";"dont apprentis";;;;;
"0380014J";"Lycée polyvalent Hector Berlioz";"AUVERGNE-RHONE-ALPES";"ensemble";49;42;37;5;43
"0380014J";"Lycée polyvalent Hector Berlioz";"AUVERGNE-RHONE-ALPES";"dont élèves en voie pro sco";49;39;36;3;40
"0380014J";"Lycée polyvalent Hector Berlioz";"AUVERGNE-RHONE-ALPES";"dont apprentis";50;;;;
"0380018N";"Lycée technologique privé Iser - Lycée des métiers du commerce, du social et des services à la personne";"AUVERGNE-RHONE-ALPES";"ensemble";49;49;54;-6;49
"0380023U";"Lycée professionnel Jacques Prévert";"AUVERGNE-RHONE-ALPES";"ensemble";55;37;35;2;40
"0380033E";"Lycée polyvalent Vaucanson";"AUVERGNE-RHONE-ALPES";"ensemble";55;54;48;6;62
"0380034F";"Lycée polyvalent Louise Michel - Lycée des métiers au service de la vie et des organisations";"AUVERGNE-RHONE-ALPES";"ensemble";44;48;48;0;54
"0380034F";"Lycée polyvalent Louise Michel - Lycée des métiers au service de la vie et des organisations";"AUVERGNE-RHONE-ALPES";"dont élèves en voie pro sco";47;50;47;3;56
"0380034F";"Lycée polyvalent Louise Michel - Lycée des métiers au service de la vie et des organisations";"AUVERGNE-RHONE-ALPES";"dont apprentis";13;39;51;-12;47
"0380035G";"Lycéé polyvalent Lesdiguiéres - Lycée des métiers de l'hôtellerie et du tourisme";"AUVERGNE-RHONE-ALPES";"ensemble";47;56;51;5;62
"0380035G";"Lycéé polyvalent Lesdiguiéres - Lycée des métiers de l'hôtellerie et du tourisme";"AUVERGNE-RHONE-ALPES";"dont élèves en voie pro sco";48;55;51;5;62
"0380035G";"Lycéé polyvalent Lesdiguiéres - Lycée des métiers de l'hôtellerie et du tourisme";"AUVERGNE-RHONE-ALPES";"dont apprentis";;;;;
"0380036H";"Lycée professionnel Guynemer - Lycée des métiers de l'automobile de la maintenance des engins et des équipements";"AUVERGNE-RHONE-ALPES";"ensemble";42;46;49;-3;53
"0380036H";"Lycée professionnel Guynemer - Lycée des métiers de l'automobile de la maintenance des engins et des équipements";"AUVERGNE-RHONE-ALPES";"dont élèves en voie pro sco";41;45;46;0;53
"0380036H";"Lycée professionnel Guynemer - Lycée des métiers de l'automobile de la maintenance des engins et des équipements";"AUVERGNE-RHONE-ALPES";"dont apprentis";47;;;;
"0380037J";"Lycée professionnel Jean Jaurès";"AUVERGNE-RHONE-ALPES";"ensemble";49;42;36;7;44
"0380049X";"Lycée polyvalent de la matheysine";"AUVERGNE-RHONE-ALPES";"ensemble";48;35;37;-2;47
"0380053B";"Lycée polyvalent Charles Gabriel Pravaz";"AUVERGNE-RHONE-ALPES";"ensemble";53;55;43;12;55
"0380063M";"Lycée polyvalent La Saulaie";"AUVERGNE-RHONE-ALPES";"ensemble";45;43;39;4;55
"0380063M";"Lycée polyvalent La Saulaie";"AUVERGNE-RHONE-ALPES";"dont élèves en voie pro sco";50;38;36;1;53
"0380063M";"Lycée polyvalent La Saulaie";"AUVERGNE-RHONE-ALPES";"dont apprentis";14;;;;
"0380073Y";"Lycée polyvalent Elie Cartan - Lycée des métiers des équipements industriels et du textile";"AUVERGNE-RHONE-ALPES";"ensemble";39;31;39;-9;33
"0380073Y";"Lycée polyvalent Elie Cartan - Lycée des métiers des équipements industriels et du textile";"AUVERGNE-RHONE-ALPES";"dont élèves en voie pro sco";40;31;37;-6;37
"0380073Y";"Lycée polyvalent Elie Cartan - Lycée des métiers des équipements industriels et du textile";"AUVERGNE-RHONE-ALPES";"dont apprentis";;;;;
"0380081G";"Lycée polyvalent Ella Fitzgerald";"AUVERGNE-RHONE-ALPES";"ensemble";44;44;44;0;50
"0380081G";"Lycée polyvalent Ella Fitzgerald";"AUVERGNE-RHONE-ALPES";"dont élèves en voie pro sco";44;43;43;0;50
"0380081G";"Lycée polyvalent Ella Fitzgerald";"AUVERGNE-RHONE-ALPES";"dont apprentis";45;;;;
"0380083J";"Lycée polyvalent Galilée - Lycée des métiers de la chimie et des process industriels";"AUVERGNE-RHONE-ALPES";"ensemble";38;43;39;4;52
"0380089R";"Lycée polyvalent Portes de l'Oisans - Lycée des métiers de l'électronique et du numérique";"AUVERGNE-RHONE-ALPES";"ensemble";54;48;44;5;52
"0380089R";"Lycée polyvalent Portes de l'Oisans - Lycée des métiers de l'électronique et du numérique";"AUVERGNE-RHONE-ALPES";"dont élèves en voie pro sco";54;48;43;4;52
"0380089R";"Lycée polyvalent Portes de l'Oisans - Lycée des métiers de l'électronique et du numérique";"AUVERGNE-RHONE-ALPES";"dont apprentis";;;;;
"0380091T";"Lycée polyvalent Edouard Herriot";"AUVERGNE-RHONE-ALPES";"ensemble";54;49;43;7;52
"0380091T";"Lycée polyvalent Edouard Herriot";"AUVERGNE-RHONE-ALPES";"dont élèves en voie pro sco";55;49;42;7;51
"0380091T";"Lycée polyvalent Edouard Herriot";"AUVERGNE-RHONE-ALPES";"dont apprentis";;;;;
"0380092U";"Lycée polyvalent Ferdinand Buisson";"AUVERGNE-RHONE-ALPES";"ensemble";53;39;47;-8;53
"0380092U";"Lycée polyvalent Ferdinand Buisson";"AUVERGNE-RHONE-ALPES";"dont élèves en voie pro sco";54;38;45;-7;53
"0380092U";"Lycée polyvalent Ferdinand Buisson";"AUVERGNE-RHONE-ALPES";"dont apprentis";;;;;
"0381599G";"Lycée polyvalent de l Edit";"AUVERGNE-RHONE-ALPES";"ensemble";41;51;39;12;52
"0381599G";"Lycée polyvalent de l Edit";"AUVERGNE-RHONE-ALPES";"dont élèves en voie pro sco";40;50;38;12;52
"0381599G";"Lycée polyvalent de l Edit";"AUVERGNE-RHONE-ALPES";"dont apprentis";;;;;
"0381602K";"Lycée professionnel L'Odyssée";"AUVERGNE-RHONE-ALPES";"ensemble";54;40;32;8;46
"0381603L";"Lycée polyvalent André Argouges";"AUVERGNE-RHONE-ALPES";"ensemble";48;45;44;1;51
"0381603L";"Lycée polyvalent André Argouges";"AUVERGNE-RHONE-ALPES";"dont élèves en voie pro sco";48;44;43;1;50
"0381603L";"Lycée polyvalent André Argouges";"AUVERGNE-RHONE-ALPES";"dont apprentis";;;;;
"0381666E";"Lycée général et technologique privé Pierre Termier";"AUVERGNE-RHONE-ALPES";"ensemble";49;50;55;-5;77
"0381678T";"Lycée Polyvalent privé Robin";"AUVERGNE-RHONE-ALPES";"ensemble";41;63;58;5;67
"0381732B";"Lycée professionnel privé François Verguin - Lycée des métiers de la chimie et des process industriels";"AUVERGNE-RHONE-ALPES";"ensemble";30;78;66;12;69
"0381733C";"Lycée professionnel privé Jeanne d'Arc";"AUVERGNE-RHONE-ALPES";"ensemble";52;38;43;-6;50
"0381738H";"Lycée professionnel privé Robin";"AUVERGNE-RHONE-ALPES";"ensemble";54;40;41;-1;52
"0381741L";"Lycée professionnel privé Le Breda - Lycée des métiers du commerce du social et des services à la personne";"AUVERGNE-RHONE-ALPES";"ensemble";32;34;37;-3;52
"0381758E";"Lycée professionnel privé Les Charmilles - Lycée des métiers du Tertiaire";"AUVERGNE-RHONE-ALPES";"ensemble";49;33;42;-9;46
"0381805F";"Lycée professionnel privé Les portes de Chartreuse";"AUVERGNE-RHONE-ALPES";"ensemble";65;45;45;-1;60
"0381806G";"Lycée professionnel privé Bordier - Lycée des métiers du commerce du social et des services à la personne";"AUVERGNE-RHONE-ALPES";"ensemble";36;29;34;-6;34
"0381809K";"Lycée professionnel privé Les Gorges - Lycée des métiers du commerce, du social et des services à la personne";"AUVERGNE-RHONE-ALPES";"ensemble";62;29;33;-5;36
"0381899H";"Lycée Professionnel Privé Philippine Duchesne - Lycée des métiers du médico-social";"AUVERGNE-RHONE-ALPES";"ensemble";46;39;42;-3;38
"0382031B";"Lycée professionnel Thomas Edison";"AUVERGNE-RHONE-ALPES";"ensemble";53;37;42;-5;39
"0382031B";"Lycée professionnel Thomas Edison";"AUVERGNE-RHONE-ALPES";"dont élèves en voie pro sco";54;38;41;-4;39
"0382031B";"Lycée professionnel Thomas Edison";"AUVERGNE-RHONE-ALPES";"dont apprentis";;;;;
"0382093U";"Lycée professionnel privé Alpes Sud Isère";"AUVERGNE-RHONE-ALPES";"ensemble";64;;;;
"0382099A";"Lycée polyvalent Roger Deschaux - Lycée des métiers de la construction du BTP et de l'énergetique";"AUVERGNE-RHONE-ALPES";"ensemble";42;64;58;7;72
"0382099A";"Lycée polyvalent Roger Deschaux - Lycée des métiers de la construction du BTP et de l'énergetique";"AUVERGNE-RHONE-ALPES";"dont élèves en voie pro sco";45;56;49;7;65
"0382099A";"Lycée polyvalent Roger Deschaux - Lycée des métiers de la construction du BTP et de l'énergetique";"AUVERGNE-RHONE-ALPES";"dont apprentis";28;89;83;6;93
