n°UAI de l'établissement;Libellé de l'établissement;Région;Taux de poursuite d'études;Taux;Taux attendu;Valeur ajoutée;Part en poursuite d'études ;Part en emploi 6 mois après la sortie ;Part des autres situations 
0010826T;Centre de Formation d'Apprentis du CECOF Bernard Palissy;AUVERGNE-RHONE-ALPES;43;64;64;1;43;37;20
0010856A;ASSOCIATION POUR LA FORMATION ET LA PROMOTION DES METIERS DE L'AIN;AUVERGNE-RHONE-ALPES;41;74;75;-1;41;44;15
0010965U;Centre de Formation d'Apprentis du BTP de l'Ain;AUVERGNE-RHONE-ALPES;50;68;71;-3;50;34;16
0011073L;Maison Familiale Rurale La Vernée - Péronnas;AUVERGNE-RHONE-ALPES;;;;;;;
0011074M;Maison Familiale Rurale de Bâgé-le-Châtel;AUVERGNE-RHONE-ALPES;;;;;;;
0011164K;GRETA-CFA Ain;AUVERGNE-RHONE-ALPES;45;68;71;-3;45;37;18
0011171T;Maison Familiale Rurale de Pont-de-Veyle;AUVERGNE-RHONE-ALPES;;;;;;;
0021502X;CFA de la CCIA;HAUTS-DE-FRANCE;36;52;54;-2;36;33;31
0021739E;CFA BTP CFA 02;HAUTS-DE-FRANCE;44;54;63;-9;44;30;26
0021831E;Maison Familiale Rurale de Clairfontaine;HAUTS-DE-FRANCE;35;30;42;-12;35;20;45
0021907M;Maison Familiale Rurale vallée du retz - Ambleny;HAUTS-DE-FRANCE;;;;;;;
0021908N;Maison Familiale Rurale de La Capelle;HAUTS-DE-FRANCE;10;57;52;5;10;52;38
0022189U;Organisme de formation-Centre de formation d'apprentis d'Axion formations Saint-Quentin;HAUTS-DE-FRANCE;;;;;;;
0022191W;Organisme de formation-Centre de formation d'apprentis de 3 solutions avec l'alternance Saint-Quentin;HAUTS-DE-FRANCE;5;54;47;7;5;51;44
0022193Y;Organisme de formation-Centre de formation d'apprentis STUDI;HAUTS-DE-FRANCE;10;67;55;12;10;60;30
0030124U;Centre de formation d'apprentis - Institut de formation interprofessionnel de l'Allier;AUVERGNE-RHONE-ALPES;43;58;59;0;43;33;24
0030126W;Centre de formation d'apprentis - Ecole des métiers du bâtiment;AUVERGNE-RHONE-ALPES;44;65;65;0;44;37;19
0031030D;Centre de Formation d'Apprentis de l'Industrie d'Auvergne;AUVERGNE-RHONE-ALPES;29;74;73;0;29;52;19
0031067U;centre form prof promo agricoles de moulins;AUVERGNE-RHONE-ALPES;26;53;61;-8;26;39;35
0031127J;Organisme de formation-Centre de Formation d'Apprentis d'Alternance Auvergne, Montluçon;AUVERGNE-RHONE-ALPES;;;;;;;
0031131N;Organisme de formation-Centre de formation d'apprentis d'IMCS SARL Gestion Formation Conseil Auvergne, Vichy;AUVERGNE-RHONE-ALPES;;;;;;;
0040161D;CFA CAMPUS DE DIGNE;PROVENCE-ALPES-COTE D'AZUR;40;58;59;-2;40;35;25
0040548Z;CFA d'apprentis de Sup'alternance provence de Manosque;PROVENCE-ALPES-COTE D'AZUR;24;62;60;2;24;47;29
0040578G;SPORT ET FORMATION;PROVENCE-ALPES-COTE D'AZUR;27;53;50;3;27;39;34
0040579H;ALPES DEVELOPPEMENT FORMATION;PROVENCE-ALPES-COTE D'AZUR;;;;;;;
0050503V;CFA Régional des Métiers et de l'Artisanat Campus de Gap;PROVENCE-ALPES-COTE D'AZUR;32;62;63;-1;32;43;25
0050606G;Maison Familiale Rurale de Ventavon;PROVENCE-ALPES-COTE D'AZUR;;;;;;;
0050621Y;Greta-CFA Alpes Provence;PROVENCE-ALPES-COTE D'AZUR;37;78;66;12;37;49;14
0050665W;GROUPE ALTERNANCE GAP;PROVENCE-ALPES-COTE D'AZUR;;;;;;;
0060862E;Ctre de formation d'apprentis Inst. de form. pharmacie et santé;PROVENCE-ALPES-COTE D'AZUR;33;58;62;-4;33;39;28
0060916N;Ctre de formation d'apprentis bâtiment et TP des AM;PROVENCE-ALPES-COTE D'AZUR;31;57;61;-5;31;39;30
0060918R;Ctre de formation d'apprentis inst de formation automobile;PROVENCE-ALPES-COTE D'AZUR;26;62;62;0;26;46;28
0060920T;Ctre de formation régional d'apprentis Faculté des métiers;PROVENCE-ALPES-COTE D'AZUR;38;54;60;-6;38;33;29
0061603K;CFA régional PACA;PROVENCE-ALPES-COTE D'AZUR;29;52;52;1;29;37;34
0061909T;Ctre de formation d'apprentis Métropole Côte d'Azur;PROVENCE-ALPES-COTE D'AZUR;31;57;60;-3;31;39;30
0061992H;Ecole supérieure privée ISCAE;PROVENCE-ALPES-COTE D'AZUR;50;;;;50;26;24
0062087L;CFA rég. Infosupaca;PROVENCE-ALPES-COTE D'AZUR;55;;;;55;27;18
0062093T;Ctre de formation d'apprentis régional Don Bosco;PROVENCE-ALPES-COTE D'AZUR;25;52;63;-11;25;39;36
0062116T;Ecole supérieure privée Neven education;PROVENCE-ALPES-COTE D'AZUR;;;;;;;
0062173E;Etablissement technique privé Campus Riera;PROVENCE-ALPES-COTE D'AZUR;;;;;;;
0062176H;GIP FIPAN CFA Rég de l'académie de Nice;PROVENCE-ALPES-COTE D'AZUR;30;56;59;-3;30;39;31
0062199H;Centre d'enseignement à distance VISIPLUS;PROVENCE-ALPES-COTE D'AZUR;;;;;;;
0062200J;Organinsme de formation - centre de formation d'apprentis Groupement Promotion Echanges Internationaux Antibes;PROVENCE-ALPES-COTE D'AZUR;;;;;;;
0062201K;Organisme formation-Centre de formation d'apprentis UFIP Nice;PROVENCE-ALPES-COTE D'AZUR;40;;;;40;36;24
0062202L;Organisme de formation-Centre de formation d'apprentis du centre de formations aux métiers de la petite enfance Nice;PROVENCE-ALPES-COTE D'AZUR;26;52;44;8;26;39;35
0062204N;Organisme formation-Centre de formation d'apprentis CFA CCINCA Nice;PROVENCE-ALPES-COTE D'AZUR;36;63;68;-5;36;41;23
0062213Y;Organisme de formation-Centre de formation d'apprentis Conseil - Formation Nice;PROVENCE-ALPES-COTE D'AZUR;;;;;;;
0062221G;Organisme de formation-Centre de formation d'apprentis Alternance Sud Azur Nice;PROVENCE-ALPES-COTE D'AZUR;49;68;61;7;49;35;16
0062255U;Organisme de formation-Centre de formation d'apprentis UPDATE 06 Antibes;PROVENCE-ALPES-COTE D'AZUR;;;;;;;
0062263C;Organisme de formation-Centre de formation d'apprentis ARDRESS Le Cannet;PROVENCE-ALPES-COTE D'AZUR;;;;;;;
0062307A;Organisme de formation-Centre de formation d'apprentis AFTRAL Carros;PROVENCE-ALPES-COTE D'AZUR;22;90;78;12;22;70;8
0070876P;Organisme de formation-Centre de formation d'apprentis de la SEPR-Annonay;AUVERGNE-RHONE-ALPES;41;69;61;8;41;40;19
0071199R;Organisme de formation-Centre de formation d'apprentis d'André Fargier-Lanas;AUVERGNE-RHONE-ALPES;39;46;54;-8;39;28;33
0071376H;Organisme de formation-Centre de formation d'apprentis d'ADAPSS-Guilherand-Granges;AUVERGNE-RHONE-ALPES;20;77;82;-5;20;61;19
0071385T;Greta Vivarais Provence;AUVERGNE-RHONE-ALPES;;;;;;;
0071456V;Organisme de formation-Centre de formation d'apprentis de Formation Emploi Avenir-Privas;AUVERGNE-RHONE-ALPES;30;62;53;8;30;43;27
0080842X;ALMEA FORMATION Interpro Ardennes;GRAND EST;42;48;54;-6;42;28;30
0080972N;Centre de Formation d'Apprentis Agricole des Ardennes;GRAND EST;39;52;59;-8;39;31;30
0081002W;Greta des Ardennes;GRAND EST;34;75;69;7;34;49;17
0081065P;Centre de Formation d'Apprentis Agricole Saint-Laurent;GRAND EST;36;49;46;3;36;32;32
0081137T;Offre de formation par apprentissage du BTP Grandest des Ardennes;GRAND EST;49;62;68;-6;49;32;19
0081150G;OF - Centre de formation de la Salle;GRAND EST;32;69;59;10;32;47;21
0081151H;OF Turenne Compétences - centre d'apprentissage;GRAND EST;;;;;;;
0081152J;OF BSA Apprentissage Maud Badureau;GRAND EST;;;;;;;
0081155M;CFA - CCI des Ardennes - Offres de formation;GRAND EST;0;37;49;-12;0;37;63
0090553C;Centre de Formation d'Apprentis de la Chambre de Métiers de l'Ariège;OCCITANIE;35;51;56;-5;35;33;32
0100715Y;Alméa Formations Interpro 10;GRAND EST;34;53;57;-3;34;35;31
0100824S;BTP Grand Est Organisme de formation par apprentissage;GRAND EST;41;61;65;-4;41;36;23
0100948B;Centre de Formation d'Apprentis de St Pouange;GRAND EST;29;65;61;4;29;46;25
0100975F;Greta Sud Champagne;GRAND EST;35;55;67;-12;35;35;30
0101035W;Centre de Formation d'Apprentis de la pharmacie de Troyes;GRAND EST;15;81;73;8;15;68;17
0101060Y;Université de Technologie de Troyes;GRAND EST;;;;;;;
0101140K;CENTRE FORM PRO LA SALLE;GRAND EST;25;;;;25;58;17
0101141L;Groupe Alternance Troyes - Offre de formations;GRAND EST;;;;;;;
0101143N;OF Sylvia Terrade apprentissage G-E Troyes;GRAND EST;26;;;;26;48;26
0101144P;Offre de formation et d'apprentissage SAS BL Formation;GRAND EST;;;;;;;
0110681F;Centre de formation d'apprentis Interprofessionnel Henri Martin;OCCITANIE;40;55;62;-6;40;33;27
0110884B;Centre de formation d'apprentis BTP de l'Aude;OCCITANIE;44;54;62;-9;44;30;26
0110905Z;Greta de l'Aude;OCCITANIE;32;61;60;0;32;41;27
0110943R;CFA de l'Aude;OCCITANIE;31;49;53;-4;31;34;35
0111003F;Centre de formation d'apprentis Spécialisé Languedoc-Roussillon;OCCITANIE;50;32;42;-9;50;16;34
0111036S;Centre de Formation Professionnelle du Midi;OCCITANIE;;;;;;;
0111060T;Centre de formation d'apprentis de l'Education nationale Interdépartemental de l'Aude et des Pyrénées-Orientales;OCCITANIE;26;61;63;-3;26;45;29
0111079N;Organisme de formation-Centre de formation d'apprentis de Formation Inov Saint-Pierre, Carcassonne;OCCITANIE;;;;;;;
0120887Z;Centre de formation d'apprentis Chambre des metiers de l'Aveyron;OCCITANIE;39;62;65;-3;39;38;23
0121358L;Centre de formation des apprentis agricole de l'Aveyron   EPLA de Villefranche de Rouergue;OCCITANIE;26;56;63;-7;26;41;33
0121371A;Greta Midi-Pyrénées Nord;OCCITANIE;86;;;;86;9;5
0121479T;CFA de Saint Affrique;OCCITANIE;33;85;73;12;33;57;10
0121507Y;CFA Nord Ouest Aveyron;OCCITANIE;32;59;69;-10;32;41;27
0131767A;OF-CFA MUNICIPAL DE SALON DE PROVENCE;PROVENCE-ALPES-COTE D'AZUR;36;53;56;-3;36;34;30
0131772F;Centre de formation d'apprentis du BTP Marseille;PROVENCE-ALPES-COTE D'AZUR;41;56;62;-6;41;33;26
0131775J;Centre de Formation de la Bourse du Travail;PROVENCE-ALPES-COTE D'AZUR;31;51;50;1;31;35;34
0131779N;CFA de la pharmacie Marseille Provence;PROVENCE-ALPES-COTE D'AZUR;22;82;78;4;22;64;14
0131781R;CFA de la Coiffure Roger Para;PROVENCE-ALPES-COTE D'AZUR;49;44;56;-12;49;23;28
0131782S;CFA INDUSTRIE DE PROVENCE;PROVENCE-ALPES-COTE D'AZUR;29;66;69;-3;29;47;24
0131784U;Sainte Victoire Pays d'Aix;PROVENCE-ALPES-COTE D'AZUR;61;63;55;7;61;24;15
0131786W;CFA METIERS DE L'AUTOMOBILE;PROVENCE-ALPES-COTE D'AZUR;31;60;63;-3;31;41;28
0131903Y;CFA DE LA COIFFURE ARCOLE;PROVENCE-ALPES-COTE D'AZUR;45;;;;45;;55
0132010P;Maison Familiale Rurale de Lambesc;PROVENCE-ALPES-COTE D'AZUR;;;;;;;
0132278F;Maison Familiale Rurale de la Montagnette - Barbentane;PROVENCE-ALPES-COTE D'AZUR;;;;;;;
0132469N;CFA DU BATIMENT ET TRAVAUX PUBLICS;PROVENCE-ALPES-COTE D'AZUR;39;62;66;-4;39;38;23
0132470P;CFA INTERPROFESSIONNEL COROT;PROVENCE-ALPES-COTE D'AZUR;24;62;54;7;24;47;29
0132823Y;Maison Familiale Rurale de Puyloubier;PROVENCE-ALPES-COTE D'AZUR;;;;;;;
0132976P;Greta-CFA Provence;PROVENCE-ALPES-COTE D'AZUR;35;63;62;1;35;41;24
0133004V;CFA DU TRANSPORT ET DE LA LOGISTIQUE (AFTRAL);PROVENCE-ALPES-COTE D'AZUR;11;70;68;2;11;62;27
0133339J;CFA DE LA CITE TECHNIQUE;PROVENCE-ALPES-COTE D'AZUR;31;59;59;-1;31;41;28
0133475G;CFA DES COMPAGNONS DU DEVOIR;PROVENCE-ALPES-COTE D'AZUR;42;57;64;-7;42;33;25
0133486U;Centre de Formation des Apprentis Interfed Santé Social;PROVENCE-ALPES-COTE D'AZUR;2;47;45;3;2;46;52
0133489X;CFA EPURE MEDITERRANEE;PROVENCE-ALPES-COTE D'AZUR;67;56;60;-5;67;19;14
0133509U;FEDERATION REGIONALE DE MFR;PROVENCE-ALPES-COTE D'AZUR;33;48;51;-3;33;32;35
0133527N;CFA régional interconsulaire méditerranée;PROVENCE-ALPES-COTE D'AZUR;36;59;61;-3;36;38;26
0133535X;CFA des métiers hippiques;PROVENCE-ALPES-COTE D'AZUR;11;83;71;12;11;74;15
0133549M;CFA BANQUE FINANCE;PROVENCE-ALPES-COTE D'AZUR;23;50;59;-9;23;38;39
0133562B;CFA Santé animale;PROVENCE-ALPES-COTE D'AZUR;8;84;73;11;8;78;14
0133565E;Formaposte Sud Est;PROVENCE-ALPES-COTE D'AZUR;22;65;63;3;22;51;27
0133597P;INHNI SUD EST;PROVENCE-ALPES-COTE D'AZUR;52;57;47;9;52;27;21
0133622S;ASSOCIATION REGIONALE POUR LA FORMATION PAR L APPRENTISSAGE AUX METIERS DU SPORT DU TOURISME ET DE L ANIMATION (A.R.F.A.M.S.T.A);PROVENCE-ALPES-COTE D'AZUR;20;;;;20;;80
0133645S;Ecole de la construction des infrastructures et réseaux APPRENTISSAGE;PROVENCE-ALPES-COTE D'AZUR;36;81;74;7;36;52;12
0133690R;CFA METIER DU SOCIAL;PROVENCE-ALPES-COTE D'AZUR;13;34;46;-12;13;29;58
0133864E;CFA FORMATION ADAPTEE;PROVENCE-ALPES-COTE D'AZUR;;;;;;;
0133915K;Maison Familiale Rurale Rhône Alpilles - St Martin de Crau;PROVENCE-ALPES-COTE D'AZUR;24;50;50;0;24;38;38
0133927Y;CFA BTP ARLES;PROVENCE-ALPES-COTE D'AZUR;41;53;63;-9;41;32;27
0133929A;REGIONAL DE L'ACADEMIE D'AIX-MARSEILLE;PROVENCE-ALPES-COTE D'AZUR;30;53;55;-2;30;37;33
0133963M;regional des metiers de l'environnement et du developpement durable;PROVENCE-ALPES-COTE D'AZUR;38;24;36;-12;38;15;47
0134088Y;Greta-CFA Marseille Méditerranée;PROVENCE-ALPES-COTE D'AZUR;25;56;58;-2;25;42;33
0134105S;centre de formation d'apprentis des métiers du spectacle;PROVENCE-ALPES-COTE D'AZUR;12;47;41;6;12;42;46
0134122K;IFCO Marseille;PROVENCE-ALPES-COTE D'AZUR;3;57;56;0;3;55;42
0134179X;Organisme de formation cfa POLYVIA FORMATION MARSEILLE-Provence Alpes-Côtes-d'Azur;PROVENCE-ALPES-COTE D'AZUR;;;;;;;
0134280G;sarl GROUPE SOMEFORM;PROVENCE-ALPES-COTE D'AZUR;;;;;;;
0134281H;OF-CFA LUDORIUM;PROVENCE-ALPES-COTE D'AZUR;17;;;;17;39;44
0134288R;CODEV;PROVENCE-ALPES-COTE D'AZUR;;;;;;;
0134291U;SARL MAOR FORMATIONS;PROVENCE-ALPES-COTE D'AZUR;;;;;;;
0134294X;Provence Formation des Métiers des Services;PROVENCE-ALPES-COTE D'AZUR;48;59;63;-4;48;31;21
0134295Y;FDM GROUPE;PROVENCE-ALPES-COTE D'AZUR;;;;;;;
0134296Z;PROFIL MANAGER;PROVENCE-ALPES-COTE D'AZUR;;;;;;;
0134297A;FCR de Marseille;PROVENCE-ALPES-COTE D'AZUR;35;66;66;0;35;43;22
0134299C;ALTERNANCE EXXECC;PROVENCE-ALPES-COTE D'AZUR;52;;;;52;28;20
0134300D;PLATE FORME;PROVENCE-ALPES-COTE D'AZUR;3;53;65;-12;3;52;45
0134302F;IFCO;PROVENCE-ALPES-COTE D'AZUR;;;;;;;
0134303G;CNAM PACA;PROVENCE-ALPES-COTE D'AZUR;;;;;;;
0134304H;WIKI LEARN FORMATION;PROVENCE-ALPES-COTE D'AZUR;;;;;;;
0134305J;GROUPE ALTERNANCE AIX;PROVENCE-ALPES-COTE D'AZUR;;;;;;;
0134307L;IFCO PARIS;PROVENCE-ALPES-COTE D'AZUR;0;57;56;1;0;57;43
0134308M;ESTC;PROVENCE-ALPES-COTE D'AZUR;;;;;;;
0134309N;IFTE AIX;PROVENCE-ALPES-COTE D'AZUR;69;74;65;9;69;23;8
0134311R;SIGMA FORMATION;PROVENCE-ALPES-COTE D'AZUR;;;;;;;
0134318Y;VOILE IMPULSION;PROVENCE-ALPES-COTE D'AZUR;;;;;;;
0134332N;CENTRE DE FORMATION CMA CGM ACADEMY;PROVENCE-ALPES-COTE D'AZUR;;;;;;;
0134333P;My Business School Campus de Marseille (13);PROVENCE-ALPES-COTE D'AZUR;50;;;;50;25;25
0134334R;My Business School Campus d'Aix en Provence (13);PROVENCE-ALPES-COTE D'AZUR;;;;;;;
0134336T;M2S FORMATION SCHOOL;PROVENCE-ALPES-COTE D'AZUR;;;;;;;
0134337U;M2S FORMATION;PROVENCE-ALPES-COTE D'AZUR;;;;;;;
0134338V;ILF - EHP -  INSTITUT LA FORBINE;PROVENCE-ALPES-COTE D'AZUR;;;;;;;
0134340X;OF-CFA ESDAC IPSAA;PROVENCE-ALPES-COTE D'AZUR;;;;;;;
0134343A;M2S FORMATION AUBAGNE;PROVENCE-ALPES-COTE D'AZUR;;;;;;;
0134350H;MFREO DE LA ROQUE D'ANTHERON;PROVENCE-ALPES-COTE D'AZUR;;;;;;;
0134353L;ASSOCIATION FORMATIC;PROVENCE-ALPES-COTE D'AZUR;;;;;;;
0134357R;COACHING PACA;PROVENCE-ALPES-COTE D'AZUR;;;;;;;
0134361V;Association de formation pour la Coopération et la Promotion Professionnelle Méditerrannéenne;PROVENCE-ALPES-COTE D'AZUR;;;;;;;
0134367B;ECIR FORMATION;PROVENCE-ALPES-COTE D'AZUR;;;;;;;
0134370E;A.S.F. - ASSOCIATION SUD FORMATION;PROVENCE-ALPES-COTE D'AZUR;;;;;;;
0141300M;Centre de formations des apprentis CIFAC Caen;NORMANDIE;45;69;69;0;45;38;17
0141408E;Université de Caen Normandie;NORMANDIE;78;;;;78;18;4
0141601P;Centre de formation des apprentis du batîment Jean Hochet Caen;NORMANDIE;53;71;67;4;53;33;14
0141815X;Organisme de formation-Centre de formation d'apprentis Institut Consulaire d'Enseignement Professionnel ICEP CAEN;NORMANDIE;38;61;62;-1;38;38;24
0141872J;Maison Familiale Rurale france de Maltot;NORMANDIE;42;71;69;2;42;42;16
0141902S;Maison Familiale Rurale de Balleroy;NORMANDIE;21;62;68;-6;21;49;30
0141903T;Maison Familiale Rurale de Blangy-le-Château;NORMANDIE;50;;;;50;45;5
0141904U;Maison Familiale Rurale de Les Moutiers-en-Cinglais;NORMANDIE;;;;;;;
0141941J;CFA Le Robillard;NORMANDIE;32;83;71;12;32;56;12
0141992P;Institut Supérieur Professionnel Normandie CAEN;NORMANDIE;;;;;;;
0142106N;Centre de Formation d'Apprentis CFAI Grand Ouest Normandie Caen;NORMANDIE;34;75;73;3;34;49;17
0142180U;CFA de Vire;NORMANDIE;30;;;;30;;70
0142220M;Site de formation de l'Organisme de formation CFA AFTRAL à Caen;NORMANDIE;22;74;68;6;22;58;20
0142248T;Association de gestion de l'Ecole Supérieure des Services AE2SE;NORMANDIE;54;71;70;1;54;33;13
0142269R;Centre de Formation des Apprenis Professions Sanitaires et Sociales Normandie Saint-Contest;NORMANDIE;6;67;54;12;6;63;31
0142321X;ADEN FORMATIONS EESTP CAEN;NORMANDIE;38;64;63;1;38;40;22
0142368Y;CFA public de l'enseignement supérieur de Caen Normandie;NORMANDIE;67;;;;67;23;10
0142390X;centre de formation d apprentis sport animation tourisme norma;NORMANDIE;24;;;;24;;76
0142400H;Centre de Formation d'Apprentis Don Bosco de Normandie Herouville-St-Clair;NORMANDIE;20;74;68;6;20;59;21
0142407R;Ecole supérieure privée IFA Trouville-sur-mer;NORMANDIE;;;;;;;
0142418C;CFA des MFR de Normandie;NORMANDIE;31;63;57;6;31;43;26
0142433U;Organisme de formation-Centre de formation d'apprentis CPNLT Clecy;NORMANDIE;;;;;;;
0142434V;Organisme de formation-Centre de formation d'apprentis IFSGO Colombelles;NORMANDIE;;;;;;;
0142435W;Organisme de formation-Centre de formation d'apprentis camp academy elite normandie training LOUVIGNY;NORMANDIE;12;54;58;-4;12;48;40
0142438Z;Organisme de formation-Centre de formation d'apprentis ALTERNANCIA CAEN;NORMANDIE;;;;;;;
0142443E;Organisme de formation-Centre de formation d'apprentis LJN  CAEN;NORMANDIE;;;;;;;
0142445G;Organisme de formation-Centre de formation d'apprentis Profiile CAEN;NORMANDIE;;;;;;;
0150605B;Centre de formation d'apprentis du bâtiment et travaux publics Georges Boché;AUVERGNE-RHONE-ALPES;45;70;69;1;45;38;17
0150640P;Institut de formation professionnelle et permanente;AUVERGNE-RHONE-ALPES;43;70;66;4;43;40;17
0150688S;Maison Familiale Rurale de Saint-Flour;AUVERGNE-RHONE-ALPES;49;;;;49;41;10
0150755P;centre form prof promo agricoles aurillac;AUVERGNE-RHONE-ALPES;22;68;70;-2;22;53;25
0150779R;GAILLARD FORMATION;AUVERGNE-RHONE-ALPES;;;;;;;
0150786Y;Chambre de Commerce et d'Industrie du Cantal;AUVERGNE-RHONE-ALPES;;;;;;;
0150788A;Organisme de formation-Centre de Formation d'Apprentis de l'école Christian Vabret - Boulangerie - Pâtisserie - Cuisine, Aurillac;AUVERGNE-RHONE-ALPES;17;;;;17;30;53
0160755J;Maison Familiale Rurale de Triac-Lautrait;NOUVELLE-AQUITAINE;;;;;;;
0160756K;CFA Chambre de metiers et artisanat de la Charente;NOUVELLE-AQUITAINE;43;60;60;1;43;34;23
0160757L;CFA de la Chambre de commerce et d'industrie de la Charente;NOUVELLE-AQUITAINE;39;61;64;-3;39;37;24
0161000A;Maison Familiale Rurale de Jarnac;NOUVELLE-AQUITAINE;;;;;;;
0161002C;Maison Familiale Rurale de Cherves-Richemont;NOUVELLE-AQUITAINE;;;;;;;
0161077J;CFA de la Charente;NOUVELLE-AQUITAINE;35;70;60;10;35;45;20
0161212F;Ctr formation apprentis BTP CFA Charente;NOUVELLE-AQUITAINE;50;64;67;-3;50;32;18
0161223T;Organisme de formation-Centre de formation d'apprentis de AFTRAL Puymoyen;NOUVELLE-AQUITAINE;;;;;;;
0171183U;Site de formation d'apprentis du Centre de formation de Lagord;NOUVELLE-AQUITAINE;42;58;62;-3;42;34;24
0171208W;Centre de formation d'apprentis Commerce de Saintes;NOUVELLE-AQUITAINE;36;67;67;-1;36;42;22
0171209X;CFA BTP de la Charente-Maritime;NOUVELLE-AQUITAINE;45;62;67;-6;45;34;21
0171291L;Maison Familiale Rurale de Saint-Germain;NOUVELLE-AQUITAINE;;;;;;;
0171318R;Maison Familiale Rurale de Chevanceaux - forêts;NOUVELLE-AQUITAINE;;;;;;;
0171401F;CFA de la Charente Maritime;NOUVELLE-AQUITAINE;31;65;59;6;31;45;24
0171427J;EXCELIA GROUP;NOUVELLE-AQUITAINE;;;;;;;
0171438W;CFA CIPECMA;NOUVELLE-AQUITAINE;36;57;62;-5;36;37;27
0171463Y;La Rochelle Université;NOUVELLE-AQUITAINE;;;;;;;
0171501P;Institut supérieur de formation par alternance et continue;NOUVELLE-AQUITAINE;;;;;;;
0171503S;Centre de formation continue Alternance Sud Atlantique - Groupe Rochefort;NOUVELLE-AQUITAINE;45;;;;45;41;14
0171552V;Maison Familiale Rurale de la Saintonge et de l'Aunis - Saint-Genis-de-Saintonge;NOUVELLE-AQUITAINE;;;;;;;
0171591M;CFA de Surgères;NOUVELLE-AQUITAINE;33;77;70;7;33;51;16
0171610H;Centre de formation d'apprentis AFTRAL de Rochefort;NOUVELLE-AQUITAINE;0;87;75;12;0;87;13
0171644V;Organisme de formation centre de formation d'apprentis IRSS Sport Royan;NOUVELLE-AQUITAINE;;;;;;;
0171646X;Organisme de formation - Centre de formation d'apprentis de Formations Equines Rochefort Ocean de Rochefort;NOUVELLE-AQUITAINE;;;;;;;
0180755Y;Organisme de formation-Centre de formation d'apprentis de IFAB de Bourges;CENTRE-VAL DE LOIRE;40;58;61;-3;40;35;25
0180847Y;CFA du Cher;CENTRE-VAL DE LOIRE;31;62;65;-3;31;43;26
0190721F;CFA EIMCL 13 VENTS TULLE;NOUVELLE-AQUITAINE;42;60;63;-3;42;35;23
0190767F;CFA PREPARATEURS EN PHARMACIE BRIVE LA GAILLARDE;NOUVELLE-AQUITAINE;0;77;76;1;0;77;23
0190807Z;CENTRE DE FORMATION D'APPRENTIS INCLUSIF NOUVELLE AQUITAINRE;NOUVELLE-AQUITAINE;35;;;;35;25;40
0190832B;CFA de la Corrèze - Brive;NOUVELLE-AQUITAINE;37;63;59;4;37;39;24
0190847T;CFAI LIMOUSIN-SITE DE TULLE;NOUVELLE-AQUITAINE;33;81;74;7;33;55;12
0190849V;BTP CFA NOUVELLE AQUITAINE TULLE;NOUVELLE-AQUITAINE;50;68;71;-2;50;34;16
0195041B;CFA EFIATP EGLETONS;NOUVELLE-AQUITAINE;22;92;80;12;22;71;7
0195059W;ORGANISME DE FORMATION-CENTRE DE FORMATION D'APPRENTIS DE IFHCO USSEL;NOUVELLE-AQUITAINE;47;64;56;7;47;34;19
0195061Y;Organisme de formation-Centre de formation d'apprentis EFIA TP EGLETONS;NOUVELLE-AQUITAINE;20;96;84;12;20;77;3
0195062Z;Organisme de formation-Centre de formation d'apprentis de CFC TP EGLETONS;NOUVELLE-AQUITAINE;;;;;;;
0195066D;Organisme de formation-Centre de formation d'apprentis INISUP CCI CORREZE BRIVE LA GAILLARDE;NOUVELLE-AQUITAINE;;;;;;;
0211181V;CFA de la Pharmacie;BOURGOGNE-FRANCHE-COMTE;21;81;85;-3;21;64;15
0211431S;BATIMENT CFA BOURGOGNE-FRANCHE-COMTE SITE DE DIJON;BOURGOGNE-FRANCHE-COMTE;35;72;72;1;35;47;18
0211479U;ECOLE DES METIERS DIJON METROPOLE;BOURGOGNE-FRANCHE-COMTE;41;62;63;0;41;37;22
0211529Y;Maison Familiale Rurale de Baigneux-les-Juifs;BOURGOGNE-FRANCHE-COMTE;;;;;;;
0211530Z;Maison Familiale Rurale de Quetigny;BOURGOGNE-FRANCHE-COMTE;;;;;;;
0211531A;Maison Familiale Rurale de Liernais;BOURGOGNE-FRANCHE-COMTE;;;;;;;
0211575Y;Maison Familiale Rurale de Ruffey-lès-Beaune;BOURGOGNE-FRANCHE-COMTE;;;;;;;
0211579C;Maison Familiale Rurale de Semur-en-Auxois;BOURGOGNE-FRANCHE-COMTE;;;;;;;
0211799S;CFA Dijon Quétigny;BOURGOGNE-FRANCHE-COMTE;34;58;64;-6;34;38;28
0211800T;CFA Beaune;BOURGOGNE-FRANCHE-COMTE;23;66;64;3;23;51;26
0211948D;AFTRAL CFATL DIJON;BOURGOGNE-FRANCHE-COMTE;40;55;64;-9;40;33;27
0212000K;CFA des Compagnons du devoir;BOURGOGNE-FRANCHE-COMTE;52;69;69;1;52;33;15
0212052S;CFA SAINT BENIGNE;BOURGOGNE-FRANCHE-COMTE;41;71;70;1;41;42;17
0212057X;CFA des MFR de Bourgogne;BOURGOGNE-FRANCHE-COMTE;31;62;65;-3;31;43;26
0212096P;CFA DES TRAVAUX PUBLICS;BOURGOGNE-FRANCHE-COMTE;40;;;;40;;60
0212109D;CFA SAINT JOSEPH;BOURGOGNE-FRANCHE-COMTE;15;73;75;-3;15;62;23
0212114J;CFA LES ARCADES;BOURGOGNE-FRANCHE-COMTE;30;15;27;-12;30;11;59
0212115K;IFRIA Bourgogne;BOURGOGNE-FRANCHE-COMTE;60;57;69;-12;60;23;17
0212183J;FORMAPI;BOURGOGNE-FRANCHE-COMTE;39;;;;39;;61
0212193V;Centre de formation d'apprentis Polyvia Formation Dijon - Bourgogne Franche-Comté;BOURGOGNE-FRANCHE-COMTE;;;;;;;
0212196Y;ECOLE SUPERIEURE DE LA BANQUE;BOURGOGNE-FRANCHE-COMTE;;;;;;;
0212197Z;CFA SUP BOURGOGNE;BOURGOGNE-FRANCHE-COMTE;66;75;66;9;66;25;9
0212220Z;Cfa sanitaire social et médico-social de Bourgogne;BOURGOGNE-FRANCHE-COMTE;5;68;58;10;5;64;31
0212243Z;CFA DE L'EDUCATION NATIONALE EN BOURGOGNE;BOURGOGNE-FRANCHE-COMTE;29;69;69;1;29;49;22
0212254L;ECOLE PRIVEE FUTURA CFA;BOURGOGNE-FRANCHE-COMTE;;;;;;;
0212261U;FORMENFANCE;BOURGOGNE-FRANCHE-COMTE;9;66;72;-6;9;59;32
0212262V;SELFORME;BOURGOGNE-FRANCHE-COMTE;15;57;62;-5;15;48;37
0221071V;CFA CMA Bretagne - Campus de Dinan-Aucaleuc;BRETAGNE;43;72;68;4;43;41;16
0221072W;CFA CMA Bretagne - Campus de Ploufragan;BRETAGNE;42;68;67;1;42;40;18
0221588G;CFA Bâtiment 22;BRETAGNE;44;71;70;2;44;40;16
0221712S;Maison Familiale Rurale de Loudéac;BRETAGNE;19;49;61;-12;19;40;41
0221804S;CFA DE CAULNES;BRETAGNE;12;;;;12;;88
0221835A;CFA Pôle de Formation UIMM Bretagne;BRETAGNE;34;77;74;3;34;51;15
0221880Z;CFA DE MERDRIGNAC;BRETAGNE;39;72;65;8;39;44;17
0221883C;CENTRE DE FORMATION PROFESSIONNELLE ET DE PROMOTION AGRICOLE;BRETAGNE;;;;;;;
0221905B;AVIPOLE Formation;BRETAGNE;0;87;75;12;0;87;13
0221943T;CFA de l'Association régionale pour la formation par apprentissage aux métiers du secteur sanitaire, social et médico-social;BRETAGNE;21;53;51;2;21;42;37
0222000E;Greta-CFA des Côtes d'Armor;BRETAGNE;52;;;;52;36;12
0222016X;Formation CCI Saint-Brieuc;BRETAGNE;38;62;64;-2;38;38;24
0222027J;CFA ITC Saint-Brieuc - EURL A3D;BRETAGNE;13;85;73;12;13;74;13
0222035T;CFA Inside Campus Saint-Quay-Portrieux;BRETAGNE;;;;;;;
0222036U;CFA SAS Aformance Plérin;BRETAGNE;;;;;;;
0230412Y;CFA CHAMBRE COMMERCE INDUS CREUSE;NOUVELLE-AQUITAINE;63;;;;63;19;18
0230553B;CFA de la Creuse;NOUVELLE-AQUITAINE;35;51;58;-7;35;33;32
0240038L;Centre de formation d'apprentis du Grand Bergeracois;NOUVELLE-AQUITAINE;38;52;55;-4;38;32;30
0240051A;Centre de formation d'apprentis du bâtiment et des travaux publics de la Dordogne;NOUVELLE-AQUITAINE;48;66;69;-3;48;34;18
0240061L;Site de formation d'apprentis de la chambre des métiers et de l'artisanat de région Nouvelle Aquitaine - CFA des Métiers de Boulazac;NOUVELLE-AQUITAINE;46;63;63;0;46;34;20
0240090T;EPSECO MIX - Talis Business School - Campus de Bergerac;NOUVELLE-AQUITAINE;10;0;12;-12;10;0;90
0241047H;Maison Familiale Rurale de thiviers;NOUVELLE-AQUITAINE;;;;;;;
0241048J;Maison Familiale Rurale de La Force;NOUVELLE-AQUITAINE;;;;;;;
0241056T;Centre de formation d'apprentis Ecoles CCI de la Dordogne-;NOUVELLE-AQUITAINE;40;58;61;-2;40;35;25
0241068F;Maison Familiale Rurale de Vanxains;NOUVELLE-AQUITAINE;;;;;;;
0241072K;Maison Familiale Rurale de Salignac;NOUVELLE-AQUITAINE;;;;;;;
0241092G;Maison Familiale Rurale de Périgueux;NOUVELLE-AQUITAINE;;;;;;;
0241099P;CFA de la Dordogne;NOUVELLE-AQUITAINE;34;57;59;-2;34;38;28
