"n°UAI de l'établissement";"Libellé de l'établissement";"Région";;;"Taux";"Taux attendu";"Valeur ajoutée";;;
"0010001W";"Lycée professionnel Alexandre Bérard - Lycée des métiers de l'énergie et de l'habitat";"AUVERGNE-RHONE-ALPES";"ensemble";49;47;41;6;51;55;56
"0010006B";"Lycée polyvalent Saint-Exupéry - Lycée des métiers de l'hôtellerie et des services - Lycée des métiers des énergies du bâtiment";"AUVERGNE-RHONE-ALPES";"ensemble";36;55;46;9;52;53;56
"0010006B";"Lycée polyvalent Saint-Exupéry - Lycée des métiers de l'hôtellerie et des services - Lycée des métiers des énergies du bâtiment";"AUVERGNE-RHONE-ALPES";"dont élèves en voie pro sco";36;54;45;10;52;54;54
"0010006B";"Lycée polyvalent Saint-Exupéry - Lycée des métiers de l'hôtellerie et des services - Lycée des métiers des énergies du bâtiment";"AUVERGNE-RHONE-ALPES";"dont apprentis";;;;;;;
"0010014K";"Lycée général et technologique Edgar Quinet";"AUVERGNE-RHONE-ALPES";"ensemble";34;72;61;11;68;68;74
"0010016M";"Lycée polyvalent Joseph-Marie Carriat";"AUVERGNE-RHONE-ALPES";"ensemble";40;69;61;7;72;75;77
"0010016M";"Lycée polyvalent Joseph-Marie Carriat";"AUVERGNE-RHONE-ALPES";"dont élèves en voie pro sco";48;63;54;9;64;70;71
"0010016M";"Lycée polyvalent Joseph-Marie Carriat";"AUVERGNE-RHONE-ALPES";"dont apprentis";22;77;71;5;84;81;85
"0010020S";"Lycée professionnel Georges Charpak - Lycée des métiers de la maintenance des engins mécaniques";"AUVERGNE-RHONE-ALPES";"ensemble";52;71;61;10;71;73;78
"0010020S";"Lycée professionnel Georges Charpak - Lycée des métiers de la maintenance des engins mécaniques";"AUVERGNE-RHONE-ALPES";"dont élèves en voie pro sco";49;61;49;12;58;58;68
"0010020S";"Lycée professionnel Georges Charpak - Lycée des métiers de la maintenance des engins mécaniques";"AUVERGNE-RHONE-ALPES";"dont apprentis";55;83;77;6;88;92;92
"0010021T";"Lycée professionnel Marcelle Pardé - Lycée des métiers du réseau textile mode cuir";"AUVERGNE-RHONE-ALPES";"ensemble";50;48;43;5;44;55;61
"0010032E";"Lycée polyvalent Xavier Bichat";"AUVERGNE-RHONE-ALPES";"ensemble";23;37;39;-2;42;51;40
"0010034G";"Lycée polyvalent Paul Painlevé";"AUVERGNE-RHONE-ALPES";"ensemble";53;41;39;2;40;46;51
"0010070W";"Lycée général et technologique privé Saint Pierre";"AUVERGNE-RHONE-ALPES";"ensemble";32;70;62;8;78;65;74
"0010072Y";"Lycée polyvalent international";"AUVERGNE-RHONE-ALPES";"ensemble";42;46;55;-9;57;43;46
"0010099C";"Lycée professionnel privé Saint Joseph - Lycée des métier des services administratifs et commerciaux - Lycée des métiers de l'électronique";"AUVERGNE-RHONE-ALPES";"ensemble";56;45;43;2;49;52;57
"0010814E";"Lycée professionnel privé Saint Joseph";"AUVERGNE-RHONE-ALPES";"ensemble";47;40;42;-2;52;66;60
"0010878Z";"Lycée polyvalent privé Jeanne d'Arc";"AUVERGNE-RHONE-ALPES";"ensemble";33;38;48;-11;33;34;39
"0010966V";"Etablissement régional d'enseignement adapté Philibert Commerson";"AUVERGNE-RHONE-ALPES";"ensemble";41;18;25;-7;30;34;41
"0011010T";"Lycée professionnel du Bugey";"AUVERGNE-RHONE-ALPES";"ensemble";39;43;36;7;40;49;48
"0011118K";"Lycée professionnel Gabriel Voisin - Lycée des métiers de l'automobile, du transport et de la logistique, de la propreté";"AUVERGNE-RHONE-ALPES";"ensemble";39;52;49;4;57;59;65
"0011118K";"Lycée professionnel Gabriel Voisin - Lycée des métiers de l'automobile, du transport et de la logistique, de la propreté";"AUVERGNE-RHONE-ALPES";"dont élèves en voie pro sco";39;55;47;7;59;60;66
"0011118K";"Lycée professionnel Gabriel Voisin - Lycée des métiers de l'automobile, du transport et de la logistique, de la propreté";"AUVERGNE-RHONE-ALPES";"dont apprentis";38;34;46;-12;45;52;62
"0011119L";"Lycée polyvalent Arbez Carme - Lycée des métiers de la plasturgie et des outillages";"AUVERGNE-RHONE-ALPES";"ensemble";51;53;50;3;54;62;66
"0011119L";"Lycée polyvalent Arbez Carme - Lycée des métiers de la plasturgie et des outillages";"AUVERGNE-RHONE-ALPES";"dont élèves en voie pro sco";54;48;44;4;49;55;60
"0011119L";"Lycée polyvalent Arbez Carme - Lycée des métiers de la plasturgie et des outillages";"AUVERGNE-RHONE-ALPES";"dont apprentis";37;69;70;0;69;83;86
"0011194T";"Lycée général et technologique de la Plaine de l'Ain";"AUVERGNE-RHONE-ALPES";"ensemble";27;51;59;-9;65;68;73
"0011258M";"Lycée professionnel privé Ensemble scolaire Lamartine";"AUVERGNE-RHONE-ALPES";"ensemble";;;;;;;
"0011276G";"Lycée général et technologique du Val de Saône";"AUVERGNE-RHONE-ALPES";"ensemble";28;90;78;12;86;71;81
"0020012C";"Lycée polyvalent Jean de la Fontaine - Lycée des métiers de la santé, de la gestion et du commerce";"HAUTS-DE-FRANCE";"ensemble";47;25;34;-9;27;37;42
"0020014E";"Lycée d'enseignement général et technologique Gay Lussac";"HAUTS-DE-FRANCE";"ensemble";24;62;59;3;67;61;68
"0020014E";"Lycée d'enseignement général et technologique Gay Lussac";"HAUTS-DE-FRANCE";"dont élèves en voie pro sco";27;46;52;-5;56;48;58
"0020014E";"Lycée d'enseignement général et technologique Gay Lussac";"HAUTS-DE-FRANCE";"dont apprentis";19;85;73;12;83;80;83
"0020022N";"Lycée professionnel Jean Monnet";"HAUTS-DE-FRANCE";"ensemble";53;23;29;-6;33;32;43
"0020025S";"Lycée professionnel Château Potel - Lycée des métiers horticulture et maintenance (véhicules industriels, matériels agricoles et travaux publics)";"HAUTS-DE-FRANCE";"ensemble";46;28;32;-4;32;38;46
"0020031Y";"Lycée d'enseignement général et technologique Frédéric et Irène Joliot Curie";"HAUTS-DE-FRANCE";"ensemble";30;51;53;-3;57;54;58
"0020031Y";"Lycée d'enseignement général et technologique Frédéric et Irène Joliot Curie";"HAUTS-DE-FRANCE";"dont élèves en voie pro sco";29;47;50;-4;53;50;53
"0020031Y";"Lycée d'enseignement général et technologique Frédéric et Irène Joliot Curie";"HAUTS-DE-FRANCE";"dont apprentis";;;;;;;
"0020032Z";"Lycée général et technologique Paul Claudel";"HAUTS-DE-FRANCE";"ensemble";39;39;49;-10;45;45;49
"0020034B";"Lycée polyvalent Pierre Méchain";"HAUTS-DE-FRANCE";"ensemble";57;33;34;-1;33;37;53
"0020048S";"Lycée général et technologique Henri Martin";"HAUTS-DE-FRANCE";"ensemble";40;33;37;-4;38;48;55
"0020048S";"Lycée général et technologique Henri Martin";"HAUTS-DE-FRANCE";"dont élèves en voie pro sco";38;36;34;1;42;49;54
"0020048S";"Lycée général et technologique Henri Martin";"HAUTS-DE-FRANCE";"dont apprentis";45;;;;;;
"0020049T";"Lycée général et technologique Pierre de La Ramée";"HAUTS-DE-FRANCE";"ensemble";25;43;50;-7;53;56;60
"0020050U";"Lycée d'enseignement général et technologique Condorcet";"HAUTS-DE-FRANCE";"ensemble";43;41;47;-7;54;51;61
"0020050U";"Lycée d'enseignement général et technologique Condorcet";"HAUTS-DE-FRANCE";"dont élèves en voie pro sco";43;42;48;-6;55;52;62
"0020050U";"Lycée d'enseignement général et technologique Condorcet";"HAUTS-DE-FRANCE";"dont apprentis";48;;;;;;
"0020051V";"Lycée professionnel d'art - Lycée des métiers";"HAUTS-DE-FRANCE";"ensemble";66;;;;;;
"0020052W";"Lycée professionnel Colard Noël - Lycée des métiers du bâtiment et de l'hôtellerie";"HAUTS-DE-FRANCE";"ensemble";46;22;27;-4;29;30;39
"0020052W";"Lycée professionnel Colard Noël - Lycée des métiers du bâtiment et de l'hôtellerie";"HAUTS-DE-FRANCE";"dont élèves en voie pro sco";47;20;26;-5;27;28;37
"0020052W";"Lycée professionnel Colard Noël - Lycée des métiers du bâtiment et de l'hôtellerie";"HAUTS-DE-FRANCE";"dont apprentis";;;;;;;
"0020059D";"Lycée général et technologique Gérard de Nerval";"HAUTS-DE-FRANCE";"ensemble";35;54;54;0;62;61;70
"0020078Z";"Lycée professionnel Julie Daubie";"HAUTS-DE-FRANCE";"ensemble";43;18;24;-6;24;23;33
"0020078Z";"Lycée professionnel Julie Daubie";"HAUTS-DE-FRANCE";"dont élèves en voie pro sco";43;18;23;-5;24;22;33
"0020078Z";"Lycée professionnel Julie Daubie";"HAUTS-DE-FRANCE";"dont apprentis";;;;;;;
"0020079A";"Lycée professionnel Condorcet - Lycée des métiers";"HAUTS-DE-FRANCE";"ensemble";50;29;28;0;36;37;44
"0020088K";"Lycée professionnel Camille Claudel - Lycée des métiers de l'optique et du tertiaire";"HAUTS-DE-FRANCE";"ensemble";61;17;26;-9;21;31;37
"0020089L";"Lycée professionnel Frédéric et Irène Joliot Curie - Lycée des métiers de la gestion et de l'industrie";"HAUTS-DE-FRANCE";"ensemble";58;17;21;-4;23;24;33
"0020492Z";"Lycée professionnel privé Saint-Vincent-de-Paul - Lycée des métiers du design, de la santé et de l'hôtellerie";"HAUTS-DE-FRANCE";"ensemble";41;27;27;0;35;36;37
"0020498F";"Lycée professionnel privé Sainte Sophie - Lycée des métiers des services à la personne";"HAUTS-DE-FRANCE";"ensemble";53;30;29;1;41;47;54
"0021476U";"Lycée polyvalent Léonard De Vinci - Lycée des métiers des éco-sciences et des éco-technologies";"HAUTS-DE-FRANCE";"ensemble";46;44;37;7;54;48;60
"0021478W";"Etablissement régional d'enseignement adapté";"HAUTS-DE-FRANCE";"ensemble";57;9;10;-1;9;14;14
"0021479X";"Lycée professionnel Françoise Dolto - Lycée des métiers des services aux personnes et aux entreprises";"HAUTS-DE-FRANCE";"ensemble";51;15;21;-5;18;24;35
"0021869W";"Lycée d'enseignement général et technologique privé Saint Joseph";"HAUTS-DE-FRANCE";"ensemble";12;73;61;12;82;82;86
"0021873A";"Lycée général et technologique privé St Jean La Croix";"HAUTS-DE-FRANCE";"ensemble";18;36;48;-12;64;48;61
"0021874B";"Lycée général et technologique privé Saint Rémy";"HAUTS-DE-FRANCE";"ensemble";14;55;52;3;64;66;71
"0021906L";"Lycée professionnel privé Saint Charles - Lycée des métiers de la sécurité et de la maintenance";"HAUTS-DE-FRANCE";"ensemble";68;36;35;1;43;49;55
"0021939X";"Lycée polyvalent Jules Verne - Lycée des métiers des sciences et technologies pour un développement durable";"HAUTS-DE-FRANCE";"ensemble";54;21;31;-10;27;25;36
"0021999M";"Lycée professionnel privé Saint Joseph - Lycée des métiers de l'hôtellerie et de la restauration";"HAUTS-DE-FRANCE";"ensemble";54;;;;;;
"0022002R";"Lycée professionnel privé Saint Joseph";"HAUTS-DE-FRANCE";"ensemble";40;28;22;6;22;28;28
"0022008X";"Lycée professionnel Jean Macé - Lycée des métiers du développement durable";"HAUTS-DE-FRANCE";"ensemble";55;23;24;-2;38;32;34
"0022022M";"Lycée d'enseignement technologique privé Sainte Sophie";"HAUTS-DE-FRANCE";"ensemble";44;28;35;-7;48;36;56
"0022042J";"Lycée polyvalent Jean Bouin - Lycée des métiers de la mode, des services à la personne et aux collectivités";"HAUTS-DE-FRANCE";"ensemble";56;10;20;-10;13;23;26
"0022044L";"Lycée polyvalent Le Corbusier - Lycée des métiers de l'hôtellerie et du bâtiment";"HAUTS-DE-FRANCE";"ensemble";38;49;43;7;54;51;62
"0022044L";"Lycée polyvalent Le Corbusier - Lycée des métiers de l'hôtellerie et du bâtiment";"HAUTS-DE-FRANCE";"dont élèves en voie pro sco";40;44;35;9;50;47;58
"0022044L";"Lycée polyvalent Le Corbusier - Lycée des métiers de l'hôtellerie et du bâtiment";"HAUTS-DE-FRANCE";"dont apprentis";28;67;68;-1;65;64;76
"0022108F";"Lycée général et technologique privé Saint-Vincent-de-Paul";"HAUTS-DE-FRANCE";"ensemble";19;;;;;;
"0022172A";"Micro lycée de Saint quentin";"HAUTS-DE-FRANCE";"ensemble";;;;;;;
"0030026M";"Lycée polyvalent Paul Constans - Lycée des métiers scientifiques, industriels, administratifs et commerciaux";"AUVERGNE-RHONE-ALPES";"ensemble";56;46;44;3;50;55;59
"0030038A";"Lycée polyvalent Jean Monnet - Lycée des métiers du design et des arts verriers";"AUVERGNE-RHONE-ALPES";"ensemble";52;42;43;-1;50;45;53
"0030038A";"Lycée polyvalent Jean Monnet - Lycée des métiers du design et des arts verriers";"AUVERGNE-RHONE-ALPES";"dont élèves en voie pro sco";53;40;42;-2;49;44;53
"0030038A";"Lycée polyvalent Jean Monnet - Lycée des métiers du design et des arts verriers";"AUVERGNE-RHONE-ALPES";"dont apprentis";;;;;;;
"0030051P";"Lycée général et technologique Albert Londres - Lycée des métiers du bois, des énergies et des services aux organisations";"AUVERGNE-RHONE-ALPES";"ensemble";44;53;58;-5;59;57;68
"0030051P";"Lycée général et technologique Albert Londres - Lycée des métiers du bois, des énergies et des services aux organisations";"AUVERGNE-RHONE-ALPES";"dont élèves en voie pro sco";44;54;58;-4;60;58;68
"0030051P";"Lycée général et technologique Albert Londres - Lycée des métiers du bois, des énergies et des services aux organisations";"AUVERGNE-RHONE-ALPES";"dont apprentis";;;;;;;
"0030061A";"Lycée professionnel Albert Londres - Lycée des métiers du bois, des énergies et des services aux organisations";"AUVERGNE-RHONE-ALPES";"ensemble";57;37;35;2;41;52;56
"0030105Y";"Lycée professionnel privé Sainte-Louise";"AUVERGNE-RHONE-ALPES";"ensemble";70;;;;;;
"0030112F";"Lycée professionnel privé Anna Rodier";"AUVERGNE-RHONE-ALPES";"ensemble";40;26;35;-9;44;44;53
"0030905T";"Lycée professionnel Gustave Eiffel - Lycée des métiers de la maintenance des matériels et des véhicules motocycles";"AUVERGNE-RHONE-ALPES";"ensemble";38;61;60;1;67;66;78
"0030905T";"Lycée professionnel Gustave Eiffel - Lycée des métiers de la maintenance des matériels et des véhicules motocycles";"AUVERGNE-RHONE-ALPES";"dont élèves en voie pro sco";42;46;49;-3;56;59;71
"0030905T";"Lycée professionnel Gustave Eiffel - Lycée des métiers de la maintenance des matériels et des véhicules motocycles";"AUVERGNE-RHONE-ALPES";"dont apprentis";30;80;75;6;83;76;87
"0030924N";"Lycée professionnel Val d'Allier";"AUVERGNE-RHONE-ALPES";"ensemble";45;18;27;-8;26;38;41
"0030935A";"Lycée Privé d'Enseignement Supérieur de Vichy";"AUVERGNE-RHONE-ALPES";"ensemble";35;63;59;4;68;57;66
"0031041R";"Lycée technologique privé Anna Rodier";"AUVERGNE-RHONE-ALPES";"ensemble";23;74;62;12;63;89;89
"0031043T";"Lycée polyvalent Albert Einstein - Lycée des métiers de l'automobile";"AUVERGNE-RHONE-ALPES";"ensemble";53;53;44;9;59;64;69
"0031043T";"Lycée polyvalent Albert Einstein - Lycée des métiers de l'automobile";"AUVERGNE-RHONE-ALPES";"dont élèves en voie pro sco";55;50;42;8;58;62;67
"0031043T";"Lycée polyvalent Albert Einstein - Lycée des métiers de l'automobile";"AUVERGNE-RHONE-ALPES";"dont apprentis";;;;;;;
"0031044U";"Lycée polyvalent Geneviève Vincent";"AUVERGNE-RHONE-ALPES";"ensemble";28;30;28;2;39;29;38
"0031082K";"Lycée polyvalent Valéry Larbaud";"AUVERGNE-RHONE-ALPES";"ensemble";44;50;47;3;57;55;61
"0031082K";"Lycée polyvalent Valéry Larbaud";"AUVERGNE-RHONE-ALPES";"dont élèves en voie pro sco";44;48;45;3;55;53;61
"0031082K";"Lycée polyvalent Valéry Larbaud";"AUVERGNE-RHONE-ALPES";"dont apprentis";38;76;76;0;81;76;71
"0040003G";"Lycée général André Honnorat";"PROVENCE-ALPES-COTE D'AZUR";"ensemble";68;;;;;;
"0040007L";"Lycée professionnel lycée des métiers Beau de Rochas";"PROVENCE-ALPES-COTE D'AZUR";"ensemble";53;28;29;-2;43;41;47
"0040010P";"Lycée général et technologique Félix Esclangon";"PROVENCE-ALPES-COTE D'AZUR";"ensemble";17;55;56;-1;70;68;84
"0040011R";"Lycée professionnel Louis Martin Bret - Lycée des métiers de l'hotellerie-restauration, des secteurs tertiaire et industriel";"PROVENCE-ALPES-COTE D'AZUR";"ensemble";50;37;34;3;53;48;59
"0040011R";"Lycée professionnel Louis Martin Bret - Lycée des métiers de l'hotellerie-restauration, des secteurs tertiaire et industriel";"PROVENCE-ALPES-COTE D'AZUR";"dont élèves en voie pro sco";51;37;33;4;52;48;59
"0040011R";"Lycée professionnel Louis Martin Bret - Lycée des métiers de l'hotellerie-restauration, des secteurs tertiaire et industriel";"PROVENCE-ALPES-COTE D'AZUR";"dont apprentis";;;;;;;
"0040023D";"Lycée polyvalent Paul Arène - lycée des métiers de l'hotellerie et de la restauration des Alpes provençales";"PROVENCE-ALPES-COTE D'AZUR";"ensemble";48;48;45;4;67;45;59
"0040027H";"Lycée général et technologique Alexandra David Neel";"PROVENCE-ALPES-COTE D'AZUR";"ensemble";63;;;;;;
"0040378P";"Etablissement régional d'enseignement adapté de Haute-Provence";"PROVENCE-ALPES-COTE D'AZUR";"ensemble";36;;;;;;
"0040490L";"Lycée général et technologique Pierre-Gilles de Gennes";"PROVENCE-ALPES-COTE D'AZUR";"ensemble";37;45;49;-4;55;53;55
"0040533H";"Lycée Polyvalent Les Iscles";"PROVENCE-ALPES-COTE D'AZUR";"ensemble";39;44;46;-2;55;51;63
"0050003B";"Lycée polyvalent  d'Altitude";"PROVENCE-ALPES-COTE D'AZUR";"ensemble";33;53;40;12;64;51;56
"0050004C";"Lycée climatique Honoré Romane";"PROVENCE-ALPES-COTE D'AZUR";"ensemble";34;58;51;7;65;55;65
"0050005D";"Lycée professionnel Alpes et Durance - Lycée des Métiers pluri-actifs du bois et de l'habitat de montagne";"PROVENCE-ALPES-COTE D'AZUR";"ensemble";44;39;46;-7;49;38;53
"0050006E";"Lycée général et technologique Dominique Villars";"PROVENCE-ALPES-COTE D'AZUR";"ensemble";21;51;57;-5;60;62;63
"0050007F";"Lycée général et technologique Aristide Briand";"PROVENCE-ALPES-COTE D'AZUR";"ensemble";24;;;;;;
"0050008G";"Lycée professionnel Paul Héraud";"PROVENCE-ALPES-COTE D'AZUR";"ensemble";41;52;45;7;61;62;63
"0050009H";"Lycée professionnel Sévigné - Lycée des métiers de la restauration, des services aux entreprises et aux personnes";"PROVENCE-ALPES-COTE D'AZUR";"ensemble";48;33;34;-1;39;35;51
"0050027C";"Lycée professionnel Pierre Mendès France";"PROVENCE-ALPES-COTE D'AZUR";"ensemble";60;39;34;6;45;45;45
"0050039R";"Lycée professionnel privé Pierre et Louis Poutrain";"PROVENCE-ALPES-COTE D'AZUR";"ensemble";66;31;41;-10;57;51;51
"0060001U";"Lycée général et technologique Jacques Audiberti";"PROVENCE-ALPES-COTE D'AZUR";"ensemble";32;57;57;0;63;62;63
"0060001U";"Lycée général et technologique Jacques Audiberti";"PROVENCE-ALPES-COTE D'AZUR";"dont élèves en voie pro sco";32;55;57;-2;61;61;62
"0060001U";"Lycée général et technologique Jacques Audiberti";"PROVENCE-ALPES-COTE D'AZUR";"dont apprentis";;;;;;;
"0060002V";"Lycée professionnel Jacques Dolle";"PROVENCE-ALPES-COTE D'AZUR";"ensemble";42;42;36;6;54;49;58
"0060009C";"Lycée général et technologique Auguste Renoir";"PROVENCE-ALPES-COTE D'AZUR";"ensemble";21;64;55;9;76;56;68
"0060011E";"Lycée général Carnot";"PROVENCE-ALPES-COTE D'AZUR";"ensemble";53;49;38;11;65;62;59
"0060013G";"Lycée général et technologique Bristol";"PROVENCE-ALPES-COTE D'AZUR";"ensemble";43;48;58;-10;67;41;50
"0060014H";"Lycée général et technologique Jules Ferry";"PROVENCE-ALPES-COTE D'AZUR";"ensemble";52;55;52;3;61;62;62
"0060015J";"Lycée professionnel Les Coteaux - Lycée des métiers de la relation client, de la mode et du costume de spectacle";"PROVENCE-ALPES-COTE D'AZUR";"ensemble";47;35;35;0;53;39;54
"0060020P";"Lycée général et technologique Amiral de Grasse";"PROVENCE-ALPES-COTE D'AZUR";"ensemble";33;54;54;0;61;59;66
"0060022S";"Lycée professionnel Léon Chiris";"PROVENCE-ALPES-COTE D'AZUR";"ensemble";37;44;40;4;54;45;56
"0060022S";"Lycée professionnel Léon Chiris";"PROVENCE-ALPES-COTE D'AZUR";"dont élèves en voie pro sco";39;44;38;6;54;44;56
"0060022S";"Lycée professionnel Léon Chiris";"PROVENCE-ALPES-COTE D'AZUR";"dont apprentis";;;;;;;
"0060023T";"Lycée professionnel Francis de Croisset";"PROVENCE-ALPES-COTE D'AZUR";"ensemble";38;40;35;5;51;46;52
"0060026W";"Lycée général et technologique Pierre et Marie Curie";"PROVENCE-ALPES-COTE D'AZUR";"ensemble";25;;;;;;
"0060027X";"Lycée professionnel Pierre et Marie Curie - Lycée des métiers de l'enseigne, de la signalétique et du développement durable";"PROVENCE-ALPES-COTE D'AZUR";"ensemble";37;22;34;-12;26;21;31
"0060028Y";"Lycée professionnel Paul Valéry - Lycée des métiers de la restauration";"PROVENCE-ALPES-COTE D'AZUR";"ensemble";35;27;38;-12;33;28;39
"0060028Y";"Lycée professionnel Paul Valéry - Lycée des métiers de la restauration";"PROVENCE-ALPES-COTE D'AZUR";"dont élèves en voie pro sco";35;27;38;-12;33;29;40
"0060028Y";"Lycée professionnel Paul Valéry - Lycée des métiers de la restauration";"PROVENCE-ALPES-COTE D'AZUR";"dont apprentis";;;;;;;
"0060029Z";"Lycée général et technologique Parc Imperial";"PROVENCE-ALPES-COTE D'AZUR";"ensemble";42;52;54;-2;55;55;62
"0060029Z";"Lycée général et technologique Parc Imperial";"PROVENCE-ALPES-COTE D'AZUR";"dont élèves en voie pro sco";42;52;53;-1;55;54;61
"0060029Z";"Lycée général et technologique Parc Imperial";"PROVENCE-ALPES-COTE D'AZUR";"dont apprentis";;;;;;;
"0060031B";"Lycée général et technologique Albert Calmette";"PROVENCE-ALPES-COTE D'AZUR";"ensemble";30;50;55;-5;53;58;66
"0060033D";"Lycée polyvalent Honoré d'Estienne d'Orves - Lycée des métiers de la comptabilité";"PROVENCE-ALPES-COTE D'AZUR";"ensemble";44;50;50;0;52;56;57
"0060033D";"Lycée polyvalent Honoré d'Estienne d'Orves - Lycée des métiers de la comptabilité";"PROVENCE-ALPES-COTE D'AZUR";"dont élèves en voie pro sco";47;48;49;0;52;57;57
"0060033D";"Lycée polyvalent Honoré d'Estienne d'Orves - Lycée des métiers de la comptabilité";"PROVENCE-ALPES-COTE D'AZUR";"dont apprentis";26;58;56;3;53;53;55
"0060034E";"Lycée polyvalent hôtelier Tourisme Paul Augier - Lycée des métiers de l'hôtellerie et du tourisme";"PROVENCE-ALPES-COTE D'AZUR";"ensemble";30;51;51;1;62;52;64
"0060034E";"Lycée polyvalent hôtelier Tourisme Paul Augier - Lycée des métiers de l'hôtellerie et du tourisme";"PROVENCE-ALPES-COTE D'AZUR";"dont élèves en voie pro sco";34;50;50;0;61;50;64
"0060034E";"Lycée polyvalent hôtelier Tourisme Paul Augier - Lycée des métiers de l'hôtellerie et du tourisme";"PROVENCE-ALPES-COTE D'AZUR";"dont apprentis";12;55;53;2;62;56;64
"0060038J";"Lycée professionnel Vauban";"PROVENCE-ALPES-COTE D'AZUR";"ensemble";35;34;40;-6;43;38;42
"0060038J";"Lycée professionnel Vauban";"PROVENCE-ALPES-COTE D'AZUR";"dont élèves en voie pro sco";40;29;34;-6;40;37;41
"0060038J";"Lycée professionnel Vauban";"PROVENCE-ALPES-COTE D'AZUR";"dont apprentis";23;46;54;-8;48;39;46
"0060040L";"Lycée professionnel Pasteur";"PROVENCE-ALPES-COTE D'AZUR";"ensemble";51;27;31;-4;36;35;33
"0060042N";"Lycée professionnel Les Palmiers";"PROVENCE-ALPES-COTE D'AZUR";"ensemble";37;34;33;0;38;41;43
"0060042N";"Lycée professionnel Les Palmiers";"PROVENCE-ALPES-COTE D'AZUR";"dont élèves en voie pro sco";37;34;33;1;38;41;43
"0060042N";"Lycée professionnel Les Palmiers";"PROVENCE-ALPES-COTE D'AZUR";"dont apprentis";;;;;;;
"0060043P";"Lycée professionnel Magnan - Lycée des métiers des soins et services à la personne";"PROVENCE-ALPES-COTE D'AZUR";"ensemble";41;34;34;0;43;45;48
"0060075Z";"Lycée général et technologique Les Eucalyptus";"PROVENCE-ALPES-COTE D'AZUR";"ensemble";45;52;52;-1;61;64;67
"0060082G";"Lycée professionnel Les Eucalyptus                 Lycée des sciences appliquées aux métiers de l'Industrie";"PROVENCE-ALPES-COTE D'AZUR";"ensemble";54;43;41;2;55;55;57
"0060670W";"Lycée général et technologique privé Sainte Marie";"PROVENCE-ALPES-COTE D'AZUR";"ensemble";24;25;37;-12;49;41;54
"0060673Z";"Lycée général et technologique privé Stanislas";"PROVENCE-ALPES-COTE D'AZUR";"ensemble";12;18;30;-12;60;28;60
"0060674A";"Lycée général et technologique privé Fénélon";"PROVENCE-ALPES-COTE D'AZUR";"ensemble";8;52;55;-2;74;52;70
"0060677D";"Lycée général et technologique privé Sasserno";"PROVENCE-ALPES-COTE D'AZUR";"ensemble";36;32;44;-12;50;48;52
"0060715V";"Lycée professionnel privé La Providence";"PROVENCE-ALPES-COTE D'AZUR";"ensemble";30;29;27;3;33;33;44
"0060750H";"Lycée polyvalent privé Institution Saint Joseph Carnolés";"PROVENCE-ALPES-COTE D'AZUR";"ensemble";44;28;33;-5;24;28;40
"0060774J";"Lycée polyvalent privé Saint Joseph";"PROVENCE-ALPES-COTE D'AZUR";"ensemble";28;42;53;-11;47;53;55
"0060776L";"Lycée professionnel privé Saint Vincent de Paul - Lycée des métiers du tertiaire";"PROVENCE-ALPES-COTE D'AZUR";"ensemble";47;41;42;-1;43;37;47
"0061394H";"Lycée professionnel privé Les Fauvettes";"PROVENCE-ALPES-COTE D'AZUR";"ensemble";40;32;35;-3;46;50;56
"0061462G";"Lycée professionnel privé Don Bosco - Lycée des métiers de la maintenance industrielle et industrie graphique";"PROVENCE-ALPES-COTE D'AZUR";"ensemble";57;43;40;3;47;37;44
"0061478Z";"Lycée polyvalent Léonard de Vinci - Lycée des métiers du bâtiment et travaux publics";"PROVENCE-ALPES-COTE D'AZUR";"ensemble";51;50;50;0;59;58;68
"0061561P";"Lycée professionnel Alfred Hutinel - lycée des métiers des énergies électriques";"PROVENCE-ALPES-COTE D'AZUR";"ensemble";35;42;39;3;43;46;52
"0061635V";"Lycée professionnel Auguste Escoffier";"PROVENCE-ALPES-COTE D'AZUR";"ensemble";35;37;35;2;46;46;53
"0061691F";"Lycée général et technologique Thierry Maulnier - Lycée des métiers de la chimie";"PROVENCE-ALPES-COTE D'AZUR";"ensemble";58;45;54;-8;45;59;68
"0061760F";"Lycée général et technologique Alexis de Tocqueville";"PROVENCE-ALPES-COTE D'AZUR";"ensemble";50;62;51;12;75;50;67
"0061763J";"Lycée général et technologique Guillaume Apollinaire";"PROVENCE-ALPES-COTE D'AZUR";"ensemble";29;48;50;-2;54;48;54
"0061987C";"Lycée polyvalent de la Montagne";"PROVENCE-ALPES-COTE D'AZUR";"ensemble";60;32;38;-6;47;53;53
"0062089N";"Lycée Général et Technologique René Goscinny";"PROVENCE-ALPES-COTE D'AZUR";"ensemble";50;30;39;-9;45;50;60
"0070001N";"Lycée polyvalent public Boissy d'Anglas - Lycée des métiers de la création industrielle";"AUVERGNE-RHONE-ALPES";"ensemble";45;65;55;10;68;69;69
"0070001N";"Lycée polyvalent public Boissy d'Anglas - Lycée des métiers de la création industrielle";"AUVERGNE-RHONE-ALPES";"dont élèves en voie pro sco";46;64;52;12;67;66;70
"0070001N";"Lycée polyvalent public Boissy d'Anglas - Lycée des métiers de la création industrielle";"AUVERGNE-RHONE-ALPES";"dont apprentis";42;65;69;-4;71;75;67
"0070002P";"Lycée professionnel Joseph et Etienne De Montgolfier";"AUVERGNE-RHONE-ALPES";"ensemble";37;27;32;-5;44;38;49
"0070002P";"Lycée professionnel Joseph et Etienne De Montgolfier";"AUVERGNE-RHONE-ALPES";"dont élèves en voie pro sco";36;28;32;-4;44;38;49
