"n°UAI de l'établissement";"Libellé de l'établissement";"Région";;;"Taux";"Taux attendu";"Valeur ajoutée";;;
"0590111A";"Lycée professionnel Sonia Delaunay - Lycée des Métiers de la Mode et des Textiles";"HAUTS-DE-FRANCE";"ensemble";54;22;27;-5;25;30;33
"0590112B";"Lycée général et technologique Dupleix";"HAUTS-DE-FRANCE";"ensemble";27;37;48;-11;47;45;53
"0590117G";"Lycée général et technologique Louis Pasteur";"HAUTS-DE-FRANCE";"ensemble";32;;;;;;
"0590117G";"Lycée général et technologique Louis Pasteur";"HAUTS-DE-FRANCE";"dont élèves en voie pro sco";37;;;;;;
"0590117G";"Lycée général et technologique Louis Pasteur";"HAUTS-DE-FRANCE";"dont apprentis";14;;;;;;
"0590121L";"Lycée général et technologique César Baggio";"HAUTS-DE-FRANCE";"ensemble";46;53;50;3;53;62;65
"0590122M";"Lycée polyvalent Valentine Labbé - Lycée des Métiers de la Biologie, de la Biochimie et des Biotechnologies, de la Santé et du Social";"HAUTS-DE-FRANCE";"ensemble";48;39;39;0;49;47;50
"0590122M";"Lycée polyvalent Valentine Labbé - Lycée des Métiers de la Biologie, de la Biochimie et des Biotechnologies, de la Santé et du Social";"HAUTS-DE-FRANCE";"dont élèves en voie pro sco";57;36;41;-4;47;43;48
"0590122M";"Lycée polyvalent Valentine Labbé - Lycée des Métiers de la Biologie, de la Biochimie et des Biotechnologies, de la Santé et du Social";"HAUTS-DE-FRANCE";"dont apprentis";9;45;37;8;54;55;55
"0590125R";"Lycée Hôtelier International de Lille";"HAUTS-DE-FRANCE";"ensemble";41;54;46;8;59;60;66
"0590125R";"Lycée Hôtelier International de Lille";"HAUTS-DE-FRANCE";"dont élèves en voie pro sco";43;50;41;9;55;56;60
"0590125R";"Lycée Hôtelier International de Lille";"HAUTS-DE-FRANCE";"dont apprentis";37;62;55;7;69;69;79
"0590133Z";"Lycée professionnel Maurice Duhamel";"HAUTS-DE-FRANCE";"ensemble";47;34;31;3;44;44;50
"0590144L";"Lycée professionnel Automobile Alfred Mongy - Lycée des Métiers de la maintenance des véhicules";"HAUTS-DE-FRANCE";"ensemble";37;56;52;4;62;66;68
"0590144L";"Lycée professionnel Automobile Alfred Mongy - Lycée des Métiers de la maintenance des véhicules";"HAUTS-DE-FRANCE";"dont élèves en voie pro sco";45;48;46;2;57;59;60
"0590144L";"Lycée professionnel Automobile Alfred Mongy - Lycée des Métiers de la maintenance des véhicules";"HAUTS-DE-FRANCE";"dont apprentis";14;72;64;8;72;79;82
"0590149S";"Lycée polyvalent Pierre Forest";"HAUTS-DE-FRANCE";"ensemble";54;39;37;2;37;45;49
"0590149S";"Lycée polyvalent Pierre Forest";"HAUTS-DE-FRANCE";"dont élèves en voie pro sco";55;35;34;1;34;44;47
"0590149S";"Lycée polyvalent Pierre Forest";"HAUTS-DE-FRANCE";"dont apprentis";;;;;;;
"0590168M";"Lycée polyvalent Eugène Thomas";"HAUTS-DE-FRANCE";"ensemble";47;15;20;-6;29;29;38
"0590184E";"Lycée général Jean Rostand";"HAUTS-DE-FRANCE";"ensemble";36;;;;;;
"0590184E";"Lycée général Jean Rostand";"HAUTS-DE-FRANCE";"dont élèves en voie pro sco";41;;;;;;
"0590184E";"Lycée général Jean Rostand";"HAUTS-DE-FRANCE";"dont apprentis";17;;;;;;
"0590185F";"LPO Jean Moulin - Lycée des métiers de la sécurité et de la prévention - Lycée des métiers des services administratifs et de la relation aux clients";"HAUTS-DE-FRANCE";"ensemble";42;52;48;3;45;51;50
"0590185F";"LPO Jean Moulin - Lycée des métiers de la sécurité et de la prévention - Lycée des métiers des services administratifs et de la relation aux clients";"HAUTS-DE-FRANCE";"dont élèves en voie pro sco";46;50;47;3;41;49;48
"0590185F";"LPO Jean Moulin - Lycée des métiers de la sécurité et de la prévention - Lycée des métiers des services administratifs et de la relation aux clients";"HAUTS-DE-FRANCE";"dont apprentis";13;62;56;6;64;64;57
"0590186G";"Lycée professionnel Turgot - Lycée des Métiers des Services Administratifs et de la Relation Client";"HAUTS-DE-FRANCE";"ensemble";61;28;26;1;32;34;38
"0590187H";"Lycée professionnel Louis Loucheur";"HAUTS-DE-FRANCE";"ensemble";49;43;31;12;47;48;49
"0590189K";"Lycée professionnel Lavoisier";"HAUTS-DE-FRANCE";"ensemble";57;30;31;-2;34;33;40
"0590192N";"Lycée polyvalent Ernest Couteaux";"HAUTS-DE-FRANCE";"ensemble";57;27;29;-2;39;40;42
"0590198V";"Lycée professionnel Georges Guynemer";"HAUTS-DE-FRANCE";"ensemble";48;29;29;-1;43;43;46
"0590198V";"Lycée professionnel Georges Guynemer";"HAUTS-DE-FRANCE";"dont élèves en voie pro sco";48;28;28;0;42;42;45
"0590198V";"Lycée professionnel Georges Guynemer";"HAUTS-DE-FRANCE";"dont apprentis";;;;;;;
"0590207E";"Lycée général et technologique Louis Pasteur";"HAUTS-DE-FRANCE";"ensemble";38;62;53;8;50;65;65
"0590214M";"Lycée polyvalent Colbert - Lycée des métiers du numérique et des technologies innovantes";"HAUTS-DE-FRANCE";"ensemble";54;43;47;-4;44;52;51
"0590214M";"Lycée polyvalent Colbert - Lycée des métiers du numérique et des technologies innovantes";"HAUTS-DE-FRANCE";"dont élèves en voie pro sco";54;41;46;-4;43;51;50
"0590214M";"Lycée polyvalent Colbert - Lycée des métiers du numérique et des technologies innovantes";"HAUTS-DE-FRANCE";"dont apprentis";;;;;;;
"0590215N";"Lycée général et technologique Sévigné";"HAUTS-DE-FRANCE";"ensemble";50;44;47;-3;45;48;57
"0590216P";"Lycée professionnel Le Corbusier";"HAUTS-DE-FRANCE";"ensemble";54;25;27;-2;27;32;37
"0590217R";"Lycée professionnel Sévigné - Lycée des Métiers de la Mode et des Textiles";"HAUTS-DE-FRANCE";"ensemble";56;34;28;5;35;36;44
"0590221V";"Lycée général et technologique Henri Wallon";"HAUTS-DE-FRANCE";"ensemble";43;50;50;0;55;55;60
"0590221V";"Lycée général et technologique Henri Wallon";"HAUTS-DE-FRANCE";"dont élèves en voie pro sco";46;52;51;2;57;57;61
"0590221V";"Lycée général et technologique Henri Wallon";"HAUTS-DE-FRANCE";"dont apprentis";;;;;;;
"0590222W";"Lycée général et technologique Watteau";"HAUTS-DE-FRANCE";"ensemble";57;;;;;;
"0590223X";"Lycée général et technologique du Hainaut";"HAUTS-DE-FRANCE";"ensemble";44;65;53;12;74;70;79
"0590233H";"Lycée polyvalent Emile Zola";"HAUTS-DE-FRANCE";"ensemble";52;35;42;-7;38;40;47
"0590249A";"Lycée professionnel Jacques-Yves Cousteau";"HAUTS-DE-FRANCE";"ensemble";51;33;27;6;38;36;43
"0590252D";"Lycée professionnel Louis-Léopold Boilly";"HAUTS-DE-FRANCE";"ensemble";49;27;30;-3;36;41;39
"0590252D";"Lycée professionnel Louis-Léopold Boilly";"HAUTS-DE-FRANCE";"dont élèves en voie pro sco";48;27;29;-2;36;42;39
"0590252D";"Lycée professionnel Louis-Léopold Boilly";"HAUTS-DE-FRANCE";"dont apprentis";;;;;;;
"0590255G";"Lycée professionnel Guy Debeyre - Lycée des Métiers du Transport et de la Logistique du Littoral";"HAUTS-DE-FRANCE";"ensemble";60;29;37;-8;32;39;42
"0590255G";"Lycée professionnel Guy Debeyre - Lycée des Métiers du Transport et de la Logistique du Littoral";"HAUTS-DE-FRANCE";"dont élèves en voie pro sco";61;27;36;-9;31;38;42
"0590255G";"Lycée professionnel Guy Debeyre - Lycée des Métiers du Transport et de la Logistique du Littoral";"HAUTS-DE-FRANCE";"dont apprentis";;;;;;;
"0590257J";"Lycée professionnel Ile de Flandre";"HAUTS-DE-FRANCE";"ensemble";55;27;33;-5;34;41;46
"0590257J";"Lycée professionnel Ile de Flandre";"HAUTS-DE-FRANCE";"dont élèves en voie pro sco";56;27;33;-5;33;40;47
"0590257J";"Lycée professionnel Ile de Flandre";"HAUTS-DE-FRANCE";"dont apprentis";;;;;;;
"0590258K";"Lycée général et technologique Gaston Berger";"HAUTS-DE-FRANCE";"ensemble";35;59;57;2;63;66;67
"0590258K";"Lycée général et technologique Gaston Berger";"HAUTS-DE-FRANCE";"dont élèves en voie pro sco";39;57;55;2;61;64;66
"0590258K";"Lycée général et technologique Gaston Berger";"HAUTS-DE-FRANCE";"dont apprentis";14;66;65;2;69;72;74
"0590263R";"Lycée professionnel Fernand Léger - Lycée des Métiers de l'Énergie, du Numérique et de la Métallurgie";"HAUTS-DE-FRANCE";"ensemble";56;35;29;6;32;35;38
"0590264S";"Lycée professionnel Alfred Kastler - Lycée des Métiers de la Conduite et de la Maintenance des systèmes";"HAUTS-DE-FRANCE";"ensemble";59;27;24;3;31;28;38
"0590265T";"Lycée Professionnel Edmond Labbé";"HAUTS-DE-FRANCE";"ensemble";35;58;56;2;64;63;63
"0590265T";"Lycée Professionnel Edmond Labbé";"HAUTS-DE-FRANCE";"dont élèves en voie pro sco";53;33;29;4;40;40;39
"0590265T";"Lycée Professionnel Edmond Labbé";"HAUTS-DE-FRANCE";"dont apprentis";14;74;74;0;79;78;79
"0590266U";"Lycée professionnel César Baggio - Lycée des Métiers des Sciences de l'Ingénieur et du Développement Durable";"HAUTS-DE-FRANCE";"ensemble";55;46;49;-2;49;51;55
"0590266U";"Lycée professionnel César Baggio - Lycée des Métiers des Sciences de l'Ingénieur et du Développement Durable";"HAUTS-DE-FRANCE";"dont élèves en voie pro sco";64;28;34;-5;34;35;41
"0590266U";"Lycée professionnel César Baggio - Lycée des Métiers des Sciences de l'Ingénieur et du Développement Durable";"HAUTS-DE-FRANCE";"dont apprentis";15;82;79;3;77;84;82
"0590270Y";"Lycée professionnel du Hainaut - Lycée des Métiers de l'Automobile - Lycée des Métiers de la Chaudronnerie";"HAUTS-DE-FRANCE";"ensemble";57;40;33;7;47;52;56
"0590270Y";"Lycée professionnel du Hainaut - Lycée des Métiers de l'Automobile - Lycée des Métiers de la Chaudronnerie";"HAUTS-DE-FRANCE";"dont élèves en voie pro sco";61;32;26;5;41;45;50
"0590270Y";"Lycée professionnel du Hainaut - Lycée des Métiers de l'Automobile - Lycée des Métiers de la Chaudronnerie";"HAUTS-DE-FRANCE";"dont apprentis";32;75;63;12;75;80;78
"0590282L";"Lycée général et technologique Jules Mousseron";"HAUTS-DE-FRANCE";"ensemble";42;47;47;0;47;54;49
"0592610S";"Lycée Professionnel Pierre-Joseph Laurent";"HAUTS-DE-FRANCE";"ensemble";42;26;25;1;35;32;40
"0592611T";"Lycée professionnel Louis Blériot - Lycée des Métiers du Bâtiment et des Energies durables";"HAUTS-DE-FRANCE";"ensemble";49;27;30;-3;30;35;39
"0592712C";"Lycée professionnel Louis Armand";"HAUTS-DE-FRANCE";"ensemble";54;15;21;-6;26;28;30
"0592832H";"Lycée professionnel Vertes Feuilles - Lycée des métiers de la sécurité et de la prévention";"HAUTS-DE-FRANCE";"ensemble";44;29;34;-5;45;49;45
"0592832H";"Lycée professionnel Vertes Feuilles - Lycée des métiers de la sécurité et de la prévention";"HAUTS-DE-FRANCE";"dont élèves en voie pro sco";47;26;27;-1;43;45;42
"0592832H";"Lycée professionnel Vertes Feuilles - Lycée des métiers de la sécurité et de la prévention";"HAUTS-DE-FRANCE";"dont apprentis";23;45;57;-12;50;65;60
"0592833J";"Lycée professionnel Les Hauts de Flandre";"HAUTS-DE-FRANCE";"ensemble";44;32;30;2;39;42;42
"0592850C";"Lycée professionnel Antoine de Saint-Exupéry";"HAUTS-DE-FRANCE";"ensemble";30;45;38;7;47;49;55
"0592916Z";"Lycée général et technologique privé Notre Dame de Grâce";"HAUTS-DE-FRANCE";"ensemble";20;34;46;-12;24;46;59
"0592921E";"Lycée général et technologique privé Saint Rémi";"HAUTS-DE-FRANCE";"ensemble";23;50;51;-1;55;59;61
"0592926K";"Lycée général et technologique privé Saint Jude";"HAUTS-DE-FRANCE";"ensemble";15;68;57;10;77;62;77
"0592928M";"Lycée Polyvalent privé Sainte Jeanne d'Arc - Lycée des Métiers de l'Hôtellerie Restauration - Lycée des Métiers de l'Esthétique et de la Coiffure";"HAUTS-DE-FRANCE";"ensemble";29;46;44;2;51;57;60
"0592963A";"Lycée polyvalent privé Saint Martin";"HAUTS-DE-FRANCE";"ensemble";30;25;31;-7;33;38;40
"0592964B";"Lycée professionnel privé Léonard de Vinci";"HAUTS-DE-FRANCE";"ensemble";61;41;38;3;44;47;47
"0592965C";"Lycée Polyvalent privé EIC Industriel et Commercial - Lycée des Métiers du Commerce et de la Vente";"HAUTS-DE-FRANCE";"ensemble";42;55;49;6;57;61;63
"0592966D";"Lycée polyvalent privé EIC Jehanne d'Arc - Lycée des Métiers du Commerce et de la Vente";"HAUTS-DE-FRANCE";"ensemble";60;38;37;2;42;38;47
"0592967E";"Lycée polyvalent privé La Sagesse";"HAUTS-DE-FRANCE";"ensemble";52;37;33;4;36;34;48
"0592969G";"Lycée polyvalent privé Dampierre";"HAUTS-DE-FRANCE";"ensemble";53;49;38;11;49;49;59
"0592973L";"Lycée professionnel privé Saint François d'Assise";"HAUTS-DE-FRANCE";"ensemble";61;41;34;6;38;47;48
"0592976P";"Lycée polyvalent privé Hélène Boucher";"HAUTS-DE-FRANCE";"ensemble";48;27;29;-2;30;39;47
"0592980U";"Lycée polyvalent privé EIC Marie Noël";"HAUTS-DE-FRANCE";"ensemble";38;34;29;5;38;32;43
"0593006X";"Lycée polyvalent privé Notre-Dame d'Annay";"HAUTS-DE-FRANCE";"ensemble";41;42;42;0;45;55;56
"0593007Y";"Lycée général et technologique privé Frédéric Ozanam - Lycée des Métiers de la Construction de l'Environnement et des Energies";"HAUTS-DE-FRANCE";"ensemble";57;51;51;0;55;57;63
"0593015G";"Lycée professionnel privé Camille de Lellis";"HAUTS-DE-FRANCE";"ensemble";51;39;33;6;40;42;45
"0593020M";"Lycée professionnel privé de la Chambre des Métiers et de l'Artisanat (CMA) Hauts de France";"HAUTS-DE-FRANCE";"ensemble";53;;;;;;
"0593027V";"Lycée professionnel privé Industries Lilloises - Lycée des Métiers de la Construction de l'Environnement et des Énergies";"HAUTS-DE-FRANCE";"ensemble";68;35;41;-6;41;42;45
"0593030Y";"Lycée professionnel privé Notre-Dame du Sacré-Coeur - Lycée des Métiers du Bien-Être, de la Santé et du Social";"HAUTS-DE-FRANCE";"ensemble";48;54;46;9;57;50;52
"0593034C";"Lycée polyvalent privé Théophile Legrand";"HAUTS-DE-FRANCE";"ensemble";48;33;38;-4;38;42;53
"0593036E";"Lycée polyvalent privé Notre Dame du Tilleul";"HAUTS-DE-FRANCE";"ensemble";44;28;39;-11;30;28;35
"0593040J";"Lycée polyvalent privé Notre-Dame de La Providence";"HAUTS-DE-FRANCE";"ensemble";56;62;50;12;73;64;70
"0593058D";"Lycée polyvalent privé Vauban - Lycée des métiers";"HAUTS-DE-FRANCE";"ensemble";46;37;39;-2;45;44;54
"0593060F";"Lycée Polyvalent Privé Institut Nicolas Barré - Lycée des Métiers de la Sécurité-prévention, de l'Automobile et de la Maintenance des matériels";"HAUTS-DE-FRANCE";"ensemble";50;46;39;6;51;47;48
"0593061G";"Lycée polyvalent privé Saint Luc - Lycée des Métiers de l'Optique, de la Santé et du Social";"HAUTS-DE-FRANCE";"ensemble";44;41;38;3;47;49;58
"0593063J";"Lycée professionnel privé Sainte Marie";"HAUTS-DE-FRANCE";"ensemble";62;33;37;-3;38;35;43
"0593066M";"Lycée professionnel privé Jean Paul II";"HAUTS-DE-FRANCE";"ensemble";44;19;21;-2;30;29;37
"0593071T";"Lycée polyvalent privé Deforest de Lewarde";"HAUTS-DE-FRANCE";"ensemble";43;36;40;-4;43;39;45
"0593077Z";"Lycée polyvalent privé Saint Joseph";"HAUTS-DE-FRANCE";"ensemble";68;41;45;-3;45;45;49
"0593078A";"Lycée polyvalent privé Fondation Depoorter - Lycée des Métiers de la Santé et du Social";"HAUTS-DE-FRANCE";"ensemble";40;23;34;-11;32;32;47
"0593079B";"Lycée professionnel privé Sainte Bernadette";"HAUTS-DE-FRANCE";"ensemble";47;14;22;-8;28;33;39
"0593104D";"Lycée polyvalent privé Saint Pierre";"HAUTS-DE-FRANCE";"ensemble";44;30;32;-2;37;41;45
"0593117T";"Lycée polyvalent privé La Salle";"HAUTS-DE-FRANCE";"ensemble";50;53;50;3;60;62;71
"0593136N";"Lycée général et technologique privé Saint Jacques";"HAUTS-DE-FRANCE";"ensemble";;;;;;;
"0593495D";"Lycée Professionnel Paul Langevin";"HAUTS-DE-FRANCE";"ensemble";47;37;33;4;34;44;46
"0593495D";"Lycée Professionnel Paul Langevin";"HAUTS-DE-FRANCE";"dont élèves en voie pro sco";47;37;33;4;35;44;46
"0593495D";"Lycée Professionnel Paul Langevin";"HAUTS-DE-FRANCE";"dont apprentis";;;;;;;
"0594278E";"Lycée technologique privé EPID";"HAUTS-DE-FRANCE";"ensemble";22;58;51;8;49;65;69
"0594302F";"Lycée professionnel François Mansart - Lycée des Métiers du Bâtiment";"HAUTS-DE-FRANCE";"ensemble";40;25;22;3;33;36;42
"0594302F";"Lycée professionnel François Mansart - Lycée des Métiers du Bâtiment";"HAUTS-DE-FRANCE";"dont élèves en voie pro sco";40;24;21;3;32;35;41
"0594302F";"Lycée professionnel François Mansart - Lycée des Métiers du Bâtiment";"HAUTS-DE-FRANCE";"dont apprentis";;;;;;;
"0594375K";"Lycée professionnel Dinah Derycke";"HAUTS-DE-FRANCE";"ensemble";53;42;42;1;41;45;53
"0594375K";"Lycée professionnel Dinah Derycke";"HAUTS-DE-FRANCE";"dont élèves en voie pro sco";61;27;31;-3;28;35;42
"0594375K";"Lycée professionnel Dinah Derycke";"HAUTS-DE-FRANCE";"dont apprentis";25;72;64;9;66;66;74
"0594380R";"Etablissement régional d'enseignement adapté déficients intellectuels légers handicapés sociaux Colette Magny";"HAUTS-DE-FRANCE";"ensemble";54;9;15;-6;9;22;35
"0594391C";"Lycée technologique Ecole Sup Arts Appliqués Textile";"HAUTS-DE-FRANCE";"ensemble";76;35;45;-9;42;55;61
"0594400M";"Lycée professionnel Automobile et Transports - Lycée des Métiers du Transport et de la Logistique du Littoral";"HAUTS-DE-FRANCE";"ensemble";31;51;43;9;56;54;63
"0594404S";"Lycée professionnel René Cassin";"HAUTS-DE-FRANCE";"ensemble";39;25;29;-4;38;39;31
"0594404S";"Lycée professionnel René Cassin";"HAUTS-DE-FRANCE";"dont élèves en voie pro sco";39;20;25;-5;35;37;30
"0594404S";"Lycée professionnel René Cassin";"HAUTS-DE-FRANCE";"dont apprentis";38;;;;;;
"0594424N";"Lycée général et technologique Raymond Queneau";"HAUTS-DE-FRANCE";"ensemble";29;55;56;-1;58;70;60
"0594532F";"Lycée professionnel Ambroise Croizat";"HAUTS-DE-FRANCE";"ensemble";38;15;18;-3;28;36;37
"0594541R";"Etablissement régional d'enseignement adapté Déficients visuels Ignace Pleyel";"HAUTS-DE-FRANCE";"ensemble";50;7;18;-11;3;31;24
"0594652L";"Lycée professionnel des Plaines du Nord";"HAUTS-DE-FRANCE";"ensemble";42;14;26;-12;25;19;35
"0594653M";"Lycée professionnel André Jurénil";"HAUTS-DE-FRANCE";"ensemble";54;17;22;-6;29;32;37
"0595480L";"Lycée professionnel Ile Jeanty";"HAUTS-DE-FRANCE";"ensemble";46;22;28;-5;32;33;40
"0595483P";"Etablissement régional d'enseignement adapté Nelson Mandela";"HAUTS-DE-FRANCE";"ensemble";35;12;23;-11;21;24;26
"0595616J";"Lycée général et technologique du Noordover";"HAUTS-DE-FRANCE";"ensemble";25;47;50;-3;51;51;49
"0595657D";"Lycée polyvalent privé Institut Saint Vincent de Paul - Lycée des Métiers du Bien-Être, de la Santé et du Social";"HAUTS-DE-FRANCE";"ensemble";37;40;39;0;49;52;51
"0595678B";"Lycée professionnel Léonard de Vinci";"HAUTS-DE-FRANCE";"ensemble";41;31;25;5;34;36;39
"0595786U";"Lycée général et technologique Jean Prouvé";"HAUTS-DE-FRANCE";"ensemble";39;66;60;6;68;71;75
"0595786U";"Lycée général et technologique Jean Prouvé";"HAUTS-DE-FRANCE";"dont élèves en voie pro sco";41;65;57;7;67;69;72
"0595786U";"Lycée général et technologique Jean Prouvé";"HAUTS-DE-FRANCE";"dont apprentis";21;74;77;-2;74;85;89
"0595787V";"Lycée professionnel Alain Savary - Lycée des Métiers";"HAUTS-DE-FRANCE";"ensemble";46;25;31;-6;32;38;38
"0595809U";"Lycée général et technologique de l'Escaut";"HAUTS-DE-FRANCE";"ensemble";58;45;48;-3;51;53;58
"0595856V";"Lycée professionnel de L'Yser";"HAUTS-DE-FRANCE";"ensemble";49;22;25;-3;27;36;42
"0595867G";"Lycée général et technologique international Montebello";"HAUTS-DE-FRANCE";"ensemble";35;37;49;-12;44;51;62
"0595884A";"Lycée polyvalent André Lurcat";"HAUTS-DE-FRANCE";"ensemble";58;27;35;-8;31;39;41
"0595885B";"Lycée général et technologique Arthur Rimbaud";"HAUTS-DE-FRANCE";"ensemble";34;53;55;-2;60;56;64
"0595894L";"Lycée professionnel François Rabelais";"HAUTS-DE-FRANCE";"ensemble";50;25;29;-5;31;34;41
"0595894L";"Lycée professionnel François Rabelais";"HAUTS-DE-FRANCE";"dont élèves en voie pro sco";50;24;28;-5;31;33;40
"0595894L";"Lycée professionnel François Rabelais";"HAUTS-DE-FRANCE";"dont apprentis";;;;;;;
"0595918M";"Lycée professionnel privé EPID - Lycée des Métiers des Industries et des innovations technologiques";"HAUTS-DE-FRANCE";"ensemble";66;42;33;9;41;47;48
"0596854E";"Lycée polyvalent du Pays de Condé - Lycée des Métiers de la Conduite et de la Maintenance des systèmes";"HAUTS-DE-FRANCE";"ensemble";44;27;32;-5;35;38;46
"0596925G";"Lycée polyvalent Charlotte Perriand";"HAUTS-DE-FRANCE";"ensemble";51;44;32;11;48;56;58
"0596957S";"Lycée professionnel Aimé Césaire";"HAUTS-DE-FRANCE";"ensemble";57;24;29;-5;27;34;31
"0597005U";"Lycée polyvalent du Val de Lys";"HAUTS-DE-FRANCE";"ensemble";39;11;23;-12;18;24;38
"0600001A";"Lycée général et technologique Félix Faure";"HAUTS-DE-FRANCE";"ensemble";41;62;60;2;64;62;66
"0600001A";"Lycée général et technologique Félix Faure";"HAUTS-DE-FRANCE";"dont élèves en voie pro sco";43;60;57;3;63;61;63
"0600001A";"Lycée général et technologique Félix Faure";"HAUTS-DE-FRANCE";"dont apprentis";25;75;74;1;71;71;83
"0600002B";"Lycée polyvalent Paul Langevin - Lycée des métiers de l'industrie et du génie civil";"HAUTS-DE-FRANCE";"ensemble";50;50;49;1;63;60;67
"0600002B";"Lycée polyvalent Paul Langevin - Lycée des métiers de l'industrie et du génie civil";"HAUTS-DE-FRANCE";"dont élèves en voie pro sco";54;42;42;0;57;54;61
"0600002B";"Lycée polyvalent Paul Langevin - Lycée des métiers de l'industrie et du génie civil";"HAUTS-DE-FRANCE";"dont apprentis";32;84;78;6;91;84;91
"0600003C";"Lycée professionnel Jean-Baptiste Corot - Lycée des métiers de l'habitat et du commerce";"HAUTS-DE-FRANCE";"ensemble";49;33;34;-1;41;47;48
"0600003C";"Lycée professionnel Jean-Baptiste Corot - Lycée des métiers de l'habitat et du commerce";"HAUTS-DE-FRANCE";"dont élèves en voie pro sco";51;32;32;0;40;46;46
"0600003C";"Lycée professionnel Jean-Baptiste Corot - Lycée des métiers de l'habitat et du commerce";"HAUTS-DE-FRANCE";"dont apprentis";17;42;54;-12;58;58;71
"0600004D";"Lycée professionnel Les Jacobins";"HAUTS-DE-FRANCE";"ensemble";48;34;33;0;39;41;47
"0600004D";"Lycée professionnel Les Jacobins";"HAUTS-DE-FRANCE";"dont élèves en voie pro sco";48;34;33;1;39;42;46
"0600004D";"Lycée professionnel Les Jacobins";"HAUTS-DE-FRANCE";"dont apprentis";40;;;;;;
"0600009J";"Lycée général et technologique Jean Rostand";"HAUTS-DE-FRANCE";"ensemble";31;48;55;-7;58;54;54
"0600013N";"Lycée général et technologique Cassini";"HAUTS-DE-FRANCE";"ensemble";36;52;63;-11;53;57;62
"0600013N";"Lycée général et technologique Cassini";"HAUTS-DE-FRANCE";"dont élèves en voie pro sco";32;45;57;-12;48;52;59
"0600013N";"Lycée général et technologique Cassini";"HAUTS-DE-FRANCE";"dont apprentis";45;;;;;;
"0600015R";"Lycée d'enseignement général et technologique Mireille Grenet";"HAUTS-DE-FRANCE";"ensemble";43;56;51;5;58;62;69
"0600016S";"Lycée professionnel Mireille Grenet industriel - Lycée des métiers de l'innovation et des services";"HAUTS-DE-FRANCE";"ensemble";60;29;34;-5;37;35;42
"0600017T";"Lycée professionnel mixte M.Grenet";"HAUTS-DE-FRANCE";"ensemble";48;23;30;-7;34;40;52
"0600020W";"Lycée d'enseignement général et technologique Marie Curie";"HAUTS-DE-FRANCE";"ensemble";45;54;58;-4;55;54;59
"0600021X";"Lycée général et technologique Jules Uhry";"HAUTS-DE-FRANCE";"ensemble";34;51;55;-4;56;56;65
"0600040T";"Lycée d'enseignement général et technologique Jean Calvin";"HAUTS-DE-FRANCE";"ensemble";46;49;58;-9;53;56;58
"0600040T";"Lycée d'enseignement général et technologique Jean Calvin";"HAUTS-DE-FRANCE";"dont élèves en voie pro sco";45;50;58;-8;50;54;58
"0600040T";"Lycée d'enseignement général et technologique Jean Calvin";"HAUTS-DE-FRANCE";"dont apprentis";46;48;58;-9;55;58;58
"0600041U";"Lycée professionnel Charles de Bovelles - Lycée des métiers";"HAUTS-DE-FRANCE";"ensemble";40;28;30;-3;34;39;45
"0600048B";"Lycée professionnel Donation de Rothschild";"HAUTS-DE-FRANCE";"ensemble";53;38;38;0;42;49;48
"0600049C";"Lycée professionnel Amyot d'Inville - Lycée des métiers du BTP, de la vente et de la communication graphique";"HAUTS-DE-FRANCE";"ensemble";52;36;37;-1;42;49;52
"0600049C";"Lycée professionnel Amyot d'Inville - Lycée des métiers du BTP, de la vente et de la communication graphique";"HAUTS-DE-FRANCE";"dont élèves en voie pro sco";53;33;34;-1;39;48;50
"0600049C";"Lycée professionnel Amyot d'Inville - Lycée des métiers du BTP, de la vente et de la communication graphique";"HAUTS-DE-FRANCE";"dont apprentis";;;;;;;
"0600062S";"Lycée professionnel Marie Curie - Lycée des métiers de l'ingénierie des industries mécaniques, chimiques et biotechnologiques";"HAUTS-DE-FRANCE";"ensemble";52;54;48;6;50;48;57
"0600062S";"Lycée professionnel Marie Curie - Lycée des métiers de l'ingénierie des industries mécaniques, chimiques et biotechnologiques";"HAUTS-DE-FRANCE";"dont élèves en voie pro sco";61;38;35;3;35;34;46
"0600062S";"Lycée professionnel Marie Curie - Lycée des métiers de l'ingénierie des industries mécaniques, chimiques et biotechnologiques";"HAUTS-DE-FRANCE";"dont apprentis";27;78;68;11;74;70;74
"0600063T";"Lycée professionnel Jules Uhry";"HAUTS-DE-FRANCE";"ensemble";54;29;30;-1;45;42;38
"0600070A";"Etablissement régional d'enseignement adapté Joséphine Baker à Crevecoeur le Grand";"HAUTS-DE-FRANCE";"ensemble";49;17;17;0;12;17;12
"0601149Y";"Lycée général et technologique privé Saint Vincent";"HAUTS-DE-FRANCE";"ensemble";10;79;67;12;79;64;75
"0601162M";"Lycée professionnel privé St Vincent de Paul";"HAUTS-DE-FRANCE";"ensemble";50;28;31;-3;31;35;36
"0601164P";"Lycée professionnel privé Croiset";"HAUTS-DE-FRANCE";"ensemble";54;49;50;-1;54;59;54
"0601363F";"Lycée professionnel Robert Desnos";"HAUTS-DE-FRANCE";"ensemble";56;37;38;0;45;43;48
"0601363F";"Lycée professionnel Robert Desnos";"HAUTS-DE-FRANCE";"dont élèves en voie pro sco";60;29;33;-4;42;40;44
"0601363F";"Lycée professionnel Robert Desnos";"HAUTS-DE-FRANCE";"dont apprentis";;;;;;;
"0601470X";"Lycée professionnel Lavoisier - Lycée des métiers des services du numérique à la personne - de l'entreprise à l'innovation";"HAUTS-DE-FRANCE";"ensemble";41;41;36;6;41;44;47
"0601700X";"Lycée général et technologique privé Sevigné";"HAUTS-DE-FRANCE";"ensemble";23;48;57;-9;59;63;70
"0601701Y";"Lycée général et technologique privé Jean-paul II";"HAUTS-DE-FRANCE";"ensemble";35;59;52;6;61;61;67
"0601787S";"Lycée professionnel Roberval - Lycée des métiers";"HAUTS-DE-FRANCE";"ensemble";45;36;37;-1;42;44;48
